,item_name,url
532,ClimateRight by Cuddl DudsClimateRight by Cuddl Duds Women's Stretch Fleece Long Underwear Half Zip Thermal Top,https://www.walmart.com/ip/ClimateRight-by-Cuddl-Duds-Women-s-Stretch-Fleece-Long-Underwear-Half-Zip-Thermal-Top/363256841
533,ZXZYWomen Solid Color Asymmetric Neck Long Sleeve Knitted Sweater,https://www.walmart.com/ip/Women-Solid-Color-Asymmetric-Neck-Long-Sleeve-Knitted-Sweater/432789567
534,ClimateRight by Cuddl DudsClimateRight by Cuddl Duds Women's Stretch Fleece 2-Piece Long Underwear Top and Legging Thermal Set,https://www.walmart.com/ip/ClimateRight-by-Cuddl-Duds-Women-s-Stretch-Fleece-2-Piece-Long-Underwear-Top-and-Legging-Thermal-Set/682127656
535,"Fit for Me by Fruit of the LoomFit For Me Women's Breathable Cotton-Mesh Brief Underwear, 6 Pack",https://www.walmart.com/ip/Fit-for-Me-Women-s-Plus-Breathable-Cotton-Mesh-Brief-Underwear-6-Pack/527216756
536,MagicflyFamily Matching Christmas Pajamas Set Adult Women Men Kids Xmas Striped Nightwear Sleepwear Top&Bottom,https://www.walmart.com/ip/Family-Matching-Christmas-Pajamas-Set-Adult-Women-Men-Kids-Xmas-Striped-Nightwear-Sleepwear-Top-Bottom/363045663
537,Pink QueenWomen Loose Spring Long Sleeve Blouses Flannel Plaid Shirt,https://www.walmart.com/ip/Women-Loose-Spring-Long-Sleeve-Blouses-Flannel-Plaid-Shirt/423292171
538,No BoundariesNo Boundaries Juniors' Plus Sherpa Pullover,https://www.walmart.com/ip/No-Boundaries-Juniors-Plus-Sherpa-Pullover/310418849
539,"Fruit of the LoomFruit of the Loom Women's Heather Low-Rise Brief Panties, 6-Pack",https://www.walmart.com/ip/Fruit-of-the-Loom-Women-s-Heather-Low-Rise-Brief-Panties-6-Pack/512299624
540,"Fruit of the LoomFruit of the Loom Women's Anti-Gravity Wirefree Bra, Style FT663",https://www.walmart.com/ip/Fruit-of-the-Loom-Women-s-Anti-Gravity-Wirefree-Bra-Style-FT663/55909699
541,Just LoveJust Love Buffalo Plaid Plush Pajama Pant,https://www.walmart.com/ip/Plaid-Plush-Fleece-Pajama-Pant-Buffalo-Plaid-Red-X-Small/114084192
542,"ThermajaneThermajane Women's Ultra Soft Thermal Underwear Long Johns Set With Fleece Lined (X-Small, White)",https://www.walmart.com/ip/Thermajane-Women-s-Ultra-Soft-Thermal-Underwear-Long-Johns-Set-With-Fleece-Lined-X-Small-White/614291314
543,No BoundariesNo Boundaries Juniors Classic Skinny Jeans 4pk Value Bundle,https://www.walmart.com/co/No-Boundaries-Juniors-Classic-Skinny-Jeans-4pk-Value-Bundle/54891956
544,Athletic WorksAthletic Works Women's Capris with Side Pockets,https://www.walmart.com/ip/Athletic-Works-Women-s-Capris-with-Side-Pockets/638445175
545,Pink QueenWomen Long Sleeve Tunic Tops With Faux Suede Elbow Patches And Button,https://www.walmart.com/ip/Women-Long-Sleeve-Tunic-Tops-With-Faux-Suede-Elbow-Patches-And-Button/878540693
546,"AviaAvia Women's Flex Tech 7"" Bike Short",https://www.walmart.com/ip/Avia-Women-s-Active-Seamless-Bike-Shorts/935162291
547,"L'eggsL'eggs Everyday Knee Highs, 20 Pack",https://www.walmart.com/ip/L-eggs-Everyday-Knee-Highs-20-Pack/344138324
548,"Fruit of the LoomFruit of the Loom Women's Heather Brief, 6 Pack",https://www.walmart.com/ip/Fruit-of-the-Loom-Women-s-Heather-Brief-6-Pack/240394291
549,HanesHanes Sport Women's Cool DRI Performance T-Shirt,https://www.walmart.com/ip/Hanes-Sport-Women-s-Cool-DRI-Performance-T-Shirt/21001556
550,DearfoamsDF by Dearfoams Women's Terry Polka Dot Clog slippers,https://www.walmart.com/ip/DF-by-Dearfoams-Women-s-Terry-Polka-Dot-Clog-slippers/449142198
551,YogaliciousWomen's Active Nude tech High Rise Side Pocket Ankle,https://www.walmart.com/ip/Women-s-Active-Nude-tech-High-Rise-Side-Pocket-Ankle/353285610
552,"Fruit of the LoomFruit of the Loom Women's Assorted Cotton Brief Underwear, 6+3 Bonus Pack",https://www.walmart.com/ip/Fruit-of-the-Loom-Women-s-Assorted-Cotton-Brief-Underwear-6-3-Bonus-Pack/288227469
553,No BoundariesNo Boundaries Juniors' Paperbag Waist Mom Jeans,https://www.walmart.com/ip/No-Boundaries-Juniors-Paperbag-Waist-Mom-Jeans/399425348
554,"L'eggsHanes L'eggs Women's Everyday Knee Highs, 10 Pair",https://www.walmart.com/ip/Hanes-L-eggs-Women-s-Everyday-Knee-Highs-10-Pair/795082200
555,No BoundariesNo Boundaries Faux Sherpa Joggers,https://www.walmart.com/ip/No-Boundaries-Faux-Sherpa-Joggers/24268481
556,"Fruit of the LoomFruit of the Loom Women's Assorted Beyondsoft Bikini Underwear, 12 Pack",https://www.walmart.com/ip/Fruit-of-the-Loom-Women-s-Assorted-Beyondsoft-Bikini-Underwear-12-Pack/250886532
557,Sleep & CoSleep & Co Women's Plush Robe with Tie Belt,https://www.walmart.com/ip/Sleep-Co-Women-s-Plush-Robe-with-Tie-Belt/278081096
558,"CoachCoach New York Eau De Parfum Spray, Perfume for Women, 3 Oz",https://www.walmart.com/ip/Coach-New-York-Eau-De-Parfum-Spray-Perfume-for-Women-3-Oz/180011429
559,VonmayVONMAY Women's Slippers House Shoes Fuzzy Fluffy Clog Slip On Memory Foam Indoor Outdoor,https://www.walmart.com/ip/VONMAY-Women-s-Slippers-House-Shoes-Fuzzy-Fluffy-Clog-Slip-On-Memory-Foam-Indoor-Outdoor/896897206
560,"Jay Aimee DesignsPersonalized Sterling Silver or Gold Plated Nameplate Necklace with Beading and Rhodium, 18"" Silver Plated Figaro Chain",https://www.walmart.com/ip/Personalized-Sterling-Silver-or-14k-Gold-Plated-Nameplate-Necklace-with-Beading-and-Rhodium-18-Silver-Plated-Figaro-Chain/229877562
561,"Radiant by Vanity FairRadiant by Vanity Fair Womens Comfort Stretch Brief Panties, 3-Pack",https://www.walmart.com/ip/Radiant-by-Vanity-Fair-Women-s-Comfort-Stretch-Brief-Panties-3-Pack/105235008
562,Heart N CrushHeart N' Crush Women's Plus Size Long Sleeve V-Neck Dropped Shoulder Sweater with Metallic Detail,https://www.walmart.com/ip/Heart-N-Crush-Women-s-Plus-Size-Long-Sleeve-V-Neck-Dropped-Shoulder-Sweater-with-Metallic-Detail/199917877
563,Time and TruTime and Tru Women's Everyday Crew Neck Cardigan,https://www.walmart.com/ip/Time-and-Tru-Women-s-Everyday-Crew-Neck-Cardigan/553339182
564,Sofia VergaraSofia Jeans by Sofia Vergara Sofia Skinny Mid Rise Stretch Ankle Jean Women's,https://www.walmart.com/ip/Sofia-Jeans-by-Sofia-Vergara-Women-s-Skinny-Mid-Rise-Stretch-Ankle-Jeans-Short-Inseam/536007312
565,"Athletic WorksAthletic Works Girls 1/4 Zip Micro Polar Fleece Pullover, Sizes 4-18 & Plus",https://www.walmart.com/ip/Athletic-Works-Girls-1-4-Zip-Micro-Polar-Fleece-Pullover-Sizes-4-18-Plus/463041318
566,ClimateRight by Cuddl DudsClimateright by Cuddl Duds Women's and Women's Plus Plush Warmth Mock Neck Top,https://www.walmart.com/ip/ClimateRight-by-Cuddl-Duds-Women-s-Plush-Warmth-Long-Underwear-Mock-Neck-Thermal-Top-with-Mitten-Cuff/927292583
567,WonderWinkWonderWink Origins Women's Romeo Six Pocket Flare Leg Scrub Pant,https://www.walmart.com/ip/WonderWink-Origins-Women-s-Romeo-Six-Pocket-Flare-Leg-Scrub-Pant/21401113
568,"ScrubstarScrubstar Women's ""Christmas Party"" V-Neck Print Scrub Top",https://www.walmart.com/ip/Scrubstar-Women-s-Christmas-Party-V-Neck-Print-Scrub-Top/427847870
569,Fashion Brands Group654 Womens Nightgown Sleepwear Pajamas Woman Long Sleeve Sleep Dress Nightshirt Green XXL,https://www.walmart.com/ip/653-Womens-Nightgown-Sleepwear-Pajamas-Woman-Long-Sleeve-Sleep-Dress-Nightshirt-Purple-3X/531506087
570,MeihuidaFashion Women Sleepwear Cute Cotton Pajamas Set Short Sleeve Nightgown Summer,https://www.walmart.com/ip/Fashion-Women-Sleepwear-Cute-Cotton-Pajamas-Set-Short-Sleeve-Nightgown-Summer/926490062
571,CoogoWomen Front Cross Side Buckle Lace Wireless Seamless Sports Bra,https://www.walmart.com/ip/Women-Front-Cross-Side-Buckle-Lace-Wireless-Seamless-Sports-Bra/137685044
572,"Secret TreasuresSecret Treasures Women's Lace Thong Panties, 6-Pack",https://www.walmart.com/ip/Secret-Treasures-Women-s-Lace-Thong-Panties-6-Pack/575120101
573,Time and TruTime and Tru Women's Lettuce Rib Sweater,https://www.walmart.com/ip/Time-and-Tru-Women-s-Lettuce-Rib-Sweater/813076006
574,Dr. Scholl'sDr. Scholl's Women's Diabetic and Circulatory Advanced Relief Ankle Socks with Blister Guard 2 Pack,https://www.walmart.com/ip/Dr-Scholl-s-Women-s-Diabetic-and-Circulatory-Advanced-Relief-Ankle-Socks-with-Blister-Guard-2-Pack/255828673
575,"No BoundariesNo Boundaries Juniors' Long Sleeve V-Neck T-Shirt, 2 Pack",https://www.walmart.com/ip/No-Boundaries-Juniors-Long-Sleeve-V-Neck-T-Shirt-2-Pack/464656312
576,TeeHee SocksTeeHee Women's Fashion No Show Fun Socks 12 Pair Pack,https://www.walmart.com/ip/TeeHee-Women-s-Fashion-No-Show-Fun-Socks-12-Pair-Pack/630200888
577,"Just My SizeJust My Size Women's Plus Size Active Lifestyle Wirefree Bra, Style 1220",https://www.walmart.com/ip/Just-My-Size-Women-s-Plus-Size-Active-Lifestyle-Wirefree-Bra-Style-1220/5811752
578,"Radiant by Vanity FairRadiant by Vanity Fair Womens 2-Pack Seamless Smoothing Brief Panty, Style 3413274",https://www.walmart.com/ip/Radiant-by-Vanity-Fair-Women-s-2-Pack-Seamless-Smoothing-Brief-Panty-Style-3413274/818305243
579,Terra & SkyTerra & Sky Women's Plus Size Cowlneck Drop Shoulder Ribbed Top,https://www.walmart.com/ip/Terra-Sky-Women-s-Plus-Size-Cowlneck-Drop-Shoulder-Ribbed-Top/356449537
580,PajamaManiaPajamaMania Women's Fleece Pajama Pants,https://www.walmart.com/ip/PajamaMania-Women-s-Fleece-Pajama-Pants/348892100
581,"HanesWomen's SmoothTec ComfortFlex Fit Lace Wirefree Bra, Style G199",https://www.walmart.com/ip/Women-s-SmoothTec-ComfortFlex-Fit-Lace-Wirefree-Bra-Style-G199/49369775
582,Made by OliviaMade by Olivia Women's Open Front Long Sleeve Classic Knit Cardigan,https://www.walmart.com/ip/Made-by-Olivia-Women-s-Open-Front-Long-Sleeve-Classic-Knit-Cardigan/383381731
583,Athletic WorksAthletic Works Women's Active Repreve Racerback Tank 2-Pack,https://www.walmart.com/ip/Athletic-Works-Women-s-Active-Repreve-Racerback-Tank-2-Pack/442398782
584,360Air360Air Women's Active Crewneck Cool Tee,https://www.walmart.com/ip/360Air-Women-s-Active-Crewneck-Cool-Tee/614833021
585,HanesHanes Women's French Terry Bermuda Pocket Short,https://www.walmart.com/ip/Hanes-Women-s-French-Terry-Bermuda-Pocket-Short/47325033
586,"SleepytimePjsSleepytimePjs Holiday Family Matching Fleece Pajama, Red and Blue Plaid",https://www.walmart.com/ip/SleepytimePjs-Holiday-Family-Matching-Fleece-Pajama-Red-and-Blue-Plaid/225558259
587,Secret TreasuresSecret Treasures Women's Full Figure Seamless Wire-Free Bra,https://www.walmart.com/ip/Secret-Treasures-Women-s-Full-Figure-Seamless-Wire-Free-Bra/906418497
588,"Blissful Benefits by Warner'sBlissful Benefits by Warner's Women's No Muffin Top Tailored Hi-Cut Panties, 3-Pack",https://www.walmart.com/ip/Blissful-Benefits-by-Warner-s-Women-s-No-Muffin-Top-Tailored-Hi-Cut-Panties-3-Pack/166924102
589,Time and TruTime and Tru Women's Sleeveless Knit Dress,https://www.walmart.com/ip/Time-and-Tru-Women-s-Sleeveless-Knit-Dress/138482342
590,"Fruit of the LoomWomens Front Close Racerback Sport Bra, Style FT390, 2-Pack",https://www.walmart.com/ip/Womens-Front-Close-Racerback-Sport-Bra-Style-FT390-2-Pack/49405081
591,LeeLee Women's Plus Size Instantly Slims Relaxed Fit Straight Leg Jean With Tummy Slimming Panel,https://www.walmart.com/ip/Lee-Women-s-Plus-Size-Instantly-Slims-Relaxed-Fit-Straight-Leg-Jean-With-Tummy-Slimming-Panel/175686263
592,ClimateRight by Cuddl DudsClimateRight by Cuddl Duds Women's Stretch Fleece Warm Underwear Long sleeve Top,https://www.walmart.com/ip/ClimateRight-by-Cuddl-Duds-Women-s-Stretch-Fleece-Long-Underwear-Thermal-Top/423144831
593,WodstyleWomen's Long Sleeve Casual Hoodies Pullover Drawstring Sweatshirts,https://www.walmart.com/ip/Women-s-Long-Sleeve-Casual-Hoodies-Pullover-Drawstring-Sweatshirts/908052792
594,Niobe ClothingWomens Long Sleeve Cotton Mock Neck Turtleneck Top,https://www.walmart.com/ip/Womens-Long-Sleeve-Cotton-Mock-Neck-Turtleneck-Top/177865557
595,Secret TreasuresSecret Treasures Women's Luxe Push Up Bra,https://www.walmart.com/ip/Secret-Treasures-Women-s-Luxe-Push-Up-Bra/484786616
596,Athletic WorksAthletic Works Women's Athleisure 5-Stripe Crewneck Sweatshirt - Yellow/Orange/Red/Blue/Navy,https://www.walmart.com/ip/Athletic-Works-Women-s-Athleisure-5-Stripe-Crewneck-Sweatshirt-Yellow-Orange-Red-Blue-Navy/895849811
597,Free AssemblyFree Assembly Womens Half Zip Faux Sherpa Sweatshirt,https://www.walmart.com/ip/Free-Assembly-Women-s-Half-Zip-Faux-Sherpa-Sweatshirt/770660118
598,"Secret TreasuresSecret Treasures Maternity Sleep Bra, 2 Pack",https://www.walmart.com/ip/Secret-Treasures-Maternity-Sleep-Bra-2-Pack/649532929
599,Time and TruTime and Tru Women's Brushed Rib Crew T-Shirt,https://www.walmart.com/ip/Time-and-Tru-Women-s-Brushed-Rib-Crewneck-T-Shirt/859341473
600,"Hampton DirectHampton Direct Unisex Dickey Dickies, Mock Turtleneck Neck Gaiters, 4 Pack",https://www.walmart.com/ip/Hampton-Direct-Unisex-Dickey-Dickies-Mock-Turtleneck-Neck-Gaiters-4-Pack/504169273
601,HanesHanes ComfortSoft EcoSmart Women's Open Leg Fleece Sweatpants - O4629,https://www.walmart.com/ip/Hanes-ComfortSoft-EcoSmart-Women-s-Open-Leg-Fleece-Sweatpants-O4629/643371485
602,"MediPedsMediPeds Diabetic CoolMax Extra Wide Crew Socks, Large, 2 Pack",https://www.walmart.com/ip/MediPeds-Diabetic-CoolMax-Extra-Wide-Crew-Socks-Large-2-Pack/46629652
603,Debra WeitznerDebra Weitzner Womens Fuzzy Socks Non-skid Grip 6 Pairs Two Tone Pattern,https://www.walmart.com/ip/Debra-Weitzner-Womens-Fuzzy-Socks-Non-skid-Grip-6-Pairs-Two-Tone-Pattern/141041466
604,Terra & SkyTerra & Sky Women's Plus Size Tummy Control Pull On 4 Pocket Jean with Stretch,https://www.walmart.com/ip/Terra-Sky-Women-s-Plus-Size-Tummy-Control-Pull-On-4-Pocket-Jean-with-Stretch/142663794
605,CupidCupid Women's 2pk Light Shaping Brief With Panel,https://www.walmart.com/ip/Cupid-Women-s-Light-Control-Brief-Panty-with-Tummy-Panel-2-Pack/349506090
606,EverlastEverlast Womens No Show Athletic Ankle Socks (Pack of 7 pairs),https://www.walmart.com/ip/Everlast-Womens-No-Show-Athletic-Ankle-Socks-Pack-of-7-pairs/184788977
607,Just My SizeJust My Size Women's Plus Size Lightweight Split V-neck Tunic Top,https://www.walmart.com/ip/Just-My-Size-Women-s-Plus-Size-Lightweight-Split-V-neck-Tunic-Top/54828703
608,Essential BasicEssential Basic Women Value Pack Deal Cami Tanks Adjustable Spagetti Strap Many Colors - Small to 3XL,https://www.walmart.com/ip/Essential-Basic-Women-Value-Pack-Deal-Cami-Tanks-Adjustable-Spagetti-Strap-Many-Colors-Small-to-3XL/173363480
609,Holiday TimeMatching Family Christmas Pajamas Pet Oh Deer Union Suit,https://www.walmart.com/ip/Matching-Family-Christmas-Pajamas-Pet-Oh-Deer-Union-Suit/642743175
610,Time and TruTime and Tru Women's Mock Neck Hacci T-Shirt,https://www.walmart.com/ip/Time-and-Tru-Women-s-Mock-Neck-Hacci-T-Shirt/893652210
611,Rudolph the Red-Nosed ReindeerRudolph Women's and Women's Plus Velour Pajama Joggers,https://www.walmart.com/ip/Rudolph-Women-s-and-Women-s-Plus-Velour-Pajama-Joggers/676363324
612,No BoundariesNo Boundaries Juniors' Girlfriend Jeans,https://www.walmart.com/ip/No-Boundaries-Juniors-Girlfriend-Jeans/137599417
613,Terra & SkyTerra & Sky Women's Plus Size Super Soft Solid Jegging,https://www.walmart.com/ip/Terra-Sky-Women-s-Plus-Size-Super-Soft-Solid-Jeggings/508158812
614,COOGOOSexy Lace Bralette Solid Cross Side Buckle Bra Brassiere Wireless Push up Bras for Women,https://www.walmart.com/ip/Sexy-Lace-Bralette-Solid-Cross-Side-Buckle-Bra-Brassiere-Wireless-Push-up-Bras-for-Women/895634598
615,BellellaPlus Size Womens Fluffy Faux Fur Parka Jacket Coat Ladies Loose Button Pocket Teddy Bear Winter Warm Outwear Cardigan S-5XL,https://www.walmart.com/ip/Plus-Size-Womens-Fluffy-Faux-Fur-Parka-Jacket-Coat-Ladies-Loose-Button-Pocket-Teddy-Bear-Winter-Warm-Outwear-Cardigan-S-5XL/183564371
616,"Fit for Me by Fruit of the LoomFit for Me Women's Plus Assorted Heather Brief Underwear, 6+2 Bonus Pack",https://www.walmart.com/ip/Fit-for-Me-Women-s-Plus-Assorted-Heather-Brief-Underwear-6-2-Bonus-Pack/727810188
617,"HanesHanes Women's Comfort Cool Lightweight Super No-Show Socks, 6 pack",https://www.walmart.com/ip/Hanes-Women-s-Comfort-Cool-Lightweight-Super-No-Show-Socks-6-pack/338410736
618,Secret TreasuresSecret Treasures Essentials Women's Tie Dye Stripe Sleep Joggers,https://www.walmart.com/ip/Secret-Treasures-Essentials-Women-s-Tie-Dye-Stripe-Sleep-Joggers/625783104
619,"Secret TreasuresSecret Treasures Women's Thong Panties, 9-Pack",https://www.walmart.com/ip/Secret-Treasures-Women-s-Thong-Panties-9-Pack/831800551
620,SUNSIOMSUNSIOM Leg Warmer Women Warm Knee High Winter Knit Crochet Legging Boot Socks Slouch,https://www.walmart.com/ip/SUNSIOM-Leg-Warmer-Women-Warm-Knee-High-Winter-Knit-Crochet-Legging-Boot-Socks-Slouch/343033660
621,Isaac LievWomen's Turtle Cowl Neck Asymmetric Hem Wrap Sweater Coat with Button Details,https://www.walmart.com/ip/Women-s-Turtle-Cowl-Neck-Asymmetric-Hem-Wrap-Sweater-Coat-with-Button-Details/979039783
622,AviaWomen's Avia Performance Skinny Pant,https://www.walmart.com/ip/Women-s-Avia-Performance-Skinny-Pant/861684843
623,LelintaLELINTA Women Seamless Waist Training Tummy Cincher Corset Shaper Trainer Bustier Slim Waistline Body Shaper,https://www.walmart.com/ip/LELINTA-Women-Seamless-Waist-Training-Tummy-Cincher-Corset-Shaper-Trainer-Bustier-Slim-Waistline-Body-Shaper/473294962
624,CupidCupid Extra Firm High Waist Shaping Brief,https://www.walmart.com/ip/Cupid-Extra-Firm-High-Waist-Shaping-Brief/20931969
625,"Fruit of the LoomFruit Of The Loom Hc Ankle Comfort Socks, 6 Pair",https://www.walmart.com/ip/Fruit-of-the-Loom-Women-s-CoolZone-Cotton-Cushioned-Ankle-Socks-6-Pack/757394519
626,DoubljuDoublju Women's Lightweight Pocket Zip-Up Hoodie Jacket for Women with Plus Size,https://www.walmart.com/ip/Doublju-Women-s-Lightweight-Pocket-Zip-Up-Hoodie-Jacket-for-Women-with-Plus-Size/509406866
627,Attitude UnknownAttitude Unknown Women's Metallic Button Blazer,https://www.walmart.com/ip/Attitude-Unknown-Women-s-Metallic-Button-Blazer/115833157
628,"Fruit of the LoomFruit of the Loom Women's Plus Size Beyond Soft Cotton Unlined Underwire Bra, Style FT813",https://www.walmart.com/ip/Fruit-of-the-Loom-Women-s-Plus-Size-Beyond-Soft-Cotton-Unlined-Underwire-Bra-Style-FT813/837930393
629,BELLA+CANVASBella + Canvas - Women's The Favorite Tee,https://www.walmart.com/ip/Bella-Canvas-Women-s-The-Favorite-Tee/513009454
630,LeeLee Women's Relaxed Fit Straight Leg Jean,https://www.walmart.com/ip/Lee-Women-s-Relaxed-Fit-Straight-Leg-Jean/969892906
631,PeanutsWomen's and Women's Plus Plush PJ Set - Snoopy,https://www.walmart.com/ip/Women-s-and-Women-s-Plus-Plush-PJ-Set-Snoopy/934780881
632,"HanesHanes Women's Performance Cool No Show Sock, 6 Pack",https://www.walmart.com/ip/Hanes-Women-s-Performance-Cool-No-Show-Socks-6-pack/497886537
633,"Loving Moments by Leading LadyMaternity Loving Moments by Leading Lady Nursing Babydoll Tank with Full Sling 2 Pack, Style L317",https://www.walmart.com/ip/Maternity-Loving-Moments-by-Leading-Lady-Nursing-Babydoll-Tank-with-Full-Sling-2-Pack-Style-L317/45089910
634,LallcWomens Floral Tie Dye Long Sleeve Top Shorts Pajamas Lounge Wear Sleepwear,https://www.walmart.com/ip/Womens-Floral-Tie-Dye-Long-Sleeve-Top-Shorts-Pajamas-Lounge-Wear-Sleepwear/233765678
635,"Just LoveJust Love Printed Short Sleeve Oversized Nightgown (Blue - Unicorns and Rainbows, 3X)",https://www.walmart.com/ip/Just-Love-Printed-Short-Sleeve-Oversized-Nightgown-Blue-Unicorns-and-Rainbows-3X/773280279
636,Woman WithinWoman Within Plus Size Scoop Neck Three-quarter Sleeve Perfect Tunic,https://www.walmart.com/ip/Woman-Within-Plus-Size-Scoop-Neck-Three-quarter-Sleeve-Perfect-Tunic/371250301
637,ScoopScoop Sadie Heeled Hiker Boot (Women's),https://www.walmart.com/ip/Scoop-Women-s-Sadie-Heeled-Hiker-Boots/284965410
638,Secret TreasuresSecret Treasures Women's and Women's Plus Short Sleeve Lounge Sweatshirt,https://www.walmart.com/ip/Secret-Treasures-Women-s-and-Women-s-Plus-Short-Sleeve-Lounge-Sweatshirt/505742184
639,"Fruit of the LoomFruit of the Loom Women's Beyondsoft Low-Rise Brief Underwear, 6 Pack",https://www.walmart.com/ip/Fruit-of-the-Loom-Women-s-Beyondsoft-Low-Rise-Brief-Underwear-6-Pack/863706152
640,"GustaveGustaveDesign Family Christmas Pajamas Winter Family Matching Sleepwear Long Sleeve Cotton Blouse and Striped Bottoms Set Nightgown ""Kid, Size 9T""",https://www.walmart.com/ip/GustaveDesign-Family-Christmas-Pajamas-Winter-Family-Matching-Sleepwear-Long-Sleeve-Cotton-Blouse-and-Striped-Bottoms-Set-Nightgown-Kid-Size-9T/643299877
641,Ashford & BrooksAshford & Brooks Women's Flannel Plaid Long Sleeve Nightgown - Red Stewart - Medium,https://www.walmart.com/ip/Ashford-Brooks-Women-s-Flannel-Plaid-Long-Sleeve-Nightgown/623433465
642,FunceeFuncee 2Pcs Women activewear Tracksuit Hoodies Sweatshirt + Pant Set Lady Sportwear Suit Plus Size,https://www.walmart.com/ip/Funcee-2Pcs-Women-activewear-Tracksuit-Hoodies-Sweatshirt-Pant-Set-Lady-Sportwear-Suit-Plus-Size/394899782
643,Scorpio SolScorpio Sol Women's Athleisure Flare Crop Joggers,https://www.walmart.com/ip/Scorpio-Sol-Women-s-Athleisure-Flare-Crop-Joggers/971176139
644,SleepytimePjsSleepytimePJs Matching Family Christmas Pajama Sets,https://www.walmart.com/ip/SleepytimePJs-Matching-Family-Christmas-Pajama-Sets/968804646
645,"ScrubstarScrubstar Disney ""Olaf Flakes"" Women's V-Neck Print Scrub Top",https://www.walmart.com/ip/Scrubstar-Disney-Olaf-Flakes-Women-s-V-Neck-Print-Scrub-Top/641544693
646,WhatwearsInvisible Push up Strapless Bra Self Adhesive Backless Sticky Bra,https://www.walmart.com/ip/Invisible-Push-up-Strapless-Bra-Self-Adhesive-Backless-Sticky-Bra/204863040
647,"Smart & SexySmart & Sexy Women's Signature Lace Push-Up Bra, Style-85046",https://www.walmart.com/ip/Smart-Sexy-Women-s-Signature-Lace-Push-Up-Bra-Style-85046/55919496
648,HanesHanes Sport Women's Performance Fleece Pullover Hoodie,https://www.walmart.com/ip/Hanes-Sport-Women-s-Performance-Fleece-Pullover-Hoodie/54778730
649,"Smart & SexyWomen's Signature Lace Deep V Bralette, Style SA874",https://www.walmart.com/ip/Women-s-Signature-Lace-Deep-V-Bralette-Style-SA874/507331530
650,Silver LillySilver Lilly Hamburger Slippers - Plush Cheeseburger Slippers w/ Comfort Foam Support,https://www.walmart.com/ip/Silver-Lilly-Hamburger-Slippers-Plush-Cheeseburger-Slippers-w-Comfort-Foam-Support/507201485
651,Sofia VergaraSofia Jeans by Sofia Vergara Womens Rosa Curvy Ripped High-Rise Ankle Jeans,https://www.walmart.com/ip/Sofia-Jeans-by-Sofia-Vergara-Women-s-Rosa-Curvy-Ripped-High-Rise-Ankle-Jeans/727072967
652,Dr. Scholl'sDr. Scholl's Women's Advanced Relief Crew Socks with BlisterGuard 2 Pack,https://www.walmart.com/ip/Dr-Scholl-s-Women-s-Advanced-Relief-Crew-Socks-with-BlisterGuard-2-Pack/504664300
653,"Just My SizeJUST MY SIZE Women's Pure Comfort Lace Plus Size Bra (1271), Violet Splendor, 2X",https://www.walmart.com/ip/JUST-MY-SIZE-Women-s-Pure-Comfort-Lace-Plus-Size-Bra-1271-Violet-Splendor-2X/847277821
654,Wayren USAFamily Matching Christmas Pajamas Set Women Daddy Kids Sleepwear Nightwear,https://www.walmart.com/ip/Family-Matching-Christmas-Pajamas-Set-Women-Daddy-Kids-Sleepwear-Nightwear/387661204
655,Pink QueenWomen Christmas Sweatshirt Holiday Vacation Pullover Blouse Tops,https://www.walmart.com/ip/Women-Christmas-Sweatshirt-Holiday-Vacation-Pullover-Blouse-Tops/753658350
656,STARVNCSTARVNC Women Long Sleeve Boho Printing Colorblock Splice Tunic Top,https://www.walmart.com/ip/STARVNC-Women-Long-Sleeve-Boho-Printing-Colorblock-Splice-Tunic-Top/677400137
657,Signature by Levi Strauss & Co.Signature by Levi Strauss & Co Women's High-Rise Skinny Jeans,https://www.walmart.com/ip/Signature-by-Levi-Strauss-Co-Women-s-High-Rise-Skinny-Jeans/149597628
658,Isaac LievWomen Punk Skull Wings Printed Long Sleeve Hoodies Sweatshirt Sports Coats for Halloween,https://www.walmart.com/ip/Women-Punk-Skull-Wings-Printed-Long-Sleeve-Hoodies-Sweatshirt-Sports-Coats-for-Halloween/426081007
659,Collections Etc.Collections Etc Women's Long Sleeve Flannel Nightgown BLUE LARGE,https://www.walmart.com/ip/Collections-Etc-Women-s-Long-Sleeve-Flannel-Nightgown-BLUE-LARGE/758505515
660,No BoundariesNo Boundaries Juniors' Plus Balloon Sleeve Duster Cardigan,https://www.walmart.com/ip/No-Boundaries-Juniors-Plus-Balloon-Sleeve-Duster-Cardigan/735813759
661,"TopcobeCyber Monday Deals! Womens 2 Piece Outfits Long Sleeve Sweatshirt and Pants Clearance, Sports Joggers Sweatsuits Set Tracksuits for Women, Casual Pullover Hoodie Sweatpants Gift for Juniors, S-XL",https://www.walmart.com/ip/Cyber-Monday-Deals-Womens-2-Piece-Outfits-Long-Sleeve-Sweatshirt-Pants-Clearance-Sports-Joggers-Sweatsuits-Set-Tracksuits-Women-Casual-Pullover-Hoodi/913274897
662,Just LoveJust Love Womens Ultra-Soft Pajama Pant Set with Matching Fuzzy Socks,https://www.walmart.com/ip/Just-Love-Womens-Ultra-Soft-Pajama-Pant-Set-with-Matching-Fuzzy-Socks-Red-Black-Buffalo-Plaid-Large/976629762
663,LavaportLavaport 9 Colors Women's Plus Solid Color Round Collar Long Sleeves Sweater Blouse,https://www.walmart.com/ip/Lavaport-9-Colors-Women-s-Plus-Solid-Color-Round-Collar-Long-Sleeves-Sweater-Blouse/762493607
664,Pink QueenWomens Color Block Long Sleeve Solid Crew Neck Soft Pullovers Sweatshirt,https://www.walmart.com/ip/Womens-Color-Block-Long-Sleeve-Solid-Crew-Neck-Soft-Pullovers-Sweatshirt/799485414
665,"Athletic WorksAthletic Works Women's Plus Size Dri More 19"" Capri Legging",https://www.walmart.com/ip/Athletic-Works-Women-s-Plus-Size-Dri-More-19-Capri-Legging/557704034
666,"Time and TruTime and Tru Women's Cami Tank Top, 3 Pack Bundle",https://www.walmart.com/ip/Time-and-Tru-Women-s-Cami-Tank-Top-3-Pack-Bundle/275497325
667,Lilly PoshLilly Posh Women's Asymmetrical Snap Fleece Pullover Turtleneck with Special Oblique Neck,https://www.walmart.com/ip/Lilly-Posh-Women-s-Asymmetrical-Snap-Fleece-Pullover-Turtleneck-with-Special-Oblique-Neck/208399542
668,Just My SizeJust My Size Women's Plus Size Stretch Jersey Lace Trim Camisole,https://www.walmart.com/ip/Just-My-Size-Women-s-Plus-Size-Stretch-Jersey-Lace-Trim-Camisole/54828659
