,item_name,url
249,Secret TreasuresSecret Treasures Women's and Women's Plus Modern Midi Chemise,https://www.walmart.com/ip/Secret-Treasures-Women-s-and-Women-s-Plus-Modern-Midi-Sleepwear-Dress/519626358
250,"Smart & SexySmart & Sexy Womens Maximum Cleavage Bra, Style SA276",https://www.walmart.com/ip/Smart-Sexy-Womens-Maximum-Cleavage-Bra-Style-SA276/8205039
251,"Just My SizeJust My Size Women's Satin Stretch Wireless Bra, Style MJ1960",https://www.walmart.com/ip/Just-My-Size-Women-s-Satin-Stretch-Wireless-Bra-Style-MJ1960/880801
252,Dr. Scholl'sWomen's Diabetes and Circulatory Ankle Socks 4 Pair,https://www.walmart.com/ip/Women-s-Diabetes-and-Circulatory-Ankle-Socks-4-Pair/476859928
253,Sleep & CoSleep & Co Women's Plush Pajama Pants,https://www.walmart.com/ip/Sleep-Co-Women-s-Plush-Pajama-Pants/148030225
254,Just My SizeJust My Size Plus-Size Women's Long-Sleeve V-neck Tee,https://www.walmart.com/ip/Just-My-Size-Plus-Size-Women-s-Long-Sleeve-V-neck-Tee/173603282
255,The Cozy Corner ClubThe Cozy Corner Women's Long Sleeve Sherpa Top & Multi Color Fleece Plush Bottom Pajama Set,https://www.walmart.com/ip/The-Cozy-Corner-Women-s-Long-Sleeve-Sherpa-Top-Multi-Color-Fleece-Plush-Bottom-Pajama-Set/351193600
256,WodstyleWomen's Short Sleeve T Shirt Plus Size Tops Casual V Neck Tunic Loose Blouse,https://www.walmart.com/ip/Women-s-Short-Sleeve-T-Shirt-Plus-Size-Tops-Casual-V-Neck-Tunic-Loose-Blouse/656517084
257,Natural UniformsWOMENS SCRUB JACKET MANY COLORS SIZES XS-5XL FREE SHIPPING,https://www.walmart.com/ip/WOMENS-SCRUB-JACKET-MANY-COLORS-SIZES-XS-5XL-FREE-SHIPPING/822638145
258,HDEHDE Women's and Women's Plus Cotton Pajama Pants Wide Leg Sleepwear Casual Loose Lounge PJ Bottoms,https://www.walmart.com/ip/HDE-Women-s-and-Women-s-Plus-Cotton-Pajama-Pants-Wide-Leg-Sleepwear-Casual-Loose-Lounge-PJ-Bottoms/934210060
259,HanesHanes Women's X-Temp Tank Top,https://www.walmart.com/ip/Hanes-Women-s-X-Temp-Tank-Top/49455836
260,White MarkWhite Mark Women's Flannel Pajama Set - Extended Sizes,https://www.walmart.com/ip/White-Mark-Women-s-Flannel-Pajama-Set-Extended-Sizes/250244193
261,ChampionChampion Women's Classic Long Sleeve Tee,https://www.walmart.com/ip/Champion-Women-s-Classic-Long-Sleeve-Tee/121726240
262,"Radiant by Vanity FairRadiant by Vanity Fair Women's Full Figure Lightly Lined Smoothing Underwire Bra, Style 3476528",https://www.walmart.com/ip/Radiant-by-Vanity-Fair-Women-s-Full-Figure-Lightly-Lined-Smoothing-Underwire-Bra-Style-3476528/153125309
263,"Fruit of the LoomFruit Of The Loom Hc No Show Socks, 6 Pair",https://www.walmart.com/ip/Fruit-of-the-Loom-Women-s-CoolZone-Cotton-Cushioned-No-Show-Socks-6-Pack/156028922
264,Time and TruWomen's Open Front Cardigan,https://www.walmart.com/ip/Time-and-Tru-Women-s-Open-Front-Cardigan/726083299
265,NlifeWomen Solid Color Waterfall Neck Knitted Cardigan,https://www.walmart.com/ip/Women-Solid-Color-Waterfall-Neck-Knitted-Cardigan/889513711
266,"Secret TreasuresSecret Treasures Women's Cotton Stretch Brief Panties, 6 pack",https://www.walmart.com/ip/Secret-Treasures-Women-s-Cotton-Stretch-Brief-Panties-6-pack/684896764
267,Athletic WorksAthletic Works Women's Plus Size Fleece Sweatpants,https://www.walmart.com/ip/Athletic-Works-Women-s-Plus-Size-Fleece-Sweatpants/792549354
268,"HanesHanes Women's Nylon Brief Panties, 6-Pack, Assorted",https://www.walmart.com/ip/Hanes-Women-s-Nylon-Brief-Panties-6-Pack/38250127
269,HanesHanes Invisible Embrace Wire-Free Bra W561,https://www.walmart.com/ip/Hanes-Women-s-Signature-Invisible-Embrace-Wire-Free-Bra-W561/435462462
270,"Sleep & CoSleep & Co Women's and Women's Plus Plush Robe and Pajama Pants Set, 2-Piece",https://www.walmart.com/ip/Sleep-Co-Women-s-and-Women-s-Plus-Plush-Robe-and-Pajama-Pants-Set-2-Piece/241667319
271,SySeaSpecial Gradient Color Print T-shirt Plus Size Women Summer Tops,https://www.walmart.com/ip/Special-Gradient-Color-Print-T-shirt-Plus-Size-Women-Summer-Tops/185782284
272,Time and TruTime and Tru Women's Turtleneck T-Shirt,https://www.walmart.com/ip/Time-And-Tru-Women-s-Turtleneck-Top/310510173
273,"Fit for Me by Fruit of the LoomFit for Me Women's Plus Microfiber Slip Short Underwear, 4 Pack",https://www.walmart.com/ip/Fit-for-Me-Women-s-Plus-Microfiber-Slip-Short-Underwear-4-Pack/51739749
274,LallcWomen's Casual Faux Fur Hooded Coats Fleece Jackets Plus Size Outerwear,https://www.walmart.com/ip/Women-s-Casual-Faux-Fur-Hooded-Coats-Fleece-Jackets-Plus-Size-Outerwear/564735862
275,DearfoamsDF by Dearfoams Knit Clog Slippers (Women's),https://www.walmart.com/ip/DF-by-Dearfoams-Knit-Clog-Slippers-Women-s/513463300
276,"No BoundariesNo Boundaries Juniors' Sleeveless Mockneck Top, 2 Pack",https://www.walmart.com/ip/No-Boundaries-Juniors-Sleeveless-Mock-Neck-Top-2-Pack/158534206
277,Time and TruTime and Tru Women's Core Modern Mid Rise Straight Jeans,https://www.walmart.com/ip/Time-and-Tru-Women-s-Core-Modern-Mid-Rise-Straight-Jean/410395381
278,"MediPedsMediPeds Diabetic Supportive Compression Socks, Medium, 2 Pack",https://www.walmart.com/ip/MediPeds-Diabetic-Supportive-Compression-Socks-Medium-2-Pack/46629650
279,Gloria VanderbiltGloria Vanderbilt Women's Plus Size Mila Belted Skimmer Short,https://www.walmart.com/ip/Gloria-Vanderbilt-Women-s-Plus-Size-Mila-Belted-Skimmer-Short/823087407
280,HanesHanes Women's Stretch Cotton Cami With Built-In Shelf Bra,https://www.walmart.com/ip/Hanes-Women-s-Stretch-Cotton-Cami-With-Built-In-Shelf-Bra/55523799
281,"Fuzzy BabbaFuzzy Babba Slipper Socks, 2pk",https://www.walmart.com/ip/Fuzzy-Babba-Slipper-Socks-2pk/381202387
282,Kuda Moda5-Pack Fleece Lined Leggings for Women Winter Warm Thermal Full Length Leggings,https://www.walmart.com/ip/5-Pack-Fleece-Lined-Leggings-for-Women-Winter-Warm-Thermal-Full-Length-Leggings/985931196
283,"FeathersFeathers Women's Plus Size High-Waisted Cozy Fleece Lined Legging, 2-Pack Bundle",https://www.walmart.com/ip/Feathers-Women-s-Plus-Size-High-Waisted-Cozy-Fleece-Lined-Legging-2-Pack-Bundle/635587369
284,CupidCupid Light Control Brief with Shaping Panel - 4 Pack,https://www.walmart.com/ip/Cupid-Light-Control-Brief-with-Shaping-Panel-4-Pack/20931965
285,Athletic WorksAthletic Works Women's Athleisure 5-Stripe Sweatpants - Yellow/Orange/Red/Blue/Navy,https://www.walmart.com/ip/Athletic-Works-Women-s-Athleisure-5-Stripe-Sweatpants-Yellow-Orange-Red-Blue-Navy/632888363
286,Jolly JammiesMatching Family Christmas Pajamas Jolly Jammies Women's and Women's Plus Size Polar Bear 2-Piece Pajama Set,https://www.walmart.com/ip/Matching-Family-Christmas-Pajamas-Jolly-Jammies-Women-s-and-Women-s-Plus-Size-Polar-Bear-2-Piece-Pajama-Set/645476660
287,"Secret TreasuresSecret Treasures Women's Cozy Sock Liners, 3-Pack",https://www.walmart.com/ip/Secret-Treasures-Women-s-Cozy-Sock-Liners-3-Pack/826695119
288,HanesHanes Women's X-Temp w/ Fresh IQ Short Sleeve Pique Polo Shirt,https://www.walmart.com/ip/Hanes-Women-s-X-Temp-w-Fresh-IQ-Short-Sleeve-Pique-Polo-Shirt/55193344
289,ChampionChampion Women's Jersey Pants,https://www.walmart.com/ip/Champion-Women-s-Jersey-Pants/40224129
290,"French LaundryFrench Laundry Women's Plus Size Slimming Waffle Waistband Leggings, Full Length",https://www.walmart.com/ip/French-Laundry-Women-s-Plus-Size-Slimming-Waffle-Waistband-Leggings-Full-Length/236448700
291,Art TopArttop Plus Size Women Long Sleeve Lace Blouse Shirt Long Tunic Tops,https://www.walmart.com/ip/Arttop-Plus-Size-Women-Long-Sleeve-Lace-Blouse-Shirt-Long-Tunic-Tops/594459156
292,"HanesHanes Women's Cushioned Ankle Socks, 10 Pair",https://www.walmart.com/ip/Hanes-Women-s-Cushioned-Ankle-Socks-10-Pair/34581643
293,Secret TreasuresSecret Treasures Women's and Women's Plus Short Sleeve Pajama Top,https://www.walmart.com/ip/Secret-Treasures-Women-s-and-Women-s-Plus-Short-Sleeve-Pajama-Top/943313294
294,Sleep & CoSleep & Co Women's and Women's Plus Plush Robe with Tie Belt and Faux Sherpa Lining,https://www.walmart.com/ip/Sleep-Co-Women-s-and-Women-s-Plus-Plush-Robe-with-Tie-Belt-and-Faux-Sherpa-Lining/252279158
295,AviaAvia Women's Active Performance Black and White Stripe Leggings,https://www.walmart.com/ip/Avia-Women-s-Active-Performance-Striped-Leggings/614634959
296,No BoundariesNo Boundaries Juniors' High Rise Bootcut Jeans,https://www.walmart.com/ip/No-Boundaries-Juniors-High-Rise-Bootcut-Jeans/306158786
297,Lee RidersLee Riders Women's Plus Size Naudia Long Sleeve Super Cozy Fleece Lined Flannel Shirt,https://www.walmart.com/ip/Lee-Riders-Women-s-Plus-Size-Naudia-Long-Sleeve-Super-Cozy-Fleece-Lined-Flannel-Shirt/988820691
298,"Time and TruTime and Tru Women's Long-Sleeve Raglan T-Shirt, 2-Pack Bundle",https://www.walmart.com/ip/Time-and-Tru-Women-s-Long-Sleeve-Raglan-T-Shirt-2-Pack-Bundle/837216820
299,DearfoamsDF by Dearfoams Women's Textured Knit or Velour Clog slippers,https://www.walmart.com/ip/DF-by-Dearfoams-Women-s-Textured-Knit-or-Velour-Clog-slippers/551415411
300,STARVNCWomen Button Down Solid Color Cardigan,https://www.walmart.com/ip/Women-Button-Down-Solid-Color-Cardigan/496654618
301,GildanGildan Women Shirt Cotton Women Shirts Womens Value Shirts Best Womens Classic Short Sleeve T-shirt Blank All Color Black Shirts for Women White Shirt Grey Shirt,https://www.walmart.com/ip/Gildan-Women-Shirt-Cotton-Shirts-Womens-Value-Best-Classic-Short-Sleeve-T-shirt-Blank-All-Color-Black-White-Grey/312308983
302,"Wonder NationWonder Nation Girls Smooth Bra, 2 Pack Bralette (Little Girls & Big Girls)",https://www.walmart.com/ip/Wonder-Nation-Girls-4-18-Smooth-Bralette-2-Pack/172321828
303,MaidenformFlexees Women's Maidenform Cool Comfort Firm Romper,https://www.walmart.com/ip/Flexees-Women-s-Maidenform-Cool-Comfort-Firm-Romper/349333011
304,baozhuWomen Men Winter Warm Fleece Anti-Slip Slippers Indoor House Shoes Lovers Home Floor Slippers Shoes,https://www.walmart.com/ip/Women-Men-Winter-Warm-Fleece-Anti-Slip-Slippers-Indoor-House-Shoes-Lovers-Home-Floor-Slippers-Shoes/717409870
305,PlaytexPlaytex 18 Hour 4803 Silky Soft Smoothing Wirefree Bra,https://www.walmart.com/ip/Playtex-18-Hour-4803-Silky-Soft-Smoothing-Wirefree-Bra/40232654
306,"Peter Thomas Roth($52 Value) Peter Thomas Roth Water Drench Hyaluronic Cloud Cream Hydrating Face Moisturizer, 1.7 Oz",https://www.walmart.com/ip/52-Value-Peter-Thomas-Roth-Water-Drench-Hyaluronic-Cloud-Cream-Hydrating-Face-Moisturizer-1-7-Oz/776121591
307,No BoundariesNo Boundaries Juniors' Faux Sherpa Joggers with Side Stripes,https://www.walmart.com/ip/No-Boundaries-Juniors-Faux-Sherpa-Joggers-with-Side-Stripes/501015500
308,Terra & SkyWomen's Plus Size Terra & Sky Ponte Pant,https://www.walmart.com/ip/Terra-Sky-Women-s-Plus-Size-Comfort-Elastic-Waistband-Ponte-Pant/707292569
309,HanesHanes Women's Mini-Ribbed Cotton Tank Top,https://www.walmart.com/ip/Hanes-Women-s-Mini-Ribbed-Cotton-Tank-Top/55523803
310,"Fruit of the LoomWomens Shirred Front Sport Bra with Removable Bra Pads, Style FT438, 2-Pack",https://www.walmart.com/ip/Womens-Shirred-Front-Sport-Bra-with-Removable-Bra-Pads-Style-FT438-2-Pack/38547793
311,Oh! MammaMaternity Oh! Mamma Skinny Jeans with Full Panel - Available in Plus Sizes,https://www.walmart.com/ip/Maternity-Oh-Mamma-Skinny-Jeans-with-Full-Panel-Available-in-Plus-Sizes/41690237
312,Secret TreasuresSecret Treasures Women's and Women's Plus Faux Fur Trimmed Union Suit,https://www.walmart.com/ip/Secret-Treasures-Women-s-and-Women-s-Plus-Faux-Fur-Trimmed-Union-Suit/722205698
313,Signature by Levi Strauss & Co.Signature by Levi Strauss & Co. Women's Shaping Pull-On Super Skinny Jeans,https://www.walmart.com/ip/Signature-by-Levi-Strauss-Co-Women-s-Shaping-Pull-On-Super-Skinny-Jeans/215679968
314,Athletic WorksAthletic Works Women's Plus Size Core Knit Athleisure Sweatpants,https://www.walmart.com/ip/Athletic-Works-Women-s-Plus-Size-Core-Knit-Athleisure-Sweatpants/839245608
315,DearfoamsDF by Dearfoams Women's Chenille Clog Slippers,https://www.walmart.com/ip/DF-by-Dearfoams-Women-s-Chenille-Clog-Slippers/992487990
316,TeeHee SocksTeeHee Women's Ladies Value 6-Pack Crew Socks,https://www.walmart.com/ip/TeeHee-Women-s-Ladies-Value-6-Pack-Crew-Socks/148627156
317,HanesHanes Tagless Short Sleeve T-Shirt (Little Boys & Big Boys),https://www.walmart.com/ip/Hanes-Boys-4-18-Tagless-Short-Sleeve-T-Shirt/40264358
318,"Athletic WorksAthletic Works Women's Plus Size Dri More 28"" Ankle Legging",https://www.walmart.com/ip/Athletic-Works-Women-s-Plus-Size-Dri-More-28-Ankle-Legging/181094006
319,EVERBESTSALESLLCWomen Cute Cartoon Pajama Set Casual Comfy Loungewear Sleepwear,https://www.walmart.com/ip/Women-Cute-Cartoon-Pajama-Set-Casual-Comfy-Loungewear-Sleepwear/398820483
320,"Athletic WorksAthletic Works Women's Plus Size Dri More 22"" Core Capri",https://www.walmart.com/ip/Athletic-Works-Women-s-Plus-Size-Dri-More-22-Core-Capri/970344915
321,DoubljuDoublju Women's Fleece Zip-Up High Neck Jacket for Women with Plus Size,https://www.walmart.com/ip/Doublju-Women-s-Fleece-Zip-Up-High-Neck-Jacket-for-Women-with-Plus-Size/567405351
322,MeihuidaChristmas Family Matching Pajamas Set Adult Mens Womens Kids Sleepwear,https://www.walmart.com/ip/Christmas-Family-Matching-Pajamas-Set-Adult-Mens-Womens-Kids-Sleepwear/839410054
323,WodstyleWomen's Buttons Hooded Pockets Coat Outerwear Ladies Casual Plain Cardigan,https://www.walmart.com/ip/Women-s-Buttons-Hooded-Pockets-Coat-Outerwear-Ladies-Casual-Plain-Cardigan/970305441
324,EZIWomen's Cotton Sleeveless Nightgown By EZI,https://www.walmart.com/ip/Ezi-Womens-Cotton-Rich-Sleeveless-Nightgown/191673287
325,"Time and TruMaternity Time and Tru Legging with Full Panel, 2 Pack (Available in Multiple Colors)",https://www.walmart.com/ip/Time-and-Tru-Maternity-Leggings-with-Full-Panel-2-Pack/486645328
326,No BoundariesNo Boundaries Juniors' Button Front Mossy Cardigan with Balloon Sleeves,https://www.walmart.com/ip/No-Boundaries-Juniors-Button-Front-Mossy-Cardigan-with-Balloon-Sleeves/390449703
327,Terra & SkyTerra & Sky Women's Plus Size Solid Denim Jegging 2 Pack Bundle,https://www.walmart.com/ip/Terra-Sky-Women-s-Plus-Size-Solid-Denim-Jeggings-2-Pack-Bundle/267765636
328,NlifeWomen's Round Neck Checked Long Sleeve Sequin Pocket Sweatshirt,https://www.walmart.com/ip/Women-s-Round-Neck-Checked-Long-Sleeve-Sequin-Pocket-Sweatshirt/822507167
329,Wayren USAChristmas Xmas Family Matching Set Pajamas Sleepwear Nightwear Kids Adult Deer Plaid Pyjamas,https://www.walmart.com/ip/Christmas-Xmas-Family-Matching-Set-Pajamas-Sleepwear-Nightwear-Kids-Adult-Deer-Plaid-Pyjamas/960420065
330,"OPIOPI Nail Polish, Nudes/Neutrals",https://www.walmart.com/ip/OPI-Nail-Polish-Samoan-Sand-0-5-Fl-Oz/34202609
331,HanesHanes Women's Cotton Wear-Around Crew Neck T-shirt,https://www.walmart.com/ip/Hanes-Women-s-Cotton-Wear-Around-Crew-Neck-T-shirt/51745392
332,"Time and TruTime and Tru Women's Essential Short Sleeve Crewneck T-Shirt, 2 Pk Bundle",https://www.walmart.com/ip/Time-and-Tru-Women-s-Essential-Short-Sleeve-Crewneck-T-Shirt-2-Pk-Bundle/657479968
333,"HanesHanes Women's Cotton Bikini Panties, 6-Pack",https://www.walmart.com/ip/Hanes-Women-s-Cotton-Bikini-Panties-6-Pack/896095
334,STARVNCWomen Asymmetric Hem Long Sleeve Solid Color Hooded Sweatshirt,https://www.walmart.com/ip/Women-Asymmetric-Hem-Long-Sleeve-Solid-Color-Hooded-Sweatshirt/222121012
335,"Secret TreasuresSecret Treasures Women's Cotton Stretch String Bikini Panties, 6-Pack",https://www.walmart.com/ip/Secret-Treasures-Women-s-Cotton-Stretch-String-Bikini-Panties-6-Pack/574077296
336,"ULTRAIDEASWomen's Soft Yarn Cable Knitted Slippers Memory Foam Anti-Skid Sole House Shoes w/Faux Fur Collar, Indoor & Outdoor, Size 5-6 US Men, Navy Blue",https://www.walmart.com/ip/Women-s-Soft-Yarn-Cable-Knitted-Slippers-Memory-Foam-Anti-Skid-Sole-House-Shoes-w-Faux-Fur-Collar-Indoor-Outdoor-Size-5-6-US-Men-Navy-Blue/881521469
337,No BoundariesNo Boundaries Juniors' Sherpa Lined Hoodie,https://www.walmart.com/ip/No-Boundaries-Juniors-Sherpa-Lined-Hoodie/788118357
338,PajamaManiaPajamaMania Women's Cotton Flannel Long Sleeve Pajamas,https://www.walmart.com/ip/PajamaMania-Women-s-Cotton-Flannel-Long-Sleeve-Pajamas/815195256
339,Terra & SkyTerra & Sky Women's Plus Size Crewneck Graphic T-Shirt with Short Sleeves,https://www.walmart.com/ip/Terra-Sky-Women-s-Plus-Size-Crewneck-Graphic-T-Shirt-with-Short-Sleeves/130073488
340,Time and TruTime and Tru Rain Boot (Women's) (Wide Width Available),https://www.walmart.com/ip/Time-and-Tru-Rain-Boot-Women-s-Wide-Width-Available/203517922
341,"HanesHanes X-Temp Wire-Free Convertible Straps Bra, Style G507",https://www.walmart.com/ip/Hanes-X-Temp-Wire-Free-Convertible-Straps-Bra-Style-G507/49369831
342,VonmayVONMAY Women's Slippers House Shoes Fleece Fuzzy Plush Lining Comfort Memory Foam Slip On Clog Coral Indoor/Outdoor,https://www.walmart.com/ip/VONMAY-Women-s-Slippers-House-Shoes-Fleece-Fuzzy-Plush-Lining-Comfort-Memory-Foam-Slip-On-Clog-Coral-Indoor-Outdoor/627997082
343,Lee RidersLee Riders Women's Waist Smoother Straight Leg Jean,https://www.walmart.com/ip/Lee-Riders-Women-s-Waist-Smoother-Straight-Leg-Jean/37425065
344,TeeHee SocksTeeHee Christmas Holiday Cozy Fuzzy Crew Socks 3-Pack for Women (Santa and Stripes),https://www.walmart.com/ip/TeeHee-Christmas-Holiday-Cozy-Fuzzy-Crew-Socks-3-Pack-for-Women-Santa-and-Stripes/248088345
345,Earth SpiritEARTH SPIRIT WOMEN'S LORI SLIPPER,https://www.walmart.com/ip/Earth-Spirit-Women-s-Lori-Slipper/476815391
346,Time and TruTime and Tru Women's Striped Turtleneck Sweater,https://www.walmart.com/ip/Time-and-Tru-Women-s-Striped-Turtleneck-Sweater/425573783
347,PudcocoPudcoco 24Pcs Christmas Tree Xmas Balls Decorations Baubles Party Ornament,https://www.walmart.com/ip/Pudcoco-24Pcs-Christmas-Tree-Xmas-Balls-Decorations-Baubles-Party-Ornament/136874335
348,No BoundariesNo Boundaries Juniors' Scoop Tank 3 Pack,https://www.walmart.com/ip/No-Boundaries-Juniors-Scoop-Neck-Tank-3-Pack/720437759
349,Time and TruTime and Tru Women's V-Neck Hacci T-Shirt,https://www.walmart.com/ip/Time-and-Tru-Women-s-V-Neck-Hacci-T-Shirt/452892547
350,"Just My SizeJust My Size Women's Plus Size Pure Comfort Seamless Wirefree Bra, Style MJ1263",https://www.walmart.com/ip/Just-My-Size-Women-s-Plus-Size-Pure-Comfort-Seamless-Wirefree-Bra-Style-MJ1263/43585793
351,Mark AlanMark Alan Women's Midi Puffer Coat with Hood,https://www.walmart.com/ip/Mark-Alan-Women-s-Midi-Puffer-Coat-with-Hood/737653476
352,"ComfortWashHanes Men's and Big Men's ComfortWash Tank, Up To Size 3XL",https://www.walmart.com/ip/Hanes-Men-s-and-Big-Men-s-ComfortWash-Tank-Up-To-Size-3XL/259171037
353,SnoopySnoopy Women's and Women's Plus Plush Pajama Joggers,https://www.walmart.com/ip/Snoopy-Women-s-and-Women-s-Plus-Plush-Pajama-Joggers/741108286
354,CalsunbabyWomen Slim Casual Blazer Jacket Top Outwear Long Sleeve Career Formal Long Coat,https://www.walmart.com/ip/Women-Slim-Casual-Blazer-Jacket-Top-Outwear-Long-Sleeve-Career-Formal-Long-Coat/589325878
355,Time and TruTime and Tru Women's Sleeveless Knit Dress,https://www.walmart.com/ip/Time-and-Tru-Women-s-Sleeveless-Knit-Dress/501246333
356,MultitrustFashion Women Flannel Plaid Long Sleeve Shirts Loose Cardigan Blouse Jacket Tops,https://www.walmart.com/ip/Fashion-Women-Flannel-Plaid-Long-Sleeve-Shirts-Loose-Cardigan-Blouse-Jacket-Tops/688708468
357,HanesHanes Women's X-temp Short Sleeve V-neck T-Shirt,https://www.walmart.com/ip/Hanes-Women-s-X-temp-Short-Sleeve-V-neck-T-Shirt/40822648
358,"No BoundariesNo Boundaries Juniors' Everyday Long Sleeve T-Shirt, 3 Pack",https://www.walmart.com/ip/No-Boundaries-Juniors-Everyday-Long-Sleeve-T-Shirt-3-Pack/761752807
359,DoubljuDoublju Women's Thermal Henley Long Sleeve Top with Plus Size,https://www.walmart.com/ip/Doublju-Women-s-Thermal-Henley-Long-Sleeve-Top-with-Plus-Size/384289540
360,Terra & SkyTerra & Sky Women's Plus Size Denim Pull on Skinny Jeans,https://www.walmart.com/ip/Terra-Sky-Women-s-Plus-Size-Denim-Pull-on-Skinny-Jeans/431955992
361,"Extreme FitExtreme Fit Knee High Sport 6-Pair Sport Compression Socks for Men and Women, S-M",https://www.walmart.com/ip/Extreme-Fit-Knee-High-Sport-6-Pair-Sport-Compression-Socks-for-Men-and-Women-S-M/251088672
362,Athletic WorksAthletic Works Women's Plus Size Soft Fleece Jogger Sweatpants,https://www.walmart.com/ip/Athletic-Works-Women-s-Plus-Size-Soft-Fleece-Jogger-Sweatpants/334123741
363,Time and TruTime and Tru Snake Twin Gore Slip On (Women's) (Wide Width Available),https://www.walmart.com/ip/Time-and-Tru-Snake-Twin-Gore-Slip-On-Women-s-Wide-Width-Available/883955802
364,SySeaWomen Long Sleeve Hallmark Christmas Movies Baseball T-Shirt,https://www.walmart.com/ip/Women-Long-Sleeve-Hallmark-Christmas-Movies-Baseball-T-Shirt/406114253
365,KORSISWomens Henley Shirts V Neck Long Sleeve Button Down Tops Warm Waffle Knit Tees,https://www.walmart.com/ip/Womens-Henley-Shirts-V-Neck-Long-Sleeve-Button-Down-Tops-Warm-Waffle-Knit-Tees/903598390
366,"Radiant by Vanity FairRadiant by Vanity Fair Women's Invisible Edge Smoothing Slip Short, Style 3412385",https://www.walmart.com/ip/Radiant-by-Vanity-Fair-Women-s-Invisible-Edge-Smoothing-Slip-Short-Style-3412385/975489618
367,XhtangWomen Winter Coat Printed Hooded Pockets Warm Fleece Floral Button Coat Jacket,https://www.walmart.com/ip/Women-Winter-Coat-Printed-Hooded-Pockets-Warm-Fleece-Floral-Button-Coat-Jacket/203956518
368,Isaac LievWomen's Lace Long Sleeve Tunic Tops Shirt Clothing Scoop Neck Womens Plus Size Tunic Blouses Tops,https://www.walmart.com/ip/Women-s-Lace-Long-Sleeve-Tunic-Tops-Shirt-Clothing-Scoop-Neck-Womens-Plus-Size-Tunic-Blouses-Tops/613670567
369,SySeaGradient Color Women Autumn Fashion Hoodies Tops,https://www.walmart.com/ip/Gradient-Color-Women-Autumn-Fashion-Hoodies-Tops/292479972
370,No BoundariesNo Boundaries Juniors' Everyday Long Sleeve T-Shirt 2 Pack,https://www.walmart.com/ip/No-Boundaries-Juniors-Everyday-Long-Sleeve-T-Shirts-2-Pack/126063122
371,KORSISWomen Yoga Leggings Fitness Pants Gym Fitness Sports Comfy Trousers with Pocket,https://www.walmart.com/ip/Women-Yoga-Leggings-Fitness-Pants-Gym-Fitness-Sports-Comfy-Trousers-with-Pocket/814612190
372,Secret TreasuresSecret Treasures Women's and Women's Plus Pajama Jogger,https://www.walmart.com/ip/Secret-Treasures-Women-s-and-Women-s-Plus-Pajama-Jogger/747600342
373,HiMONEChristmas Children Adult Family Matching Family Pajamas Sets Sleepwear Outfit Dad Mum Kids Printing Xmas Gifts Family PJs Matching Set Plaid Pants+Top 2pcs Letter Print,https://www.walmart.com/ip/Christmas-Children-Adult-Family-Matching-Pajamas-Sets-Sleepwear-Outfit-Dad-Mum-Kids-Printing-Xmas-Gifts-PJs-Set-Plaid-Pants-Top-2pcs-Letter-Print/221962559
374,Treehouse KnitsTreehouse Knit (2 Pack) Womens Thick Knit Sherpa Fleece Slipper Socks Grippers,https://www.walmart.com/ip/Treehouse-Knit-2-Pack-Womens-Thick-Knit-Sherpa-Fleece-Slipper-Socks-Grippers/264278418
375,HUBERYWomen Long Sleeve Floral Print Drawstring Hoodie with Pocket,https://www.walmart.com/ip/Women-Long-Sleeve-Floral-Print-Drawstring-Hoodie-with-Pocket/873832097
376,MagicflyChristmas Family Pajamas Set Matching Xmas Adult Parents Kids Sleepwear Christmas Costume Nightwear,https://www.walmart.com/ip/Christmas-Family-Pajamas-Set-Matching-Xmas-Adult-Parents-Kids-Sleepwear-Christmas-Costume-Nightwear/807757851
377,Time and TruTime and Tru Women's Plus Size Essential Everyday Lightweight Turtleneck Sweater,https://www.walmart.com/ip/Time-and-Tru-Women-s-Plus-Size-Essential-Everyday-Lightweight-Turtleneck-Sweater/355843349
378,Just My SizeJust My Size Women's Plus Size Stretch Jersey Capri Legging,https://www.walmart.com/ip/Just-My-Size-Women-s-Plus-Size-Stretch-Jersey-Capri-Legging/47575600
379,LallcWomen's Casual Plus Size Baggy Floral Hooded Sweatshirts Pullover Loose Tops,https://www.walmart.com/ip/Women-s-Casual-Plus-Size-Baggy-Floral-Hooded-Sweatshirts-Pullover-Loose-Tops/863721847
380,HUBERYWomen Solid Color V Neck Short Sleeve Button Sleepwear Set,https://www.walmart.com/ip/Women-Solid-Color-V-Neck-Short-Sleeve-Button-Sleepwear-Set/911793624
381,Muk LuksMuk Luks Womens Fleece Cozy Shortie Robe,https://www.walmart.com/ip/Muk-Luks-Women-s-Fleece-Cozy-Shortie-Robe/822006288
382,AviaAvia Women's Athleisure Long Sleeve Soft T-Shirt,https://www.walmart.com/ip/Avia-Women-s-Athleisure-Long-Sleeve-Soft-T-Shirt/874012843
383,UKAPCasual Dandelion Print Longline Shirt for Women Plus Size Long Sleeve Floral Tunic Top Pullover Tee Shirts Blouse S-XXXXXL,https://www.walmart.com/ip/Casual-Dandelion-Print-Longline-Shirt-for-Women-Plus-Size-Long-Sleeve-Floral-Tunic-Top-Pullover-Tee-Shirts-Blouse-S-XXXXXL/650835329
384,MedgearMedgear 12-Pocket Women's Scrub Set with Silver Snap Detail & Contrast Trim,https://www.walmart.com/ip/Medgear-12-Pocket-Women-s-Scrub-Set-with-Silver-Snap-Detail-Contrast-Trim/571364833
385,Terra & SkyTerra & Sky Women's Plus Size Tiered Dress with Short Sleeves,https://www.walmart.com/ip/Terra-Sky-Women-s-Plus-Size-Tiered-Dress-with-Short-Sleeves/315559252
386,MaidenformMaidenform Flexees Cool Comfort Firm Wirefree Camisole,https://www.walmart.com/ip/Maidenform-Flexees-Cool-Comfort-Firm-Wirefree-Camisole/702210634
387,HanesHanes Sport Women's Cool DRI Performance Long-Sleeve V-Neck Tee,https://www.walmart.com/ip/Hanes-Sport-Women-s-Cool-DRI-Performance-Long-Sleeve-V-Neck-Tee/54778846
388,PopvclyNew Leggings Jeans for Womens Denim Pants Slim Jeggings Fitness Plus Size Leggings S-XXXL Blue,https://www.walmart.com/ip/New-Leggings-Jeans-for-Womens-Denim-Pants-Slim-Jeggings-Fitness-Plus-Size-Leggings-S-XXXL-Black-nbsp/984276036
389,No BoundariesNo Boundaries Juniors' Christmas Ankle Legging 2-Pack,https://www.walmart.com/ip/No-Boundaries-Juniors-Christmas-Ankle-Leggings-2-Pack/846465208
390,"HanesJust My Size Womens Plus Size comfort shaping jacquard wire free bra, style 1Q20",https://www.walmart.com/ip/Just-My-Size-Womens-Plus-Size-comfort-shaping-jacquard-wire-free-bra-style-1Q20/195851029
