,item_name,url
0,The Pioneer WomanSneak Peek Today! The Pioneer Woman Women's 3/4 Sleeve Blouson Top,https://www.walmart.com/ip/The-Pioneer-Woman-Women-s-3-4-Sleeve-Blouson-Top-Sneak-Peek-Today/722729582
1,Time and TruTime and Tru Women's Packable Puffer Jacket with Hood,https://www.walmart.com/ip/Time-and-Tru-Women-s-Packable-Puffer-Jacket-with-Hood/825507263
2,Lee RidersLee Riders Women's Waist Smoother Straight Leg Jean,https://www.walmart.com/ip/Lee-Riders-Women-s-Waist-Smoother-Straight-Leg-Jean/37425065?wpa_bd=&wpa_pg_seller_id=F55CDC31AB754BB68FE0B39041159D63&wpa_ref_id=wpaqs:uOaAWYxt0_X2fxZ3w2yY0v0ZjxGZ-WrdlsTlDopDHYALplYgcLmFSq1q-5BqecwVgQSJ6odAn4kKNkJmVifRIFHDpy1n9xEgpcE6wo0bCHYgHldMEzthgaTFRK7WcdvR3aFZCMVRxXNGYPCn89XFvYQSmDkbynHk_BA4tQNg8LEmFsk_pL_M72O1cAFiUKYMlNjY_3WoYkVJIUxhnI3EXQ&wpa_tag=&wpa_aux_info=&wpa_pos=3&wpa_plmt=1145x1145_T-C-IG_TI_1-6_HL-INGRID-GRID-NY&wpa_aduid=1d3fee14-37b3-4316-a57d-c75eea7087fa&wpa_pg=browse&wpa_pg_id=5438_133162&wpa_st=Womens%2BClothing&wpa_tax=5438_133162&wpa_bucket=__bkt__
3,Woman WithinWoman Within Women's Plus Size Zip-Front Microfleece Jacket Fleece,https://www.walmart.com/ip/Woman-Within-Women-s-Plus-Size-Zip-Front-Microfleece-Jacket-Fleece/207861250?wpa_bd=&wpa_pg_seller_id=3352D180A65149CDA2AD7D6BCAF4DC64&wpa_ref_id=wpaqs:PRVPMmECL3mbS9crm-Dz_u2_4x1m39VnwDqkne_ekxlkyoQ4d_ZfGqxpO1ZNTlXSLVtNm3oaZtIGxSCM-WfmH0vXb7ddc7as38hNzAmVHo19KAr2o7j9hkJKpfsKQrn4itDTx4Hk3-mn9BV2fxygtzyyGE4IlMkxWePGignKlrysomzqMIMtrtLP0qB5DXeHzvutgEcxFvKSYet36H1sSQ&wpa_tag=&wpa_aux_info=&wpa_pos=4&wpa_plmt=1145x1145_T-C-IG_TI_1-6_HL-INGRID-GRID-NY&wpa_aduid=1d3fee14-37b3-4316-a57d-c75eea7087fa&wpa_pg=browse&wpa_pg_id=5438_133162&wpa_st=Womens%2BClothing&wpa_tax=5438_133162&wpa_bucket=__bkt__
4,DreamersDreamers by Debut Women's Leopard Print Cardigan,https://www.walmart.com/ip/Dreamers-by-Debut-Women-s-Leopard-Print-Cardigan/164919279
5,Time and TruTime and Tru Women's Crewneck Sweatshirt,https://www.walmart.com/ip/Time-and-Tru-Women-s-Crewneck-Sweatshirt/777380698
6,Athletic WorksAthletic Works Women's Athleisure Soft Jogger Sweatpants,https://www.walmart.com/ip/Athletic-Works-Women-s-Athleisure-Soft-Joggers-Sweatpants/838355958
7,Time and TruTime and Tru Women's Stretch Knit Jeggings,https://www.walmart.com/ip/Time-and-Tru-Women-s-Stretch-Knit-Jeggings/830992448
8,Time and TruTime and Tru Women's Plaid Button Front Shirt,https://www.walmart.com/ip/Time-and-Tru-Women-s-Plaid-Button-Front-Shirt/868212920
9,Free AssemblyFree Assembly Womens Turtleneck Sweater,https://www.walmart.com/ip/Free-Assembly-Women-s-Ultra-Soft-Turtleneck-Sweater/372189663
10,C. WonderC. Wonder Womens T- Shirt With Gold Buttons,https://www.walmart.com/ip/C-Wonder-Women-s-T-Shirt-With-Gold-Buttons/603188474
11,C. WonderC. Wonder Women's Long Sleeve Printed Midi Wrap Dress,https://www.walmart.com/ip/C-Wonder-Women-s-Long-Sleeve-Printed-Midi-Wrap-Dress/947819558?wpa_bd=&wpa_pg_seller_id=F55CDC31AB754BB68FE0B39041159D63&wpa_ref_id=wpaqs:Qf9_I7Hk-XGIv1ry9j2ouUfdHcQZAXTcCnvRzutCo3pIYPgQAsp6jmUmkwzZFwGZ9YYJoTUwhNTE3zkULQJUA6XpudYsjKYZOYSRCp4zXCkfYGp23VifY1Hif9Ry2suP3aFZCMVRxXNGYPCn89XFvYQSmDkbynHk_BA4tQNg8LEW5_4WfuvR2BX-FAkPG5kQlNjY_3WoYkVJIUxhnI3EXQ&wpa_tag=&wpa_aux_info=&wpa_pos=12&wpa_plmt=1145x1145_T-C-IG_TI_1-6_HL-INGRID-GRID-NY&wpa_aduid=1d3fee14-37b3-4316-a57d-c75eea7087fa&wpa_pg=browse&wpa_pg_id=5438_133162&wpa_st=Womens%2BClothing&wpa_tax=5438_133162&wpa_bucket=__bkt__
12,ScoopScoop Women's Cozy Funnel Neck Tunic Sweater,https://www.walmart.com/ip/Scoop-Women-s-Cozy-Funnel-Neck-Tunic-Sweater/353663113
13,"Time and TruTime and Tru Women's Thermal T-Shirt, 2 Pack Bundle",https://www.walmart.com/ip/Time-and-Tru-Women-s-Thermal-T-Shirt-2-Pack-Bundle/200427684
14,"Blissful Benefits by Warner'sBlissful Benefits by Warner's Women's Easy Size Underarm Smoothing Seamless Wire-Free Bra, Style RM3911W",https://www.walmart.com/ip/Blissful-Benefits-by-Warner-s-Women-s-Easy-Size-Underarm-Smoothing-Seamless-Wire-Free-Bra/146243433?wpa_bd=&wpa_pg_seller_id=F55CDC31AB754BB68FE0B39041159D63&wpa_ref_id=wpaqs:c1vn0GiWFLNSa2GzXpDAzRFnMsbvGAf5njhRbqPq0VVIYPgQAsp6jmUmkwzZFwGZ9YYJoTUwhNTE3zkULQJUAyXOIe47LQWJKOwIspXS2w0rnC5WKk2YWs__s9nNOEYG3aFZCMVRxXNGYPCn89XFvYQSmDkbynHk_BA4tQNg8LEmFsk_pL_M72O1cAFiUKYMlNjY_3WoYkVJIUxhnI3EXQ&wpa_tag=&wpa_aux_info=&wpa_pos=15&wpa_plmt=1145x1145_T-C-IG_TI_1-6_HL-INGRID-GRID-NY&wpa_aduid=1d3fee14-37b3-4316-a57d-c75eea7087fa&wpa_pg=browse&wpa_pg_id=5438_133162&wpa_st=Womens%2BClothing&wpa_tax=5438_133162&wpa_bucket=__bkt__
15,Lee RidersLee Riders Women's Classic Fit Jean,https://www.walmart.com/ip/Lee-Riders-Women-s-Classic-Fit-Jean/37424917
16,Heart N CrushHeart N' Crush Women's Plus Size Long Sleeve V-Neck Dropped Shoulder Sweater with Metallic Detail,https://www.walmart.com/ip/Heart-N-Crush-Women-s-Plus-Size-Long-Sleeve-V-Neck-Dropped-Shoulder-Sweater-with-Metallic-Detail/199917877
17,A3 DenimA3 Denim Women's Plus Sized Destructed Skinny Jeans,https://www.walmart.com/ip/A3-Denim-Women-s-Plus-Sized-Destructed-Skinny-Jeans/55975150
18,Ma CroixMa Croix Womens Premium Soft Fleece Sweatpants Yoga Joggers with Ribbed Cuffs,https://www.walmart.com/ip/Ma-Croix-Womens-Premium-Soft-Fleece-Sweatpants-Yoga-Joggers-with-Ribbed-Cuffs/335835222
19,PajamaManiaPajamaMania Women's Cotton Flannel Long Sleeve Pajamas,https://www.walmart.com/ip/PajamaMania-Women-s-Cotton-Flannel-Long-Sleeve-Pajamas/815195256
20,The Cozy Corner ClubBlue Star Clothing Women's 3/4 Length Textured Plush Robe,https://www.walmart.com/ip/Blue-Star-Clothing-Women-s-3-4-Length-Textured-Plush-Robe/216749364
21,DreamersDreamers by Debut Women's Leopard Print Sweater,https://www.walmart.com/ip/Dreamers-by-Debut-Women-s-Leopard-Print-Sweater/988898535
22,Plain StudiosPlain Studios Women's Ramones Short Sleeve Graphic Tee,https://www.walmart.com/ip/Plain-Studios-Women-s-Ramones-Short-Sleeve-Graphic-Tee/497194387
23,C. WonderC. Wonder Womens Tie Sleeve Blouse,https://www.walmart.com/ip/C-Wonder-Women-s-Tie-Sleeve-Blouse/733307032
24,No BoundariesNo Boundaries Juniors Yoga Pants,https://www.walmart.com/ip/No-Boundaries-Juniors-Yoga-Pants/725300499
25,"Eye CandyEye Candy Juniors' Chevron Hoodie and Joggers Loungewear Set, 2-Piece",https://www.walmart.com/ip/Eye-Candy-Juniors-Chevron-Hoodie-and-Joggers-Loungewear-Set-2-Piece/779763664
26,Mark AlanMark Alan Women's Plus Size Single Breasted Faux Sherpa Coat,https://www.walmart.com/ip/Mark-Alan-Women-s-Plus-Size-Single-Breasted-Faux-Sherpa-Coat/424829855
27,C. WonderC. Wonder Women's Long Sleeve Self Tie Wrap Dress,https://www.walmart.com/ip/C-Wonder-Women-s-Long-Sleeve-Self-Tie-Wrap-Dress/909007992?wpa_bd=&wpa_pg_seller_id=F55CDC31AB754BB68FE0B39041159D63&wpa_ref_id=wpaqs:Qf9_I7Hk-XGIv1ry9j2ouUfdHcQZAXTcCnvRzutCo3pIYPgQAsp6jmUmkwzZFwGZ9YYJoTUwhNTE3zkULQJUAzDX21aInC5ZWl3gJOY2MlBO83jxPkQjSL8UTGx8iUKb3aFZCMVRxXNGYPCn89XFvYQSmDkbynHk_BA4tQNg8LEmFsk_pL_M72O1cAFiUKYMlNjY_3WoYkVJIUxhnI3EXQ&wpa_tag=&wpa_aux_info=&wpa_pos=28&wpa_plmt=1145x1145_T-C-IG_TI_1-6_HL-INGRID-GRID-NY&wpa_aduid=1d3fee14-37b3-4316-a57d-c75eea7087fa&wpa_pg=browse&wpa_pg_id=5438_133162&wpa_st=Womens%2BClothing&wpa_tax=5438_133162&wpa_bucket=__bkt__
28,C. WonderC. Wonder Women's Color Block Cardigan,https://www.walmart.com/ip/C-Wonder-Women-s-Color-Block-Cardigan/681216623?wpa_bd=&wpa_pg_seller_id=F55CDC31AB754BB68FE0B39041159D63&wpa_ref_id=wpaqs:Qf9_I7Hk-XGIv1ry9j2ouUfdHcQZAXTcCnvRzutCo3pIYPgQAsp6jmUmkwzZFwGZ9YYJoTUwhNTE3zkULQJUA6vDi3LrkoIqHdS9RyzAX9DgP2kbGMzHwt9LKmzX-4J13aFZCMVRxXNGYPCn89XFvYQSmDkbynHk_BA4tQNg8LEmFsk_pL_M72O1cAFiUKYMlNjY_3WoYkVJIUxhnI3EXQ&wpa_tag=&wpa_aux_info=&wpa_pos=29&wpa_plmt=1145x1145_T-C-IG_TI_1-6_HL-INGRID-GRID-NY&wpa_aduid=1d3fee14-37b3-4316-a57d-c75eea7087fa&wpa_pg=browse&wpa_pg_id=5438_133162&wpa_st=Womens%2BClothing&wpa_tax=5438_133162&wpa_bucket=__bkt__
29,Terra & SkyTerra & Sky Women's Plus Size Destructed Denim Jegging,https://www.walmart.com/ip/Terra-Sky-Women-s-Plus-Size-Destructed-Denim-Jegging/443816274
30,ELOQUII ElementsELOQUII Elements Women's Plus Size Tie Waist Tunic Sweater,https://www.walmart.com/ip/ELOQUII-Elements-Women-s-Plus-Size-Tie-Waist-Tunic-Sweater/440839531
31,Free AssemblyFree Assembly Womens Super-Soft Mock Neck Sweater,https://www.walmart.com/ip/Free-Assembly-Women-s-Super-Soft-Mock-Neck-Sweater/148157099
32,"Secret TreasuresSecret Treasures Women's and Women's Plus Hacci Long Sleeve Top and Joggers, 2-Piece Pajama Set",https://www.walmart.com/ip/Secret-Treasures-Women-s-and-Women-s-Plus-Hacci-Long-Sleeve-Top-and-Joggers-2-Piece-Pajama-Set/100075169
33,C. WonderC. Wonder Women's Short Sleeve Fit & Flare Dress,https://www.walmart.com/ip/C-Wonder-Women-s-Short-Sleeve-Fit-Flare-Dress/771695460
34,Natural UniformsWOMENS LONG SLEEVE T SHIRT WITH SUPER-SOFT STRETCH FABRIC,https://www.walmart.com/ip/WOMENS-LONG-SLEEVE-T-SHIRT-WITH-SUPER-SOFT-STRETCH-FABRIC/957706945
35,Eddie BauerEddie Bauer Women's Luna Peak Down Parka,https://www.walmart.com/ip/Eddie-Bauer-Women-s-Luna-Peak-Down-Parka/160733785
36,No BoundariesNo Boundaries Juniors' Mom Jeans,https://www.walmart.com/ip/No-Boundaries-Juniors-Mom-Jeans/986905901
37,No BoundariesNo Boundaries Juniors' Plus Sherpa Pullover,https://www.walmart.com/ip/No-Boundaries-Juniors-Plus-Sherpa-Pullover/310418849
38,C. WonderC. Wonder Womens Sleeveless Wrap Top,https://www.walmart.com/ip/C-Wonder-Women-s-Sleeveless-Wrap-Top/475139878
39,Time and TruTime and Tru Women's Hacci Crewneck Pullover,https://www.walmart.com/ip/Time-and-Tru-Women-s-Hacci-Crewneck-Pullover/824285351
40,C. WonderC. Wonder Women's Long Sleeve Printed Midi Wrap Dress,https://www.walmart.com/ip/C-Wonder-Women-s-Long-Sleeve-Printed-Midi-Wrap-Dress/947819558?wpa_bd=&wpa_pg_seller_id=F55CDC31AB754BB68FE0B39041159D63&wpa_ref_id=wpaqs:Qf9_I7Hk-XGIv1ry9j2ouUfdHcQZAXTcCnvRzutCo3pIYPgQAsp6jmUmkwzZFwGZ9YYJoTUwhNTE3zkULQJUA6XpudYsjKYZOYSRCp4zXCkfYGp23VifY1Hif9Ry2suP3aFZCMVRxXNGYPCn89XFvYQSmDkbynHk_BA4tQNg8LETRJ1GiNirVl7gXC1mJGWXlNjY_3WoYkVJIUxhnI3EXQ&wpa_tag=&wpa_aux_info=&wpa_pos=1&wpa_plmt=1145x1145_T-C-IG_TI_1-6_HL-INGRID-GRID-NY&wpa_aduid=9efe9376-8716-46f1-9b7b-9c03736c687b&wpa_pg=browse&wpa_pg_id=5438_133162&wpa_st=__searchterms__&wpa_tax=5438_133162&wpa_bucket=__bkt__
41,"Just My SizeJust My Size Women's Plus Size Pull on Stretch Woven Pants, Also in Petite",https://www.walmart.com/ip/Just-My-Size-Women-s-Plus-Size-Pull-on-Stretch-Woven-Pants-Also-in-Petite/728022053
42,HanesHanes Women's Long-Sleeve Crewneck Tee,https://www.walmart.com/ip/Hanes-Women-s-Long-Sleeve-Crewneck-Tee/162832714
43,Lee RidersLee Riders Women's Long Sleeve Button Up Fleece Shirt,https://www.walmart.com/ip/Lee-Riders-Women-s-Long-Sleeve-Button-Up-Fleece-Shirt/328640134
44,DickiesDickies Relaxed Fit Cargo Pant,https://www.walmart.com/ip/Dickies-Relaxed-Fit-Cargo-Pant/35850661
45,C. WonderC. Wonder Women's Color Block Cardigan,https://www.walmart.com/ip/C-Wonder-Women-s-Color-Block-Cardigan/681216623
46,C. WonderC. Wonder Women's Long Sleeve Self Tie Wrap Top,https://www.walmart.com/ip/C-Wonder-Women-s-Long-Sleeve-Self-Tie-Wrap-Top/508139601
47,ZXZYWomen Colorblock Plaid Elbow Patch Long Sleeves Cardigan,https://www.walmart.com/ip/Women-Colorblock-Plaid-Elbow-Patch-Long-Sleeves-Cardigan/639449266
48,"Blissful Benefits by Warner'sBlissful Benefits by Warner's Women's Easy Size Underarm Smoothing Seamless Wire-Free Bra, Style RM3911W",https://www.walmart.com/ip/Blissful-Benefits-by-Warner-s-Women-s-Easy-Size-Underarm-Smoothing-Seamless-Wire-Free-Bra/146243433?wpa_bd=&wpa_pg_seller_id=F55CDC31AB754BB68FE0B39041159D63&wpa_ref_id=wpaqs:c1vn0GiWFLNSa2GzXpDAzRFnMsbvGAf5njhRbqPq0VVIYPgQAsp6jmUmkwzZFwGZ9YYJoTUwhNTE3zkULQJUAyXOIe47LQWJKOwIspXS2w0rnC5WKk2YWs__s9nNOEYG3aFZCMVRxXNGYPCn89XFvYQSmDkbynHk_BA4tQNg8LH4MzQHLt3y3sVZ7JZeXDCVlNjY_3WoYkVJIUxhnI3EXQ&wpa_tag=&wpa_aux_info=&wpa_pos=9&wpa_plmt=1145x1145_T-C-IG_TI_1-6_HL-INGRID-GRID-NY&wpa_aduid=9efe9376-8716-46f1-9b7b-9c03736c687b&wpa_pg=browse&wpa_pg_id=5438_133162&wpa_st=__searchterms__&wpa_tax=5438_133162&wpa_bucket=__bkt__
49,C. WonderC. Wonder Women's Sleeveless Blouse,https://www.walmart.com/ip/C-Wonder-Women-s-Sleeveless-Blouse/935777376
50,AviaAvia Flex Tech 7/8ths Length Legging,https://www.walmart.com/ip/Avia-Flex-Tech-7-8ths-Length-Leggings/369716961
51,C. WonderC. Wonder Women's Long Sleeve Self Tie Wrap Dress,https://www.walmart.com/ip/C-Wonder-Women-s-Long-Sleeve-Self-Tie-Wrap-Dress/909007992?wpa_bd=&wpa_pg_seller_id=F55CDC31AB754BB68FE0B39041159D63&wpa_ref_id=wpaqs:Qf9_I7Hk-XGIv1ry9j2ouUfdHcQZAXTcCnvRzutCo3pIYPgQAsp6jmUmkwzZFwGZ9YYJoTUwhNTE3zkULQJUAzDX21aInC5ZWl3gJOY2MlBO83jxPkQjSL8UTGx8iUKb3aFZCMVRxXNGYPCn89XFvYQSmDkbynHk_BA4tQNg8LH4MzQHLt3y3sVZ7JZeXDCVlNjY_3WoYkVJIUxhnI3EXQ&wpa_tag=&wpa_aux_info=&wpa_pos=12&wpa_plmt=1145x1145_T-C-IG_TI_1-6_HL-INGRID-GRID-NY&wpa_aduid=9efe9376-8716-46f1-9b7b-9c03736c687b&wpa_pg=browse&wpa_pg_id=5438_133162&wpa_st=__searchterms__&wpa_tax=5438_133162&wpa_bucket=__bkt__
52,No BoundariesNo Boundaries Juniors' 3-Button Corset Jeans,https://www.walmart.com/ip/No-Boundaries-Juniors-3-Button-Corset-Jeans/635776277
53,Pink RosePink Rose Juniors Double Stitch Sweater,https://www.walmart.com/ip/Pink-Rose-Juniors-Double-Stitch-Sweater/199552738
54,Pink RosePink Rose Women's Juniors Lux Cardigan Sweater,https://www.walmart.com/ip/Pink-Rose-Women-s-Juniors-Lux-Cardigan-Sweater/705514763
55,Secret TreasuresSecret Treasures Women's and Women's Plus 2-piece Velour Top and Jogger Set,https://www.walmart.com/ip/Secret-Treasures-Women-s-and-Women-s-Plus-2-piece-Velour-Top-and-Jogger-Set/750427215
56,ClimateRight by Cuddl DudsClimateRight by Cuddl Duds Women's Stretch Fleece Warm Underwear Long sleeve Top,https://www.walmart.com/ip/ClimateRight-by-Cuddl-Duds-Women-s-Stretch-Fleece-Long-Underwear-Thermal-Top/423144831
57,ClimateRight by Cuddl DudsClimateRight by Cuddl Duds Women's and Women's Plus Stretch Fleece High Waisted Thermal Long Underwear Legging,https://www.walmart.com/ip/ClimateRight-by-Cuddl-Duds-Women-s-Stretch-Fleece-High-Waisted-Long-Underwear-Thermal-Legging/625785298
58,Swiss TechSwiss Tech Women's Bibbed Solarball Puffer Coat with Faux Fur Trimmed Hood,https://www.walmart.com/ip/Swiss-Tech-Women-s-Bibbed-Solarball-Puffer-Coat-with-Faux-Fur-Trimmed-Hood/488673656
59,Big ChillBig Chill Women's Heavy Coated Anorak With Fur Hood,https://www.walmart.com/ip/Big-Chill-Women-s-Heavy-Coated-Anorak-With-Fur-Hood/520435633
60,Treehouse KnitsTreehouse Knit (2 Pack) Womens Thick Knit Sherpa Fleece Slipper Socks Grippers,https://www.walmart.com/ip/Treehouse-Knit-2-Pack-Womens-Thick-Knit-Sherpa-Fleece-Slipper-Socks-Grippers/264278418
61,No BoundariesNo Boundaries Juniors' classic skinny jeans,https://www.walmart.com/ip/No-Boundaries-Juniors-classic-skinny-jeans/44108251
62,Lush ClothingLush Clothing Cozy Long Sweater Cardigan,https://www.walmart.com/ip/Lush-Clothing-Cozy-Long-Sweater-Cardigan/816335081
63,Gray by Grayson SocialGray by Grayson Social Women's Holiday Short Sleeve Graphic T-Shirt,https://www.walmart.com/ip/Gray-by-Grayson-Social-Women-s-Holiday-Short-Sleeve-Graphic-T-Shirt/169355117
64,Lush ClothingLush Clothing Mock Neck Top,https://www.walmart.com/ip/Lush-Clothing-Mock-Neck-Top/778011642
65,"Celebrity PinkCelebrity Pink High Rise Ankle Skinny 27""",https://www.walmart.com/ip/Celebrity-Pink-High-Rise-Ankle-Skinny-27/295089155
66,Big ChillBig Chill Women's Faux Memory Chevron Quilted Maxi Coat with Faux Fur Hood,https://www.walmart.com/ip/Big-Chill-Women-s-Faux-Memory-Chevron-Quilted-Maxi-Coat-with-Faux-Fur-Hood/940106300
67,Como BluComo Blu Women's Athleisure Sweatpants,https://www.walmart.com/ip/Como-Blu-Women-s-Athleisure-Sweatpants/878196763
68,COMFORT COLORSComfort Colors Women's Athleisure Short Sleeve Tee,https://www.walmart.com/ip/Comfort-Colors-Women-s-Athleisure-Short-Sleeve-Tee/969143113
69,GEORGEMaternity George Legging Full Panel (2pk),https://www.walmart.com/ip/George-Women-s-Maternity-Leggings-2-Pack/537697188
70,C. WonderC. Wonder Women's Collared Button Front Dress With Self Tie,https://www.walmart.com/ip/C-Wonder-Women-s-Collared-Button-Front-Dress-With-Self-Tie/813992863?wpa_bd=&wpa_pg_seller_id=F55CDC31AB754BB68FE0B39041159D63&wpa_ref_id=wpaqs:Qf9_I7Hk-XGIv1ry9j2ouUfdHcQZAXTcCnvRzutCo3pIYPgQAsp6jmUmkwzZFwGZ9YYJoTUwhNTE3zkULQJUA01R3qLHwFFm9Ar0RmGEyxt4JZd6O9W_9kvRGZjHLaDt3aFZCMVRxXNGYPCn89XFvYQSmDkbynHk_BA4tQNg8LETRJ1GiNirVl7gXC1mJGWXlNjY_3WoYkVJIUxhnI3EXQ&wpa_tag=&wpa_aux_info=&wpa_pos=31&wpa_plmt=1145x1145_T-C-IG_TI_1-6_HL-INGRID-GRID-NY&wpa_aduid=9efe9376-8716-46f1-9b7b-9c03736c687b&wpa_pg=browse&wpa_pg_id=5438_133162&wpa_st=__searchterms__&wpa_tax=5438_133162&wpa_bucket=__bkt__
71,"Time and TruTime and Tru Womens Maternity Basic's Box Bundle, 4-Piece",https://www.walmart.com/ip/Time-and-Tru-Women-s-Maternity-Basic-s-Box-Bundle-4-Piece/338866710
72,ClimateRight by Cuddl DudsClimateRight by Cuddl Duds Women's Velour 2-Piece Long Underwear Top and Legging Thermal Set,https://www.walmart.com/ip/ClimateRight-by-Cuddl-Duds-Women-s-Velour-2-Piece-Long-Underwear-Top-and-Legging-Thermal-Set/636233383
73,PajamaManiaPajamaMania Women's Fleece Robe,https://www.walmart.com/ip/PajamaMania-Women-s-Fleece-Robe/886521042
74,"Dr. Scholl'sDr. Scholl's Women's Diabetes and Circulatory Crew Socks, 4pk",https://www.walmart.com/ip/Women-s-Diabetes-and-Circulatory-Crew-Socks-4-Pair/715239901?wpa_bd=&wpa_pg_seller_id=F55CDC31AB754BB68FE0B39041159D63&wpa_ref_id=wpaqs:yxo4VFhnFtbSS1PO7Iz5mSUho3NYnrCajfn8ckfyyIxIYPgQAsp6jmUmkwzZFwGZ9YYJoTUwhNTE3zkULQJUA6GgqAmtOPgVd5VpOMsVAlFa8I2U_12Q8A6iQPQXPOBM3aFZCMVRxXNGYPCn89XFvYQSmDkbynHk_BA4tQNg8LH4MzQHLt3y3sVZ7JZeXDCVlNjY_3WoYkVJIUxhnI3EXQ&wpa_tag=&wpa_aux_info=&wpa_pos=35&wpa_plmt=1145x1145_T-C-IG_TI_1-6_HL-INGRID-GRID-NY&wpa_aduid=9efe9376-8716-46f1-9b7b-9c03736c687b&wpa_pg=browse&wpa_pg_id=5438_133162&wpa_st=__searchterms__&wpa_tax=5438_133162&wpa_bucket=__bkt__
75,NlifeWomen Solid Color Waterfall Neck Knitted Cardigan,https://www.walmart.com/ip/Women-Solid-Color-Waterfall-Neck-Knitted-Cardigan/889513711
76,Free AssemblyFree Assembly Womens Original 90's Straight Leg Jeans,https://www.walmart.com/ip/Free-Assembly-Women-s-Original-90-s-Straight-Leg-Jeans/260658066
77,Free AssemblyFree Assembly Cocoon Coat Women's,https://www.walmart.com/ip/Free-Assembly-Women-s-Cocoon-Coat/366367844
78,Free AssemblyFree Assembly Women's Lightweight Turtleneck Sweater Dress,https://www.walmart.com/ip/Free-Assembly-Women-s-Lightweight-Turtleneck-Sweater-Dress/539222866
79,PajamaManiaPajamaMania Women's Flannel Pajama PJ Pants,https://www.walmart.com/ip/PajamaMania-Women-s-Cotton-Flannel-Pajama-PJ-Pants/811283033
80,C. WonderC. Wonder Women's Collared Button Front Dress With Self Tie,https://www.walmart.com/ip/C-Wonder-Women-s-Collared-Button-Front-Dress-With-Self-Tie/813992863
81,Athletic WorksAthletic Works Women's Athleisure Plush Hoodie,https://www.walmart.com/ip/Athletic-Works-Women-s-Athleisure-Plush-Hoodie/789953012
82,PaviliaPremium Women Fleece Robe with Satin Trim | Luxurious Super Soft Plush Bathrobe,https://www.walmart.com/ip/Premium-Women-Fleece-Robe-with-Satin-Trim-Luxurious-Super-Soft-Plush-Bathrobe/496177228
83,"Dr. Scholl'sDr. Scholl's Women's Diabetes and Circulatory Crew Socks, 4pk",https://www.walmart.com/ip/Women-s-Diabetes-and-Circulatory-Crew-Socks-4-Pair/715239901
84,ScoopScoop Women's Balloon Sleeve Crewneck Sweater,https://www.walmart.com/ip/Scoop-Women-s-Balloon-Sleeve-Crewneck-Sweater/492760093
85,Time and TruTime and Tru Women's Shawl Collar Cardigan Sweater,https://www.walmart.com/ip/Time-and-Tru-Women-s-Shawl-Collar-Cardigan-Sweater/144180063
86,ScoopScoop Womens Cropped Balloon Sleeve Sweater,https://www.walmart.com/ip/Scoop-Women-s-Cropped-Balloon-Sleeve-Sweater/701308581
87,NlifeNlife Women Long Sleeve Lace Up V Neck Top,https://www.walmart.com/ip/Nlife-Women-Long-Sleeve-Lace-Up-V-Neck-Top/265324061?wpa_bd=&wpa_pg_seller_id=4EEA0FEB9AC046928C26E69D9D99A79C&wpa_ref_id=wpaqs:e_tarXvWU32Mpti0_h_GTIuh7oy6IxP0FA5hzZ714A-G75PojSZyUxJcdFrdh68Kbr2_t1MKy1g7V2s5Cbr1ohsum3Bt1wTMNmCgdkiyGrnJWF5Ty-rFJVrfLbEQazg45x5SHyOI0e4tHrIAU7mCX0tawHkG_M4OQbQfNt5hzkc46NEQeu0iA9IAdJw0lAuV4t1OCtD9WKsGqRyfP49k9w&wpa_tag=&wpa_aux_info=&wpa_pos=8&wpa_plmt=1145x1145_T-C-IG_TI_1-6_HL-INGRID-GRID-NY&wpa_aduid=eaa2a513-ba3f-4754-801a-4a03827f5c1d&wpa_pg=browse&wpa_pg_id=5438_133162&wpa_st=Womens%2BClothing&wpa_tax=5438_133162&wpa_bucket=__bkt__
88,Lush ClothingLush Clothing Women's Mock Neck Balloon Sleeve Sweater,https://www.walmart.com/ip/Lush-Clothing-Women-s-Mock-Neck-Balloon-Sleeve-Sweater/581292858
89,Lush ClothingLush Clothing Women's Long Sleeve Brushed Cowl Neck Tunic,https://www.walmart.com/ip/Lush-Clothing-Long-Sleeve-Brushed-Cowl-Neck-Tunic/622289012
90,Lush ClothingLush Clothing Women's Long Sleeve Crewneck Sweater,https://www.walmart.com/ip/Lush-Clothing-Women-s-Long-Sleeve-Crewneck-Sweater/146886667
91,Lush ClothingLush Clothing Women's Long Sleeve Sweater V-Neck,https://www.walmart.com/ip/Lush-Clothing-Women-s-Long-Sleeve-Sweater-V-Neck/223768635
92,Lush ClothingLush Clothing Star Pattern Hooded Sweater,https://www.walmart.com/ip/Lush-Clothing-Star-Pattern-Hooded-Sweater/411940939
93,Lush ClothingLush Clothing Women's Turtleneck Sweater,https://www.walmart.com/ip/Lush-Clothing-Women-s-Turtleneck-Sweater/534275774
94,Lush ClothingLush Clothing Sequin Embroidered Sweater Dress,https://www.walmart.com/ip/Lush-Clothing-Sequin-Embroidered-Sweater-Dress/662679669
95,Time and TruTime and Tru Women's Open Front Duster Cardigan Sweater,https://www.walmart.com/ip/Time-and-Tru-Women-s-Open-Front-Duster-Cardigan/104139252
96,Time and TruTime and Tru Women's V-Neck Sweater,https://www.walmart.com/ip/Time-and-Tru-Women-s-V-Neck-Sweater/778761609
97,Time and TruTime and Tru Women's Striped Turtleneck Sweater,https://www.walmart.com/ip/Time-and-Tru-Women-s-Striped-Turtleneck-Sweater/425573783
98,Time and TruTime and Tru Women's Turtleneck Sweater,https://www.walmart.com/ip/Time-and-Tru-Women-s-Turtleneck-Sweater/844530264
99,Time and TruTime and Tru Women's Leopard Sweater,https://www.walmart.com/ip/Time-and-Tru-Women-s-Leopard-Sweater/216437376
100,Time and TruTime and Tru Women's Cowlneck Dress,https://www.walmart.com/ip/Time-and-Tru-Women-s-Cowlneck-Dress/102186389
101,Time and TruTime and Tru Women's Heavyweight Anorak with Faux Fur Trimmed Hood,https://www.walmart.com/ip/Time-and-Tru-Women-s-Heavyweight-Anorak-with-Faux-Fur-Trimmed-Hood/840736730
102,Time and TruTime and Tru Women's Boucle Cardigan Sweater,https://www.walmart.com/ip/Time-and-Tru-Women-s-Boucle-Cardigan/840386026
103,AviaAvia Women's Active Brushed Leggings,https://www.walmart.com/ip/Avia-Women-s-Active-Brushed-Leggings/867714553
104,Secret TreasuresSecret Treasures Women's and Women's Plus Traditional Front Zip Robe,https://www.walmart.com/ip/Secret-Treasures-Women-s-and-Women-s-Plus-Traditional-Front-Zip-Robe/285908583
105,AviaAvia Women's Athleisure Commuter Pants,https://www.walmart.com/ip/Avia-Women-s-Athleisure-Commuter-Pants/307642254
106,Terra & SkyTerra & Sky Women's Plus Size Knit Capri,https://www.walmart.com/ip/Terra-Sky-Women-s-Plus-Size-Knit-Capri/382784065
107,Time and TruTime and Tru Women's Eyelash Sweater,https://www.walmart.com/ip/Time-and-Tru-Women-s-Eyelash-Sweater/999151484
108,"HanesHanes Men's and Big Men's Tagless Short Sleeve Tee, Up To Size 6XL",https://www.walmart.com/ip/Hanes-Men-s-and-Big-Men-s-Tagless-Short-Sleeve-Tee-Up-To-Size-6XL/40227255
109,S2 SportswearS2 Sportswear Women's 2-Pack Active Full Length High-Waist Leggings with Pockets,https://www.walmart.com/ip/S2-Sportswear-Women-s-2-Pack-Active-Full-Length-High-Waist-Leggings-with-Pockets/335404652
110,Secret TreasuresSecret Treasures Women's Plush Jogger,https://www.walmart.com/ip/Secret-Treasures-Women-s-and-Women-s-Plus-Deluxe-Touch-Lounge-Pajama-Joggers/122502999
111,AviaAvia Women's Active Brushed 1/4 Zip Pullover,https://www.walmart.com/ip/Avia-Women-s-Active-Brushed-1-4-Zip-Pullover/105246961
112,Time and TruTime and Tru Women's Cowl Neck Tunic Sweatshirt,https://www.walmart.com/ip/Time-and-Tru-Women-s-Cowl-Neck-Tunic-Sweatshirt/445675712
113,Secret TreasuresSecret Treasures Women's V-Neck Ballet Gown,https://www.walmart.com/ip/Secret-Treasures-Women-s-and-Women-s-Plus-Traditional-Long-Sleeve-V-Neck-Velour-Nightgown/555052828
114,STARVNCWomen Round Neck Long Sleeve Splicing Plaid Top,https://www.walmart.com/ip/Women-Round-Neck-Long-Sleeve-Splicing-Plaid-Top/588288664
115,Secret TreasuresSecret Treasures Women's Square Neck Flutter Gown,https://www.walmart.com/ip/Secret-Treasures-Women-s-and-Women-s-Plus-Traditional-Flutter-Sleeve-Gown/540177942
116,AviaAvia Women's Athleisure Quilted Tunic Jacket,https://www.walmart.com/ip/Avia-Women-s-Quilted-Tunic-Jacket/210265875
117,"HanesHanes Men's and Big Men's Premium Beefy-T Long Sleeve T-Shirt, Up To 3XL",https://www.walmart.com/ip/Hanes-Men-s-and-Big-Men-s-Premium-Beefy-T-Long-Sleeve-T-Shirt-Up-To-3XL/14710862
118,Just My SizeJust My Size Women's Plus Size Fleece Pullover Sweatshirt,https://www.walmart.com/ip/Just-My-Size-Women-s-Plus-Size-Fleece-Pullover-Sweatshirt/54778933
119,ScrubstarScrubstar Women's Fashion Premium Performance Yoga Scrub Pant,https://www.walmart.com/ip/Scrubstar-Women-s-Fashion-Premium-Performance-Yoga-Scrub-Pant/688188492
120,"HanesHanes Women's Cotton Brief Underwear, 10-Pack",https://www.walmart.com/ip/Hanes-Women-s-Cotton-Brief-Underwear-10-Pack/22904105
121,Athletic WorksAthletic Works Women's Plus Size Dri More Relaxed Fit Sweatpants,https://www.walmart.com/ip/Athletic-Works-Women-s-Plus-Size-Dri-More-Relaxed-Fit-Sweatpants/669887923
122,Time and TruTime and Tru Women's Stretch Denim Bootcut Jeans,https://www.walmart.com/ip/Time-and-Tru-Women-s-Stretch-Denim-Bootcut-Jeans/945684745
123,"Fruit of the LoomFruit of the Loom Women's Comfort Front Close Sports Bra, Style 96014",https://www.walmart.com/ip/Fruit-of-the-Loom-Women-s-Comfort-Front-Close-Sports-Bra-Style-96014/13997194
