,item_name,url
391,Big ChillBig Chill Women's Heavy Coated Anorak With Fur Hood,https://www.walmart.com/ip/Big-Chill-Women-s-Heavy-Coated-Anorak-With-Fur-Hood/702084351
392,Wayren USAChristmas Family Matching Pajamas PJs Set Dad Mum Kids Baby Xmas Sleepwear,https://www.walmart.com/ip/Christmas-Family-Matching-Pajamas-PJs-Set-Dad-Mum-Kids-Baby-Xmas-Sleepwear/293795815
393,Premiere Fashion1812 Womens Nightgown Sleepwear Pajamas - Woman Sleeveless Sleep Dress Nightshirt Purple L,https://www.walmart.com/ip/1812-Womens-Nightgown-Sleepwear-Pajamas-Woman-Sleeveless-Sleep-Dress-Nightshirt-Purple-L/957341977
394,Holiday TimeHoliday Time Women's Plus Size Quarter Sleeve Festive Baseball Tee,https://www.walmart.com/ip/Holiday-Time-Women-s-Plus-Size-Quarter-Sleeve-Festive-Baseball-Tee/366506560
395,Lati Fashion812 Womens Nightgown Sleepwear Pajamas - Woman Sleeveless Sleep Dress Nightshirt Pink XL,https://www.walmart.com/ip/812-Womens-Nightgown-Sleepwear-Pajamas-Woman-Sleeveless-Sleep-Dress-Nightshirt-Pink-XL/383163890
396,WodstyleWomens Fluffy Fleece Long Trench Coat Jacket Faux Fur Borg Outwear Warm Overcoat,https://www.walmart.com/ip/Womens-Fluffy-Fleece-Long-Trench-Coat-Jacket-Faux-Fur-Borg-Outwear-Warm-Overcoat/629700848
397,DisneyDisney Women's and Women's Plus Minnie Mouse Hooded Union Suit,https://www.walmart.com/ip/Disney-Women-s-and-Women-s-Plus-Minnie-Mouse-Hooded-Union-Suit/545265992
398,WodstyleWomens Casual Long Sleeve Tops Plus Size Tie Dye Crew Neck Blouses Sweatshirts,https://www.walmart.com/ip/Womens-Casual-Long-Sleeve-Tops-Plus-Size-Tie-Dye-Crew-Neck-Blouses-Sweatshirts/326615899
399,XIAXAIXUCasual Women Hoodies Sports Tops Pants Tracksuit Sweatshirt Sweat Suit Jogging Set,https://www.walmart.com/ip/Casual-Women-Hoodies-Sports-Tops-Pants-Tracksuit-Sweatshirt-Sweat-Suit-Jogging-Set/766598063
400,Lee RidersLee Riders Women's Plus Size Classic Fit Midrise Jean,https://www.walmart.com/ip/Lee-Riders-Women-s-Plus-Size-Classic-Fit-Midrise-Jean/48268651
401,"Sleep & CoSleep & Co Women's and Women's Plus Knit Pajama Set with Scrunchie, 2-Piece",https://www.walmart.com/ip/Sleep-Co-Women-s-and-Women-s-Plus-Knit-Pajama-Set-with-Scrunchie-2-Piece/439413765
402,WodstyleWomens Plus Size Crew Neck Long Sleeve Colorbock Tops T Shirt Casual Blouses,https://www.walmart.com/ip/Womens-Plus-Size-Crew-Neck-Long-Sleeve-Colorbock-Tops-T-Shirt-Casual-Blouses/808666469
403,HiMONEHIMONE Casual Pullover Sweatshirts for Women Loose Stripe Tie Dye T-Shirts Tops Baggy Blouse Ladies Fashion Side Split Tunic Tops Women Plus Activewear,https://www.walmart.com/ip/HIMONE-Casual-Pullover-Sweatshirts-Women-Loose-Stripe-Tie-Dye-T-Shirts-Tops-Baggy-Blouse-Ladies-Fashion-Side-Split-Tunic-Plus-Activewear/751763094
404,Vanity FairVanity Fair Womens Classic Ravissant Full Brief Style-15712,https://www.walmart.com/ip/Vanity-Fair-Womens-Classic-Ravissant-Full-Brief-Style-15712/740910716
405,Athletic WorksAthletic Works Women's Plus Size Soft Fleece Pullover Sweatshirt,https://www.walmart.com/ip/Athletic-Works-Women-s-Plus-Size-Soft-Fleece-Pullover-Sweatshirt/412008299
406,AviaAvia Women's Performance Capri Pants,https://www.walmart.com/ip/Avia-Women-s-Performance-Capri-Pants/719964413
407,EV1 from Ellen DeGeneresEV1 from Ellen DeGeneres Alex Relaxed Vintage Fit Jean Women's,https://www.walmart.com/ip/EV1-from-Ellen-DeGeneres-Metallic-Cuff-Alex-Relaxed-Jean-Women-s/725965612
408,Athletic WorksAthletic Works Women's Active Performance Long Sleeve Crewneck Commuter T-Shirt,https://www.walmart.com/ip/Athletic-Works-Women-s-Active-Performance-Long-Sleeve-Crewneck-Commuter-T-Shirt/303399704
409,Blissful Benefits by Warner'sBlissful Benefits by Warner's Women's No Muffin Top Micro Hipster 3-Pack,https://www.walmart.com/ip/Blissful-Benefits-by-Warner-s-Women-s-No-Muffin-Top-Micro-Hipster-3-Pack/280277245
410,Time and TruTime and Tru Women's Long Sleeve Faux Wrap Dress,https://www.walmart.com/ip/Time-and-Tru-Women-s-Long-Sleeve-Faux-Wrap-Dress/720086226
411,Blissful Benefits by Warner'sBlissful Benefits by Warner's Women's No Muffin Top Seamless Hipster 3-Pack,https://www.walmart.com/ip/Blissful-Benefits-by-Warner-s-Women-s-No-Muffin-Top-Seamless-Hipster-3-Pack/736308217
412,LeeLee Womens's Plus Stretch Relaxed Fit Straight Leg Jean,https://www.walmart.com/ip/Lee-Womens-s-Plus-Stretch-Relaxed-Fit-Straight-Leg-Jean/212100463
413,Time and TruWomen's Classic Career Shirt,https://www.walmart.com/ip/Women-s-Classic-Career-Shirt/236056999
414,PudcocoPudcoco Women Winter Baggy Cardigan Coat Long Knitted Oversized Sweater Jumper,https://www.walmart.com/ip/Pudcoco-Women-Winter-Baggy-Cardigan-Coat-Long-Knitted-Oversized-Sweater-Jumper/499947039
415,Athletic WorksAthletic Works Women's Athleisure Velour Pullover,https://www.walmart.com/ip/Athletic-Works-Women-s-Athleisure-Velour-Pullover/639297196
416,NlifeWomen's Cowl Neck Striped Loog Sleeve High-Low Hem Tunic Top,https://www.walmart.com/ip/Women-s-Cowl-Neck-Striped-Loog-Sleeve-High-Low-Hem-Tunic-Top/433023934
417,Bergman KellyBergman Kelly Open Toe Slippers for Women (Cloud Collection),https://www.walmart.com/ip/Bergman-Kelly-Open-Toe-Slippers-for-Women-Cloud-Collection/648047279
418,"Wonder NationWonder Nation Girls Exclusive Metallic Bubble Puffer Jacket, Sizes 4-18 & Plus",https://www.walmart.com/ip/Wonder-Nation-Girls-Exclusive-Metallic-Bubble-Puffer-Jacket-Sizes-4-18-Plus/543508473
419,MultitrustMultitrust Women's Hoodies Sports Tops Pants Tracksuit Sweatshirt Sweat Suit Jogging Set,https://www.walmart.com/ip/Multitrust-Women-s-Hoodies-Sports-Tops-Pants-Tracksuit-Sweatshirt-Sweat-Suit-Jogging-Set/138019984
420,Athletic WorksAthletic Works Women's Active Core Long Sleeve Tee 2-Pack,https://www.walmart.com/ip/Athletic-Works-Women-s-Active-Core-Long-Sleeve-Tee-2-Pack/827127420
421,Athletic WorksWomen's Athletic Works Mule Slip On Shoe,https://www.walmart.com/ip/Women-s-Athletic-Works-Mule-Slip-On-Shoe/201360848
422,LookwoildLookwoild Women Summer Gypsy Baggy Tunic Tops Shirt Long Sleeve Blouse Plus Size 6-26,https://www.walmart.com/ip/Lookwoild-Women-Summer-Gypsy-Baggy-Tunic-Tops-Shirt-Long-Sleeve-Blouse-Plus-Size-6-26/917347871
423,Athletic WorksAthletic Works Women's Plus Size Zip Front Bra,https://www.walmart.com/ip/Athletic-Works-Women-s-Plus-Size-Zip-Front-Bra/507970826
424,WodstyleWomen's Cable Knit Sweater Ladies Casual Plain Hooded Button Pocket Outwear,https://www.walmart.com/ip/Women-s-Cable-Knit-Sweater-Ladies-Casual-Plain-Hooded-Button-Pocket-Outwear/598134250
425,MeihuidaFashion Lovely Comfortable Cotton Family Mums Matching Christmas Pajamas PJs Sets Xmas Gift Sleepwear Nightwear Outfit Clothes Red,https://www.walmart.com/ip/Fashion-Lovely-Comfortable-Cotton-Family-Mums-Matching-Christmas-Pajamas-PJs-Sets-Xmas-Gift-Sleepwear-Nightwear-Outfit-Clothes-Red/830076790
426,HanesWomen's Lowcut Socks 10 Pack,https://www.walmart.com/ip/Women-s-Lowcut-Socks-10-Pack/24099764
427,TeeHee SocksTeeHee Christmas Holiday Fun Knee High Socks 9-Pack with Gift Box,https://www.walmart.com/ip/TeeHee-Christmas-Holiday-Fun-Knee-High-Socks-9-Pack-with-Gift-Box/584368133
428,Athletic WorksAthletic Work Women's Athleisure Knit Capri Pant,https://www.walmart.com/ip/Athletic-Work-Women-s-Athleisure-Knit-Capri-Pants/519108253
429,Just LoveJust Love Women's and Women's Plus Plaid Pajama Pants,https://www.walmart.com/ip/Just-Love-Women-s-and-Women-s-Plus-Plaid-Pajama-Pants/656819430
430,PaviliaPremium Women Fleece Robe with Satin Trim | Luxurious Super Soft Plush Bathrobe,https://www.walmart.com/ip/Premium-Women-Fleece-Robe-with-Satin-Trim-Luxurious-Super-Soft-Plush-Bathrobe/496177228
431,HanesHanes Cooling Comfort Foam Wire-Free Bra W507,https://www.walmart.com/ip/Hanes-Women-s-Signature-Cooling-Comfort-Foam-Wire-Free-Bra-Style-W507/667194704
432,JustVHJustVH Women's Cold Shoulder Short Sleeve Casual Tunic Tops Loose Blouse Shirts,https://www.walmart.com/ip/JustVH-Women-s-Cold-Shoulder-Short-Sleeve-Casual-Tunic-Tops-Loose-Blouse-Shirts/703850416
433,PlaytexPlaytex Womens 18 Hour Comfortflex Wire-Free Bra Style-4395,https://www.walmart.com/ip/Playtex-Womens-18-Hour-Comfortflex-Wire-Free-Bra-Style-4395/873288
434,YeleteWomen's Cotton Blend Full Length Jeggings Stretchy Skinny Pants Jeans Leggings,https://www.walmart.com/ip/Women-s-Cotton-Blend-Full-Length-Jeggings-Stretchy-Skinny-Pants-Jeans-Leggings/617742951
435,"Fruit of the LoomFruit Of The Loom Women's Heather Bikinis, 6 Pack",https://www.walmart.com/ip/Fruit-of-the-Loom-Women-s-Heather-Bikinis-6-Pack/653330322
436,AviaAvia Flex Tech 7/8ths Length Legging,https://www.walmart.com/ip/Avia-Flex-Tech-7-8ths-Length-Leggings/369716961
437,Premiere Fashion1651 Womens Nightgown Sleepwear Pajamas Woman Long Sleeve Sleep Dress Nightshirt Blue L,https://www.walmart.com/ip/1651-Womens-Nightgown-Sleepwear-Pajamas-Woman-Long-Sleeve-Sleep-Dress-Nightshirt-Blue-L/758302933
438,"Athletic WorksAthletic Works Women's Athleisure Dri More Core Active 12"" Bermuda Shorts",https://www.walmart.com/ip/Athletic-Works-Women-s-Athleisure-Dri-More-Core-Active-12-Bermuda-Shorts/892003330
439,Terra & SkyTerra & Sky Women's Plus Size Denim Pull on Straight Leg Jean,https://www.walmart.com/ip/Terra-Sky-Women-s-Plus-Size-Denim-Pull-on-Straight-Leg-Jean/758380208
440,Como BluComo Blu Women's Athleisure Sweatpants,https://www.walmart.com/ip/Como-Blu-Women-s-Athleisure-Sweatpants/878196763
441,Just My SizeJust My Size Womens Plus Size Pull on Stretch Denim Bootcut Jegging,https://www.walmart.com/ip/Just-My-Size-Womens-Plus-Size-Pull-on-Stretch-Denim-Bootcut-Jegging/990890592
442,Secret TreasuresSecret Treasures Women's and Women's Plus Superminky Pajama Pant,https://www.walmart.com/ip/Secret-Treasures-Women-s-and-Women-s-Plus-Superminky-Pajama-Pants/732058055
443,SkechersWomen's Skechers D'Lites Sneaker,https://www.walmart.com/ip/Women-s-Skechers-D-Lites-Sneaker/909124933
444,Just My SizeJust My Size Women's Plus Size French Terry Pocket Capri,https://www.walmart.com/ip/Just-My-Size-Women-s-Plus-Size-French-Terry-Pocket-Capri/47576368
445,"Fit for Me by Fruit of the LoomFit For Me by Fruit Of The Loom Women's Comfort Covered Cotton Brief, 6 Pack",https://www.walmart.com/ip/Fit-for-Me-Women-s-Plus-Comfort-Covered-Cotton-Assorted-Brief-Underwear-6-Pack/283005336
446,"TruformFirm Strength Compression Socks, Knee High, Closed Toe, Black, Medium",https://www.walmart.com/ip/Firm-Strength-Compression-Socks-Knee-High-Closed-Toe-Black-Medium/318599016
447,"Footed PajamasFooted Pajamas - Family Matching Polar Hoodie Onesies for Boys, Girls, Men, Women and Pets - Adult - Large (Fits 6'0 - 6'4"")",https://www.walmart.com/ip/Footed-Pajamas-Family-Matching-Orange-Hoodie-Onesies-for-Boys-Girls-Men-Women-and-Pets-Kids-Medium-Fits-4-6-4-8/269107520
448,Lati Fashion820C Womens Capri Set Sleepwear Pajamas Woman Sleep Nightshirt,https://www.walmart.com/ip/820C-Womens-Capri-Set-Sleepwear-Pajamas-Woman-Sleep-Nightshirt/735228527
449,"ZenanaWomen Premium Cotton High Waist Full Ankle Length Leggings (2PK: Ash Blue/Ash Mint, S)",https://www.walmart.com/ip/Women-Premium-Cotton-High-Waist-Full-Ankle-Length-Leggings/976201819
450,Athletic WorksAthletic Work's Women's Plus Size Dri-More Core Zip-Up Hoodie,https://www.walmart.com/ip/Athletic-Work-s-Women-s-Plus-Size-Dri-More-Core-Zip-Up-Hoodie/563268534
451,PlaytexPlaytex Womens 18 Hour Smoothing Wire-Free Bra Style-4049,https://www.walmart.com/ip/Playtex-Womens-18-Hour-Smoothing-Wire-Free-Bra-Style-4049/13905429
452,HanesHanes Women's Modal Triblend Short Sleeve Scoopneck Tee,https://www.walmart.com/ip/Hanes-Women-s-Modal-Triblend-Short-Sleeve-Scoopneck-Tee/56271046
453,PlaytexPlaytex Womens 18 Hour Cooling Comfort Wire-Free Sports Bra Style-4159,https://www.walmart.com/ip/Playtex-Womens-18-Hour-Cooling-Comfort-Wire-Free-Sports-Bra-Style-4159/10812663
454,"ScrubstarScrubstar Women's Rudolph ""Christmas Countdown"" V-Neck Print Scrub Top",https://www.walmart.com/ip/Scrubstar-Women-s-Rudolph-Christmas-Countdown-V-Neck-Print-Scrub-Top/681571596
455,"Fruit of the LoomFruit of the Loom Women's Microfiber Brief Panties, 6 Pack",https://www.walmart.com/ip/Fruit-of-the-Loom-Women-s-Microfiber-Brief-Panties-6-Pack/650939148
456,"Fruit of the LoomFruit of the Loom Women's Heather Assorted Bikini Underwear, 12-Pack",https://www.walmart.com/ip/Fruit-of-the-Loom-Women-s-Heather-Assorted-Bikini-Underwear-12-Pack/531052437
457,"No BoundariesNo Boundaries Juniors' Faux Fur Lined Leggings, 2-Pack",https://www.walmart.com/ip/No-Boundaries-Juniors-Faux-Fur-Lined-Leggings-2-Pack/480333669
458,Free AssemblyFree Assembly Women's Chunky Grandpa Cardigan,https://www.walmart.com/ip/Free-Assembly-Women-s-Chunky-Grandpa-Cardigan/723317262
459,FreshLookWomen Fashion Autumn and Winter Harry Potter Hoddie Hoody Glasses Hogwarts Alumni BOOK Titles Sweater Sweatshirt,https://www.walmart.com/ip/Women-Fashion-Autumn-and-Winter-Harry-Potter-Hoddie-Hoody-Glasses-Hogwarts-Alumni-BOOK-Titles-Sweater-Sweatshirt/968165563
460,Chic NiteChic Nite Women's 3/4 Length Plush Hooded Robe with Sherpa Trim Collar & Cuffs,https://www.walmart.com/ip/Chic-Nite-Women-s-3-4-Length-Plush-Hooded-Robe-with-Sherpa-Trim-Collar-Cuffs/903212836
461,"YesMediPeds Diabetic CoolMax Crew Socks, Large, 2 Pack",https://www.walmart.com/ip/MediPeds-Diabetic-CoolMax-Crew-Socks-Large-2-Pack/46629649
462,Port & CompanyLong Sleeve 54oz 100% Cotton TShirt,https://www.walmart.com/ip/Long-Sleeve-54oz-100-Cotton-TShirt/835637959
463,"Fruit of the LoomFruit Of The Loom Flat No Show Comfort Socks, 6 Pair",https://www.walmart.com/ip/Fruit-of-the-Loom-Women-s-CoolZone-Cotton-Lightweight-No-Show-Socks-6-Pack/612457685
464,Comfort ChoiceComfort Choice Women's Plus Size 10-Pack Pure Cotton Full-Cut Brief Underwear,https://www.walmart.com/ip/Comfort-Choice-Women-s-Plus-Size-10-Pack-Pure-Cotton-Full-Cut-Brief-Underwear/204541155
465,Fresh lookWomen's Paisley Printed Top Long Sleeve V Neck Pleated Casual Flare Tunic Loose Blouse Shirt,https://www.walmart.com/ip/Women-s-Paisley-Printed-Top-Long-Sleeve-V-Neck-Pleated-Casual-Flare-Tunic-Loose-Blouse-Shirt/278855570
466,Time and TruTime and Tru Women's Eyelash Sweater,https://www.walmart.com/ip/Time-and-Tru-Women-s-Eyelash-Sweater/637402184
467,"EmprellaEmprella Cotton Underwear Women, 8 Pack Womens Bikini Seamless Ladies Cheeky Panties S-XL",https://www.walmart.com/ip/Emprella-Cotton-Underwear-Women-8-Pack-Womens-Bikini-Seamless-Ladies-Cheeky-Panties-S-XL/328197000
468,"Secret TreasuresSecret Treasures Women's Heather Print Brief Panties, 6-Pack",https://www.walmart.com/ip/Secret-Treasures-Women-s-Heather-Print-Brief-Panties-6-Pack/418012824
469,SySeaWinter Women Fur Hooded Coat Warm Cotton Padded Jacket,https://www.walmart.com/ip/Winter-Women-Fur-Hooded-Coat-Warm-Cotton-Padded-Jacket/589617121
470,WodstyleWomen's Plus Size V Neck Floral Tops Short Sleeve Summer Loose T-shirts,https://www.walmart.com/ip/Women-s-Plus-Size-V-Neck-Floral-Tops-Short-Sleeve-Summer-Loose-T-shirts/657502990
471,Signature by Levi Strauss & Co.Signature by Levi Strauss & Co. Women's Plus Modern Straight Jeans,https://www.walmart.com/ip/Signature-by-Levi-Strauss-Co-Women-s-Plus-Modern-Straight-Jeans/469124776
472,ChampionChampion Women's Powerblend Boyfriend Left Chest Crewneck Sweatshirt,https://www.walmart.com/ip/Champion-Women-s-Powerblend-Boyfriend-Left-Chest-Crewneck-Sweatshirt/836663332
473,HanesHanes Women's French Terry Jogger with Pockets,https://www.walmart.com/ip/Hanes-Women-s-French-Terry-Jogger-with-Pockets/847077782
474,Awkward StylesAwkward Styles Matching Christmas Pajamas Set Green Let's Get Lit Family Sleepwear,https://www.walmart.com/ip/Awkward-Styles-Matching-Christmas-Pajamas-Set-Green-Let-s-Get-Lit-Family-Sleepwear/758485335
475,Athletic WorksAthletic Works Women's Athleisure Dri More Core Piped Bermuda Shorts,https://www.walmart.com/ip/Athletic-Works-Women-s-Athleisure-Dri-More-Core-Piped-Bermuda-Shorts/687646251
476,"CherokeeCherokee Workwear Women Scrubs Pant, Natural Rise Tapered Pull-On Cargo, Plus Size, 4200, 5XL, Dandelion",https://www.walmart.com/ip/Cherokee-Workwear-Scrubs-Pant-for-Women-Natural-Rise-Tapered-Pull-On-Cargo-4200T-S-Tall-Pewter/168375891
477,LeeLee Women's Comfort Waist Knit Straight Leg Pant,https://www.walmart.com/ip/Lee-Women-s-Comfort-Waist-Knit-Straight-Leg-Pant/614389357
478,"Wonder NationWonder Nation Girls Printed Bubble Jacket, Sizes 4-18 & Plus",https://www.walmart.com/ip/Wonder-Nation-Girls-Printed-Bubble-Jacket-Sizes-4-18-Plus/193027342
479,"Fruit of the LoomFruit of the Loom Women's Microfiber Bikini Panty, 6 Pack",https://www.walmart.com/ip/Fruit-of-the-Loom-Women-s-Microfiber-Bikini-Panty-6-Pack/762884795
480,Derek HeartDerek Heart Women's and Women's Plus Frosted Deluxe Touch Burnout Robe,https://www.walmart.com/ip/Derek-Heart-Women-s-and-Women-s-Plus-Frosted-Deluxe-Touch-Burnout-Robe/461141971
481,NituyyNituyy Family Matching Christmas Pajamas Sets Xmas Sleepwear Nightwear,https://www.walmart.com/ip/Nituyy-Family-Matching-Christmas-Pajamas-Sets-Xmas-Sleepwear-Nightwear/640624652
482,Premiere FashionDS-02 Womens Nightgown Sleepwear Pajamas Woman Sleep Dress Nightshirt,https://www.walmart.com/ip/DS-02-Womens-Nightgown-Sleepwear-Pajamas-Woman-Sleep-Dress-Nightshirt/998569955
483,HanesHanes Women's Soft Thermal Top and Plush Joggers Pajama Set,https://www.walmart.com/ip/Hanes-Women-s-Soft-Thermal-Top-and-Plush-Joggers-Pajama-Set/856383736
484,ChampionChampion Women's Powerblend Fleece Joggers,https://www.walmart.com/ip/Champion-Women-s-Powerblend-Fleece-Joggers/741347781
485,DearfoamsDF by Dearfoams Women's Velour Moc Toe Clog slippers,https://www.walmart.com/ip/DF-by-Dearfoams-Women-s-Velour-Moc-Toe-Clog-slippers/208228786
486,"Fruit of the LoomWomens Comfort Front Close Sports Bra, 3 Pack, Style 96014D",https://www.walmart.com/ip/Womens-Comfort-Front-Close-Sports-Bra-3-Pack-Style-96014D/831846255
487,"Muk LuksMuk Luks Women's 8"" Boot Sock, 3 Pair",https://www.walmart.com/ip/Muk-Luk-Boot-Sock-3pk/338932600
488,No BoundariesNo Boundaries Juniors' Open Front Brushed Cardigan,https://www.walmart.com/ip/No-Boundaries-Juniors-Open-Front-Brushed-Cardigan/582443414
489,"Blissful Benefits by Warner'sBlissful Benefits by Warner's Women's Tummy Smoothing Brief, 3-Pack",https://www.walmart.com/ip/Blissful-Benefits-by-Warner-s-Women-s-Tummy-Smoothing-Brief-3-Pack/148252567
490,Blissful Benefits by Warner'sBlissful Benefits by Warner's Women's Underarm Smoothing Wire-Free Bra RM7561W,https://www.walmart.com/ip/Blissful-Benefits-by-Warner-s-Women-s-Underarm-Smoothing-Wire-Free-Bra-RM7561W/973260014
491,"Athletic WorksAthletic Works Women's Plus Size Relaxed Fit French Terry Sweatpant, 2-Pack Bundle",https://www.walmart.com/ip/Athletic-Works-Women-s-Plus-Size-Relaxed-Fit-French-Terry-Sweatpant-2-Pack-Bundle/218551600
492,LallcWomen's Sports High Waist Pants Jogging Workout Sportwear Sweatpants Trousers,https://www.walmart.com/ip/Women-s-Sports-High-Waist-Pants-Jogging-Workout-Sportwear-Sweatpants-Trousers/333504004
493,"Terra & SkyTerra & Sky Women's Plus Size Everday Essential Tunic Length Cami, 3-Pack Bundle",https://www.walmart.com/ip/Terra-Sky-Women-s-Plus-Size-Everyday-Essential-Tunic-Length-Cami-3-Pack-Bundle/791172937
494,"HanesHanes Women's Cool Comfort Cotton Low Rise Brief, 6-Pack",https://www.walmart.com/ip/Hanes-Women-s-Cool-Comfort-Cotton-Low-Rise-Brief-6-Pack/10855215
495,ChampionChampion Womens Middleweight Hoodie,https://www.walmart.com/ip/Champion-Women-s-Middleweight-Hoodie/154658761
496,ScoopScoop Women's Printed Tiered Dress,https://www.walmart.com/ip/Scoop-Women-s-Printed-Tiered-Dress/122399684
497,MaidenformSweet Nothings Women's Stay Put Strapless Push Up Underwire Bra,https://www.walmart.com/ip/Sweet-Nothings-Women-s-Stay-Put-Strapless-Push-Up-Underwire-Bra/55485236
498,Time and TruTime and Tru Womens Puff Sleeve Crewneck Pullover,https://www.walmart.com/ip/Time-and-Tru-Women-s-Puff-Sleeve-Crewneck-Pullover/467747272
499,Time and TruSpring Everyday Crew Neck Cardigan,https://www.walmart.com/ip/Time-and-Tru-Women-s-Everyday-Crew-Neck-Cardigan/719854734
500,MeihuidaXMAS PJs Family Matching Adult Women Kid Christmas Nightwear Pyjamas Set,https://www.walmart.com/ip/XMAS-PJs-Family-Matching-Adult-Women-Kid-Christmas-Nightwear-Pyjamas-Set/835626610
501,Athletic WorksAthletic Works Women's Active Straight Leg Pants,https://www.walmart.com/ip/Athletic-Works-Women-s-Active-Straight-Leg-Pants/468128882
502,Terra & SkyTerra & Sky Women's Plus Size Wide Leg Pants,https://www.walmart.com/ip/Terra-Sky-Women-s-Plus-Size-Wide-Leg-Pants/798962879
503,beautimate(60% Off) Beautimate Facial Jade Roller & Gua Sha Tool Set,https://www.walmart.com/ip/60-Off-Beautimate-Facial-Jade-Roller-Gua-Sha-Tool-Set/689568728
504,Time and TruTime and Tru Women's Athleisure Sweatshirt and Open Bottom Pants Set,https://www.walmart.com/ip/Time-and-Tru-Women-s-Athleisure-Sweatshirt-and-Open-Bottom-Pants-Set/798629084
505,AviaAvia Women's Active Quilted 1/4 Zip Pullover,https://www.walmart.com/ip/Avia-Women-s-Active-Quilted-1-4-Zip-Pullover/969487985
506,GvmfiveGvmfive Women Long Sleeve Loose Tunic Top,https://www.walmart.com/ip/Gvmfive-Women-Long-Sleeve-Loose-Tunic-Top/357336023
507,JulymonaJulymona Womens Plus Size Sleepwear Nightdress Lace V Neck Lingerie Babydoll,https://www.walmart.com/ip/Julymona-Womens-Plus-Size-Sleepwear-Nightdress-Lace-V-Neck-Lingerie-Babydoll/962452817
508,"HanesHanes Women's SUPERVALUE Cotton Bikini Underwear, 6+2 Bonus Pack",https://www.walmart.com/ip/Hanes-Women-s-SUPERVALUE-Cotton-Bikini-Underwear-6-2-Bonus-Pack/22172460
509,Signature by Levi Strauss & Co.Signature by Levi Strauss & Co. Women's Plus Modern Skinny Jean,https://www.walmart.com/ip/Signature-by-Levi-Strauss-Co-Women-s-Plus-Modern-Skinny-Jean/589383546
510,Hmount Deeroll1PCS Head Face Neck Gaiter Tube Bandana Scarf Dustproof Outdoor SportsWhite),https://www.walmart.com/ip/1PCS-Head-Face-Neck-Gaiter-Tube-Bandana-Scarf-Dustproof-Outdoor-Sports-White/219270168
511,WodstyleWomen's Velvet Fluffy Jumper Long Sleeve Pullover Warm Sweater,https://www.walmart.com/ip/Women-s-Velvet-Fluffy-Jumper-Long-Sleeve-Pullover-Warm-Sweater/118931041
512,"Fruit of the LoomFruit of the Loom Women's Long Underwear Waffle Crew and V-Neck Thermal Top, 2-Pack",https://www.walmart.com/ip/Fruit-of-the-Loom-Women-s-Long-Underwear-Waffle-Crew-and-V-Neck-Thermal-Top-2-Pack/993311581
513,"Muk LuksMuk Luks Cabin Cozy Sock, 2pk",https://www.walmart.com/ip/Muk-Luks-Women-s-Cabin-Sock-2-Pair/188100895
514,MeihuidaWomen Autumn V Neck Long Sleeve Sweater Loose Knit Pullover Sexy Jumper Tops Striped Sweaters Fashion,https://www.walmart.com/ip/Women-Autumn-V-Neck-Long-Sleeve-Sweater-Loose-Knit-Pullover-Sexy-Jumper-Tops-Striped-Sweaters-Fashion/466357934
515,"Dr. Scholl'sDr.Scholl's Women's Relaxed Fit Ankle Socks, 4 Pack",https://www.walmart.com/ip/Dr-Scholl-s-Women-s-Relaxed-Fit-Ankle-Socks-4-Pack/46939806
516,"Sleep & CoSleep & Co Women's and Women's Plus Plush Pajama Set, 2-Piece",https://www.walmart.com/ip/Sleep-Co-Women-s-and-Women-s-Plus-Plush-Pajama-Set-2-Piece/610355919
517,Ever-prettyBlack Friday Women's Tie Dye Loungewear Pajama Sets Drawstring Shorts and Shirts 30002 Pink Medium,https://www.walmart.com/ip/Black-Friday-Women-s-Tie-Dye-Loungewear-Pajama-Sets-Drawstring-Shorts-and-Shirts-30002-Pink-Medium/875356944
518,Blended3 Pair of Fuzzy Slipper Socks for Women Soft Cozy in Several Patterns,https://www.walmart.com/ip/3-Pair-of-Fuzzy-Slipper-Socks-for-Women-Soft-Cozy-in-Several-Patterns/578201238
519,Terra & SkyTerra & Sky Women's Plus Size Lightweight Long Sleeve Mockneck Top,https://www.walmart.com/ip/Terra-Sky-Women-s-Plus-Size-Lightweight-Long-Sleeve-Mockneck-Top/769352521
520,ZXZYWomen Striped Leopard Spliced Long Sleeve Twisted Hem Top,https://www.walmart.com/ip/Women-Striped-Leopard-Spliced-Long-Sleeve-Twisted-Hem-Top/548854894
521,GildanGildan - MF Women - Heavy Cotton Womens Long Sleeve T-Shirt,https://www.walmart.com/ip/Gildan-MF-Women-Heavy-Cotton-Women-s-Long-Sleeve-T-Shirt/814032441
522,Wayren USAFamily Christmas Pajamas Set Xmas Pjs Matching Pyjamas Adult Kids Xmas Sleepwear,https://www.walmart.com/ip/Family-Christmas-Pajamas-Set-Xmas-Pjs-Matching-Pyjamas-Adult-Kids-Xmas-Sleepwear/679938867
523,BagilaanoeWomen Cotton Solid Color Skinny Stretchy Pants Casual Yoga Leggings Black,https://www.walmart.com/ip/Women-Cotton-Solid-Color-Skinny-Stretchy-Pants-Casual-Yoga-Leggings-Black/224063652
524,"Fruit of the LoomFruit of the Loom Women's Plus Size Beyond Soft Wireless Cotton Bra, Style FT811",https://www.walmart.com/ip/Fruit-of-the-Loom-Women-s-Plus-Size-Beyond-Soft-Wireless-Cotton-Bra-Style-FT811/635824242
525,What's NextWhat's Next Women's Plus Size Ribbed Striped Flyaway Cardigan,https://www.walmart.com/ip/What-s-Next-Women-s-Plus-Size-Ribbed-Striped-Flyaway-Cardigan/321472436
526,"NKNike Unisex Everyday Cotton Cushioned Crew Training Socks with DRI-FIT Technology, White (6 Pairs)",https://www.walmart.com/ip/Nike-Unisex-Everyday-Cotton-Cushioned-Crew-Training-Socks-with-DRI-FIT-Technology-White-6-Pairs/439915194
527,"Collections Etc.Cable Knit Slippers with Pom Poms, Comfortable Booties for Women",https://www.walmart.com/ip/Cable-Knit-Slippers-with-Pom-Poms-Comfortable-Booties-for-Women/429105918
528,"No BoundariesNo Boundaries Juniors' Mid-Rise Bootcut Jeans, 2-Pack Bundle",https://www.walmart.com/ip/No-Boundaries-Juniors-Mid-Rise-Bootcut-Jeans-2-Pack-Bundle/466864779
529,"HanesHanes Women's Nylon Hi-Cut Panties, 6-Pack",https://www.walmart.com/ip/Hanes-Women-s-Nylon-Hi-Cut-Panties-6-Pack/38250128
530,Gloria VanderbiltGloria Vanderbilt Amanda Jeans,https://www.walmart.com/ip/Gloria-Vanderbilt-Amanda-Jeans/616389194
531,Time and TruTime and Tru Women's Plus Size Ribbed V-Neck Pullover Dolman Sleeve Sweater,https://www.walmart.com/ip/Time-and-Tru-Women-s-Plus-Size-Ribbed-V-Neck-Pullover-Dolman-Sleeve-Sweater/750342698
