,item_name,url
524,"Little Star OrganicLittle Star Organic Baby Toddler Boy Snug Fit Cotton Long Sleeve Pajamas, 2pc Set",https://www.walmart.com/ip/Little-Star-Organic-Baby-Toddler-Boy-Snug-Fit-Cotton-Long-Sleeve-Pajamas-2pc-Set/56097915
525,RustlerRustler Boys Relaxed Jeans Sizes 4-16 & Husky,https://www.walmart.com/ip/Rustler-Boys-Relaxed-Jeans-Sizes-4-16-Husky/22257050
526,N'Ice CapsN'Ice Caps Boys Thinsulate and Waterproof Colorblock Vented Ski Glove | Performance Style Kids Gloves for Winter Adventure,https://www.walmart.com/ip/N-Ice-Caps-Boys-Thinsulate-and-Waterproof-Colorblock-Vented-Ski-Glove-Performance-Style-Kids-Gloves-for-Winter-Adventure/162041304
527,"CrayolaCrayola Boys T-Shirt & Shorts, 2-Piece Outfit Set, Sizes 4-7",https://www.walmart.com/ip/Crayola-Boys-T-Shirt-Shorts-2-Piece-Outfit-Set-Sizes-4-7/221133806
528,lisenraIn2pcs Boy Kids Long Sleeve Spiderman T-shirt+Pants Outfits Pajama Set Sleepwear,https://www.walmart.com/ip/2pcs-Boy-Kids-Long-Sleeve-Spiderman-T-shirt-Pants-Outfits-Pajama-Set-Sleepwear/390380084
529,Wonder NationWonder Nation Toddler Boys' Lightweight Jacket,https://www.walmart.com/ip/Wonder-Nation-Baby-Toddler-Boys-Lightweight-Jacket/887323777
530,"FortniteFortnite Boys Underwear 4-Pack Boxer Briefs, Sizes 8-12",https://www.walmart.com/ip/Fortnite-Boys-Underwear-4-Pack-Boxer-Briefs-Sizes-8-12/368412896
531,Luvable FriendsNewborn Baby Boys Basic Cuff Socks 6 Pack,https://www.walmart.com/ip/Newborn-Baby-Boys-Basic-Cuff-Socks-6-Pack/52802203
532,"The AvengersAvengers Boys 4-10 Boxer Briefs, 3 Pack",https://www.walmart.com/ip/Avengers-Boys-4-10-Boxer-Briefs-3-Pack/520274008
533,"UmbroUmbro Boys Underwear, 10 Pack Cotton Briefs Sizes 4/5 - 14/16",https://www.walmart.com/ip/Umbro-Boys-Cotton-Brief-Underwear-10-Pack-Sizes-4-5-14-16/545071297
534,"Spider-ManSpiderman Toddler Boys' Brief Underwear, 7 Pack",https://www.walmart.com/ip/Spiderman-Toddler-Boys-Brief-Underwear-7-Pack/327663612
535,"The MandalorianBoy's Mandalorian hat, glove, and scarf set",https://www.walmart.com/ip/Boy-s-Mandalorian-hat-glove-and-scarf-set/842017447
536,HanesHanes Boys 4-18 Ecosmart Youth Hooded Sweatshirt,https://www.walmart.com/ip/Hanes-Boys-4-18-Ecosmart-Youth-Hooded-Sweatshirt/927870960
537,"Wonder NationWonder Nation Baby Toddler Unisex Socks, 20-Pack Neutral Ankle",https://www.walmart.com/ip/Wonder-Nation-Baby-Toddler-Unisex-Socks-20-Pack-Neutral-Ankle/168411661
538,The Children's PlaceThe Children's Place Boys Knit Long Sleeve Shirt Sizes 4-16,https://www.walmart.com/ip/The-Children-s-Place-Boys-4-16-Long-Sleeve-Knit-Shirt/826977779
539,"Fruit of the LoomFruit of the Loom Boys Ankle Sock, 18 Pack (Toddler Boys)",https://www.walmart.com/ip/Fruit-of-the-Loom-Toddler-Boys-Cushion-Gripper-Ankle-Socks-18-Pack/974151877
540,"Wonder NationWonder Nation Boys Husky School Uniform Long Sleeve Pique Polo Shirt, 2-Pack Value Bundle, Sizes 8-18",https://www.walmart.com/ip/Wonder-Nation-Boys-Husky-School-Uniform-Long-Sleeve-Pique-Polo-Shirt-2-Pack-Value-Bundle-Sizes-8-18/867702806
541,JERZEESJerzees Mid-Weight Fleece Full-Zip Hooded Sweatshirt (Little Boys & Big Boys),https://www.walmart.com/ip/Jerzees-Mid-Weight-Fleece-Full-Zip-Hooded-Sweatshirt-Little-Boys-Big-Boys/54734381
542,"GenericV.I.P. Boys Exclusive Fall Graphic T-Shirts 2-Pack, Sizes 4-18",https://www.walmart.com/ip/V-I-P-Boys-Exclusive-Fall-Graphic-T-Shirts-2-Pack-Sizes-4-18/624445367
543,"Cozy JamsCozy Jams Boys French Terry Pajamas, 3-Piece Set, Sizes 4-14",https://www.walmart.com/ip/Cozy-Jams-Boys-French-Terry-Pajamas-3-Piece-Set-Sizes-4-14/442317813
544,"Little RebelsLittle Rebels Toddler Boy Hoodie Sweatshirt & Jogger Pants Outfit Set, 2-Piece (2T-4T)",https://www.walmart.com/ip/Little-Rebels-Toddler-Boy-Hoodie-Sweatshirt-Jogger-Pants-Outfit-Set-2-Piece-2T-4T/412053582
545,"Fruit of the LoomFruit of the Loom Boys Socks,12 Pack No Show Active Sizes M - L",https://www.walmart.com/ip/Fruit-of-the-Loom-Boys-Socks-12-Pack-No-Show-Active-Sizes-M-L/804800268
546,"Ryan's WorldRyan's World Boys Red Titan & Friends w/ Velcro Mask Long Sleeve, Sizes 4-7",https://www.walmart.com/ip/Ryan-s-World-Boys-Red-Titan-Friends-w-Velcro-Mask-Long-Sleeve-Sizes-4-7/841476504
547,"GaranimalsGaranimals Baby Boy & Toddler Boy Thermal Henley T-Shirt & Denim Jeans Outfit Set, 3-Piece (12M-5T)",https://www.walmart.com/ip/Garanimals-Baby-Boy-Toddler-Boy-Thermal-Henley-T-Shirt-Denim-Jeans-Outfit-Set-3-Piece-12M-5T/519603448
548,"GaranimalsGaranimals Baby Boy & Toddler Boy Fleece Sweatshirts, 4-Pack (12M-5T)",https://www.walmart.com/ip/Garanimals-Baby-Boy-Toddler-Boy-Fleece-Sweatshirts-4-Pack-12M-5T/621849520
549,LEGOLego Star Wars Boys 2-Piece Hooded Pajama Set Sizes 4-12,https://www.walmart.com/ip/Lego-Star-Wars-Boys-2-Piece-Hooded-Pajama-Set-Sizes-4-12/414959408
550,Fruit of the LoomYouth 5 oz. HD Cotton T-Shirt,https://www.walmart.com/ip/Youth-5-oz-HD-Cotton-T-Shirt/174782178
551,"MarioMario Boys Long Sleeve Pajama Set, 2-Piece, Sizes 4-16",https://www.walmart.com/ip/Mario-Boys-Long-Sleeve-Pajama-Set-2-Piece-Sizes-4-16/629235636
552,Fruit of the LoomFruit of the Loom 5Pack Boys Exposed-Waistband Boxers Boxer Shorts Underwear L,https://www.walmart.com/ip/Boys-Assorted-Covered-Waistband-Boxers-5-Pack/34319490
553,ColortoneTie-Dye Spider Hoodies Sweatshirts Adult,https://www.walmart.com/ip/Tie-Dye-Spider-Hoodies-Sweatshirts-Adult/762585076
554,"GerberGerber Baby Boys or Baby Girls Wiggle-Proof White Jersey Ankle Bootie Socks, 8-Pack",https://www.walmart.com/ip/Gerber-Baby-Boys-or-Baby-Girls-Wiggle-Proof-White-Jersey-Ankle-Bootie-Socks-8-Pack/56265994
555,"Fruit of the LoomFruit of the Loom Boys Socks, 12 Pack Low Cut Everyday Active Sizes M - L",https://www.walmart.com/ip/Fruit-of-the-Loom-Boys-Socks-12-Pack-Low-Cut-Everyday-Active-Sizes-M-L/471665246
556,"GaranimalsGaranimals Baby Boy & Toddler Boy Thermal Henley T-Shirt, 3-Pack (12M-5T)",https://www.walmart.com/ip/Garanimals-Baby-Boy-Toddler-Boy-Thermal-Henley-T-Shirt-3-Pack-12M-5T/306306991
557,"MarioMario Boys 2-Pack Lounge Pajama Pants, Sizes 4-12",https://www.walmart.com/ip/Mario-Boys-2-Pack-Lounge-Pajama-Pants-Sizes-4-12/951415162
558,"Wonder NationWonder Nation Toddler Boys School Uniform Short Sleeve Double Pique Polo Shirt, 2-Pack Value Bundle",https://www.walmart.com/ip/Wonder-Nation-Toddler-Boys-School-Uniform-Short-Sleeve-Double-Pique-Polo-Shirt-2-Pack-Value-Bundle/715307887
559,"Star WarsStar Wars Mandalorian Boys Underwear, 6 Pack Boxer Briefs Sizes 4 - 10",https://www.walmart.com/ip/Star-Wars-Mandalorian-Boys-Underwear-6-Pack-Boxer-Briefs-Sizes-4-10/212373607
560,"Fruit of the LoomFruit of the Loom Boys Underwear, 10 pack Cotton Stretch Boxer Briefs (Big Boys)",https://www.walmart.com/ip/Fruit-of-the-Loom-Boys-Underwear-10-pack-Cotton-Stretch-Boxer-Briefs-Big-Boys/385061774
561,"GerberGerber Baby & Toddler Boys Wiggle Proof Jersey ""No Show"" Socks, 8-pack",https://www.walmart.com/ip/Gerber-Baby-and-Toddler-Boys-Jersey-No-Show-Wiggle-Proof-Socks-8-Pack/414135672
562,"LEGOLego Ninjago Boys Pajama Union Suit, Sizes 4-12",https://www.walmart.com/ip/Lego-Ninjago-Boys-Pajama-Union-Suit-Sizes-4-12/518236395
563,"IXtremeiXtreme Boys Classic Colorblock Puffer Coat, Sizes 4-18",https://www.walmart.com/ip/iXtreme-Boys-Classic-Colorblock-Puffer-Coat-Sizes-4-18/516791386
564,Awkward StylesAwkward Styles Feliz Navidad Pajamas for Christmas Family Pajamas Matching Xmas Pajama,https://www.walmart.com/ip/Awkward-Styles-Feliz-Navidad-Pajamas-for-Christmas-Family-Pajamas-Matching-Xmas-Pajama/234785869
565,"CherokeeCherokee Boys Colorblock Puffer Jacket, Sizes 4-18",https://www.walmart.com/ip/Cherokee-Boys-Colorblock-Puffer-Jacket-Sizes-4-18/156563515
566,Petit LemPetit Lem Boys Long Sleeve Long Pant 2-Piece Pajama Set Sizes 4-10,https://www.walmart.com/ip/Petit-Lem-Boys-Long-Sleeve-Long-Pant-2-Piece-Pajama-Set-Sizes-4-10/825110002
567,"Luvable FriendsToddler Boy Tapered Pants, 3-pack",https://www.walmart.com/ip/Toddler-Boy-Tapered-Pants-3-pack/56252974
568,"Fruit of the LoomFruit of the Loom Boys Low Cut Sock, 18 Pack (Toddler Boys)",https://www.walmart.com/ip/Fruit-of-the-Loom-Toddler-Boys-Cushion-Gripper-Low-Cut-Socks-18-Pack/970076437
569,Child of Mine by Carter'sChild of Mine Boys Christmas 2-Pack Microfleece Pajama Blanket Sleeper Sizes 5-8,https://www.walmart.com/ip/Child-of-Mine-Boys-Christmas-2-Pack-Microfleece-Pajama-Blanket-Sleeper-Sizes-5-8/924636342
570,LeveretLeveret Solid Turtleneck 100% Cotton (2-14 Years),https://www.walmart.com/ip/Leveret-Boys-Girls-Kids-100-Cotton-Turtleneck-Aqua-3-Years/266796623
571,"HANDS ONSK1025, Boys Premium Pack-Down Ski Glove, 100% Waterproof, 3M Thinsulate Lined (One Size Fits Most)",https://www.walmart.com/ip/SK1025-Boys-Premium-Pack-Down-Ski-Glove-100-Waterproof-3M-Thinsulate-Lined-One-Size-Fits-Most/466291436
572,"FortniteFortnite Boys Socks, 10 + 1 Bonus Pack, Sizes 6/8-9/11",https://www.walmart.com/ip/Fortnite-Boys-Socks-11-Pack-Socks-Sizes-6-8-9-11/485529715
573,"BatmanDC Comics Batman Boys Classic Logo Hoodie, Sizes 4-18",https://www.walmart.com/ip/DC-Comics-Batman-Boys-Classic-Logo-Hoodie-Sizes-4-18/767377701
574,"Mickey MouseMickey Mouse Toddler Boy Graphic T-Shirt, 2-Pack (2T-5T)",https://www.walmart.com/ip/Mickey-Mouse-Toddler-Boy-Graphic-T-Shirt-2-Pack-2T-5T/727907207
575,"Wonder NationWonder Nation Boys Underwear, 10 Pack Dino Boxer Brief Sizes S - XL",https://www.walmart.com/ip/Wonder-Nation-Boys-Underwear-10-Pack-Dino-Boxer-Brief-Sizes-S-XL/382101880
576,"IXtremeiXtreme Boys Textured Colorblocked Puffer Coat, Sizes 4-18",https://www.walmart.com/ip/iXtreme-Boys-Textured-Colorblocked-Puffer-Coat-Sizes-4-18/115195977
577,"PAW PatrolPaw Patrol Baby Boy & Toddler Boy Sweatshirt & Jogger Pants Outfit Set, 2-Piece (12M-4T)",https://www.walmart.com/ip/Paw-Patrol-Baby-Boy-Toddler-Boy-Sweatshirt-Jogger-Pants-Outfit-Set-2-Piece-12M-4T/40599582
578,N'Ice CapsNICE CAPS Kids Winter Snow Waterproof and Thinsulate Lined Insulated Easy On Zip-Up Reflector Ski Snowboarder Gloves - Fits Boys Girls Toddler Youth Children Child,https://www.walmart.com/ip/NICE-CAPS-Kids-Winter-Snow-Waterproof-Thinsulate-Lined-Insulated-Easy-On-Zip-Up-Reflector-Ski-Snowboarder-Gloves-Fits-Boys-Girls-Toddler-Youth-Childr/108121672
579,"Spider-ManSpider-Man Toddler Boy Graphic T-Shirt, 2-Pack (2T-5T)",https://www.walmart.com/ip/Spider-Man-Toddler-Boy-Graphic-T-Shirt-2-Pack-2T-5T/390112334
580,Ecko Unltd.Ecko Unltd. Boys' 11-Pack Quarter Socks,https://www.walmart.com/ip/Ecko-Unltd-Boys-11-Pack-Quarter-Socks/326525179
581,"Star WarsStar Wars Boys Baby Yoda This Is The Way & Bounty Hunter T-Shirts 2-Pack, Sizes 4-18",https://www.walmart.com/ip/Star-Wars-Boys-Baby-Yoda-This-Is-The-Way-Bounty-Hunter-T-Shirts-2-Pack-Sizes-4-18/772358205
582,XIAXAIXU2PCS Toddler Baby Boy Spring Autumn Clothes Shark Hooded Sweater+Pants Leggings Outfits Set 6-12 Months,https://www.walmart.com/ip/2PCS-Toddler-Baby-Boy-Spring-Autumn-Clothes-Shark-Hooded-Sweater-Pants-Leggings-Outfits-Set-6-12-Months/409607177
583,"Wonder NationWonder Nation Toddler Boys Underwear, 18-Pack Covered Elastic Boxer Briefs",https://www.walmart.com/ip/Wonder-Nation-Toddler-Boys-Underwear-18-Pack-Covered-Elastic-Boxer-Briefs/379286956
584,"Saint EveSaint Eve Boys Short Sleeve, Long Pant and Short, 3-Piece Pajama Set Sizes 4-16",https://www.walmart.com/ip/Saint-Eve-Boys-Short-Sleeve-Long-Pant-and-Short-3-Piece-Pajama-Set-Sizes-4-16/254652092
585,"CrayolaCrayola Boys Long Sleeve Graphic T-Shirt & Jogger Pants, 2-Piece Outfit Set, Sizes 4-7",https://www.walmart.com/ip/Crayola-Boys-Long-Sleeve-Graphic-T-Shirt-Jogger-Pants-2-Piece-Outfit-Set-Sizes-4-7/480439129
586,"Mickey MouseMickey Mouse Toddler Boys Low-Cut Socks, 10-Pack",https://www.walmart.com/ip/Mickey-Mouse-Toddler-Boys-Low-Cut-Socks-10-Pack/225290433
587,"Vertical 9Vertical 9 Boys Colorblock Camo Detail Puffer Coat, Sizes 4-16",https://www.walmart.com/ip/Vertical-9-Boys-Colorblock-Camo-Detail-Puffer-Coat-Sizes-4-16/722801421
588,"Disney JuniorMickey Mouse Toddler Boys' Christmas Pajamas, 2 Piece Set",https://www.walmart.com/ip/Mickey-Mouse-Toddler-Boys-Christmas-Pajamas-Set-2-Piece/663502506
589,"365 Kids From Garanimals365 Kids From Garanimals Boys Dino Sequin Sweatshirt & Jogger Sweatpants, 2-Piece Outfit Set, Size 4-10",https://www.walmart.com/ip/365-Kids-From-Garanimals-Boys-Dino-Sequin-Sweatshirt-Jogger-Sweatpants-2-Piece-Outfit-Set-Size-4-10/921320558
590,"Fruit of the LoomFruit of the Loom Assorted Print Boxer Brief Underwear, 5 Pack (Toddler Boys)",https://www.walmart.com/ip/Fruit-of-the-Loom-Assorted-Print-Boxer-Brief-Underwear-5-Pack-Toddler-Boys/36687540
591,LookwoildLookwoild Kids Boys Spider man Top T-shirt+Pants Outfit Pajama Sleepwear Set,https://www.walmart.com/ip/Lookwoild-Kids-Boys-Spider-man-Top-T-shirt-Pants-Outfit-Pajama-Sleepwear-Set/924979936
592,"MinecraftMinecraft Boys Pocket Creeper & Time To Mine Graphic T-Shirts 2-Pack, Sizes 4-18",https://www.walmart.com/ip/Minecraft-Boys-Pocket-Creeper-Time-To-Mine-Graphic-T-Shirts-2-Pack-Sizes-4-18/372389668
593,"One Point OneOne Point One Boys Splatter Long Sleeve Hoodie, Sizes 8-18",https://www.walmart.com/ip/One-Point-One-Boys-Splatter-Long-Sleeve-Hoodie-Sizes-8-18/941004570
594,Jellifish KidsJellifish Kids Boys Printed Jogger Pajama Pant Sizes 4-16,https://www.walmart.com/ip/Jellifish-Kids-Boys-Printed-Jogger-Pajama-Pant-Sizes-4-16/704986484
595,"Spider-ManSpider-Man, Boys Underwear, 6 Pack Boxer Briefs (Little Boys & Big Boys)",https://www.walmart.com/ip/Spider-Man-Boys-Underwear-6-Pack-Boxer-Briefs-Little-Boys-Big-Boys/930184536
596,"Jurassic WorldJurassic World Boys Underwear, 4 Pack Athletic Boxer Briefs (Little Boys & Big Boys)",https://www.walmart.com/ip/Jurassic-World-Boys-Underwear-4-Pack-Athletic-Boxer-Briefs-Little-Boys-Big-Boys/351838979
597,LeveretLeveret Kids Fleece Sleep Hooded Robe Multiple Colors (2T-14 Years),https://www.walmart.com/ip/Leveret-Kids-Fleece-Sleep-Hooded-Robe-Green-Size-8-Years/993013868
598,"365 Kids From Garanimals365 Kids From Garanimals Boys Button Down Shirts, 2-Pack, Sizes 4-10",https://www.walmart.com/ip/365-Kids-From-Garanimals-Boys-Button-Down-Shirts-2-Pack-Sizes-4-10/194291578
599,Wonder NationWonder Nation Foodie Taco Slippers (Little Boys & Big Boys),https://www.walmart.com/ip/Wonder-Nation-Foodie-Taco-Slippers-Little-Boys-Big-Boys/936881223
600,"HanesHanes Boys Socks, 10 Pack No Show, Sizes S - L",https://www.walmart.com/ip/Hanes-Boys-No-Show-Socks-10-Pack/29558003
601,VKWEARBoys Kids Athletic Soft Sherpa Lined Fleece Zip Up Hoodie Sweater Jacket,https://www.walmart.com/ip/Boys-Kids-Athletic-Soft-Sherpa-Lined-Fleece-Zip-Up-Hoodie-Sweater-Jacket/329368825
602,"Spider-ManMarvel Spider-Man Boys' 4-10 Boxer Briefs, 3 Pack",https://www.walmart.com/ip/Marvel-Spider-Man-Boys-4-10-Boxer-Briefs-3-Pack/901733021
603,"Fruit of the LoomFruit of the Loom Boys 4-18 Soft Short Sleeve Crewneck T Shirts, Multi-Color 3 Pack",https://www.walmart.com/ip/Fruit-of-the-Loom-Boys-4-18-Soft-Short-Sleeve-Crewneck-T-Shirts-Multi-Color-3-Pack/261712387
604,TrevcoHarry Potter - Gryffindor Crest - Youth Hooded Sweatshirt - Small,https://www.walmart.com/ip/Harry-Potter-Gryffindor-Crest-Youth-Hooded-Sweatshirt-Small/898024599
605,"PJ MasksPJ Masks Baby Boys' & Toddler Boys' Quarter Socks, 6 Pack",https://www.walmart.com/ip/PJ-Masks-Baby-Boys-Toddler-Boys-Quarter-Socks-6-Pack/711241996
606,Luvable FriendsLuvable Friends Toddler Boy Tapered Ankl,https://www.walmart.com/ip/Luvable-Friends-Toddler-Boy-Tapered-Ankl/56051351
607,Wonder NationWonder Nation Boys Jacquard Short Sleeve T-Shirt 2 Pack Sizes 4-18 & Husky,https://www.walmart.com/ip/Wonder-Nation-Boys-Jacquard-Short-Sleeve-T-Shirt-2-Pack-Sizes-4-18-Husky/243546349
608,Just BornJust Born Organic Toddler Boys' 2-Pack Organic 2-Piece Pajamas,https://www.walmart.com/ip/Just-Born-Organic-Toddler-Boys-2-Pack-Organic-2-Piece-Pajamas/751277524
609,"Wonder NationWonder Nation Boys Sherpa Zip Jacket, Sizes 4-18",https://www.walmart.com/ip/Wonder-Nation-Boys-Faux-Sherpa-Zip-Jacket-Sizes-4-18/487080216
610,"Disney Pixar Toy StoryDisney Toy Story Boys 4-14 Buzz ""Airplane Mode On"" Graphic Short Sleeve T-Shirt",https://www.walmart.com/ip/Disney-Toy-Story-Boys-4-14-Buzz-Airplane-Mode-On-Graphic-Short-Sleeve-T-Shirt/826673444
611,"BuffaloBuffalo Boys Slim Straight Fit Pants, Sizes 8-18",https://www.walmart.com/ip/Buffalo-Boys-Slim-Straight-Fit-Pants-Sizes-8-18/402708328
612,"Little Star OrganicLittle Star Organic Baby Toddler Boy Potty Training Pants Underwear, 4-Pack",https://www.walmart.com/ip/Little-Star-Organic-Baby-Toddler-Boy-Potty-Training-Pants-Underwear-4-Pack/172274984
613,"GerberGerber Toddler Boys' Boxer Briefs, 7-Pack",https://www.walmart.com/ip/Gerber-Toddler-Boys-Boxer-Briefs-7-Pack/892183585
614,"ArrowArrow Aroflex Stretch Poplin Fashion Dress Shirt and Tie, 2 Piece Set (Little Boys & Big Boys)",https://www.walmart.com/ip/Arrow-Aroflex-Stretch-Poplin-Fashion-Dress-Shirt-and-Tie-2-Piece-Set-Husky-Boys/480610024
615,ArrowArrow Aroflex Boys Stretch Herringbone Suit,https://www.walmart.com/ip/Arrow-Aroflex-Boys-Stretch-Herringbone-Suit-Little-Boys-Big-Boys/781080076
616,"WrightsWrights Mix & Match Outfits, 4pc Active Set (Toddler Boys)",https://www.walmart.com/ip/Wrights-Mix-Match-Outfits-4pc-Active-Set-Toddler-Boys/987795472
617,"Sleep On ItSleep On It Boys Fleece Pajama Pants Set, 2-Piece, Sizes 6-14",https://www.walmart.com/ip/Sleep-On-It-Boys-Fleece-Pajama-Pants-Set-2-Piece-Sizes-6-14/873641226
618,"Marvel Super Hero AdventuresMarvel Super Hero Adventures Toddler Boys Training Pants, 7-Pack",https://www.walmart.com/ip/Marvel-Super-Hero-Adventures-Toddler-Boys-Training-Pants-7-Pack/945000607
619,"Mickey MouseMickey Mouse Halloween Baby Toddler Boy Long Sleeve Snug Fit Cotton Pajamas, 2pc Set",https://www.walmart.com/ip/Mickey-Mouse-Halloween-Baby-Toddler-Boy-Long-Sleeve-Snug-Fit-Cotton-Pajamas-2pc-Set/672082099
620,"FortniteFortnite Boys Logo Graphic Short Sleeve Camo T-Shirt, 8-18",https://www.walmart.com/ip/Fortnite-Boys-Logo-Graphic-Short-Sleeve-Camo-T-Shirt-8-18/720840845
621,BagilaanoeNewborn Baby Boys Clothes Little Man Romper+Deer Leggings Pants+Hat Outfits Set,https://www.walmart.com/ip/Newborn-Baby-Boys-Clothes-Little-Man-Romper-Deer-Leggings-Pants-Hat-Outfits-Set/560399967
622,"Justice LeagueDC Comics Justice League Boys Underwear, 5 Pack Boxer Briefs (Little Boys & Big Boys)",https://www.walmart.com/ip/DC-Comics-Justice-League-Boys-Underwear-5-Pack-Boxer-Briefs-Little-Boys-Big-Boys/22866982
623,"Mickey MouseMickey Mouse Toddler Boys Long Sleeve Microfleece Pajamas, 2pc Set",https://www.walmart.com/ip/Mickey-Mouse-Toddler-Boys-Long-Sleeve-Microfleece-Pajamas-2pc-Set/640240838
624,"RussellRussell Boys Stretch Knit Full Zip Performance Jacket, Sizes 4-18",https://www.walmart.com/ip/Russell-Boys-Stretch-Knit-Full-Zip-Performance-Jacket-Sizes-4-18/450434233
625,Spring NotionSpring Notion Boy's Cotton Blend Long Sleeve Dress Shirt,https://www.walmart.com/ip/Spring-Notion-Boy-s-Cotton-Blend-Long-Sleeve-Dress-Shirt/423821016
626,"Wonder NationWonder Nation Boys School Uniform Long Sleeve Pique Polo Shirt, 4-Pack Value Bundle, Sizes 4-18",https://www.walmart.com/ip/Wonder-Nation-Boys-School-Uniform-Long-Sleeve-Pique-Polo-Shirt-4-Pack-Value-Bundle-Sizes-4-18/509696920
627,"BatmanSuper Mario Bros. Boys Mario Kart & Friends Graphic Short Sleeve T-Shirts, 2 Pack ,Sizes 4-18",https://www.walmart.com/ip/Super-Mario-Bros-Boys-Mario-Kart-Friends-Graphic-Short-Sleeve-T-Shirts-2-Pack-Sizes-4-18/271765687
628,"DickiesDickies Boys School Uniform Classic Fit Straight Leg Flat Front Pants, Sizes 4-20 & Husky",https://www.walmart.com/ip/Dickies-Boys-School-Uniform-Classic-Fit-Straight-Leg-Flat-Front-Pants-Sizes-4-20-Husky/370161579
629,FortniteFortnite Boys Hooded Pajama Blanket Sleeper,https://www.walmart.com/ip/Fortnite-Boys-Hooded-Pajama-Blanket-Sleeper/655280707
630,"BatmanSuper Mario Bros. Boys Classic!! Graphic Long Sleeve T-Shirt, Sizes 4-18",https://www.walmart.com/ip/Super-Mario-Bros-Boys-Classic-Graphic-Long-Sleeve-T-Shirt-Sizes-4-18/483510460
631,"Spider-ManMarvel Spider-Man Boys Exclusive Motion Graphic Long Sleeve T-Shirt, Sizes 4-18",https://www.walmart.com/ip/Marvel-Spider-Man-Boys-Exclusive-Motion-Graphic-Long-Sleeve-T-Shirt-Sizes-4-18/359680138
632,SkylinewearsMens Biker Leg Fashion Skinny Fit Stretch Slim Destroyed Denim Jeans,https://www.walmart.com/ip/Mens-Biker-Leg-Fashion-Skinny-Fit-Stretch-Slim-Destroyed-Denim-Jeans/795805479
633,"Wonder NationWonder Nation Boys Socks, 15 Pack No Show Sizes S - L",https://www.walmart.com/ip/Wonder-Nation-Boys-Socks-15-Pack-No-Show-Sizes-S-L/591114974
634,Tony HawkTony Hawk Boys Colorblock Pullover Hoodie Sizes 4-16,https://www.walmart.com/ip/Tony-Hawk-Boys-Colorblock-Pullover-Hoodie-Sizes-4-16/264047103
635,"The Children's PlaceThe Children's Place Boys 4-16 Waffle Thermal Shirt, 2-Pack",https://www.walmart.com/ip/The-Children-s-Place-Boys-4-16-Waffle-Thermal-Shirt-2-Pack/605374668
636,"HollywoodHollywood Boys Honeycomb Microfleece Jogger Sweatpants, Sizes 8-18",https://www.walmart.com/ip/Hollywood-Boys-Honeycomb-Microfleece-Jogger-Sweatpants-Sizes-8-18/709785703
637,Fruit of the LoomFruit of the Loom Boys 6-20 HD Cotton Long Sleeve T-Shirt,https://www.walmart.com/ip/Fruit-of-the-Loom-Boys-6-20-HD-Cotton-Long-Sleeve-T-Shirt/113458946
638,Sesame StreetSesame Street Elmo Boys Girls Sock Top Slippers STF5521BSS,https://www.walmart.com/ip/Sesame-Street-Elmo-Boys-Girls-Sock-Top-Slippers-STF5521BSS/888503167
639,"Sonic the HedgehogSonic the Hedgehog Boys Underwear, 10 Pack Briefs Sizes 4 -8",https://www.walmart.com/ip/Sonic-the-Hedgehog-Boys-Underwear-10-Pack-Briefs-Sizes-4-8/642178851
640,"Fruit of the LoomFruit of the Loom Boys Underwear, Breathable Cotton Boxer Briefs, 10 Pack Sizes 6/8 - 18/20",https://www.walmart.com/ip/Fruit-of-the-Loom-Boys-Underwear-Breathable-Cotton-Boxer-Briefs-10-Pack-Sizes-6-8-18-20/569416572
641,"Mickey MouseDisney Mickey Mouse Boys Half-Zip Sweatshirt & Jogger Sweatpants, 2-Piece Outfit Set, Sizes 4-7",https://www.walmart.com/ip/Disney-Mickey-Mouse-Boys-Half-Zip-Sweatshirt-Jogger-Sweatpants-2-Piece-Outfit-Set-Sizes-4-7/156962533
642,"Danskin NowDanskin Now Girls Ballet, Dance & Gymnastics Premium Nylon Short with Criss Cross Front XXS - XL",https://www.walmart.com/ip/Danskin-Now-Girls-4-16-Ballet-Dance-Gymnastics-Premium-Nylon-Shorts-with-Criss-Cross-Front/919424760
643,"Walmart Digital Photo CenterPhoto T-Shirt, Youth Large",https://www.walmart.com/ip/Photo-T-Shirt-Youth-Large/5027085
644,AME SleepwearAME Sleepwear Boys 2-Pack Short Pajama Set Sizes 4-16,https://www.walmart.com/ip/AME-Sleepwear-Boys-2-Pack-Short-Pajama-Set-Sizes-4-16/367222488
645,AllTopBargainsAll Top Bargains 6 Pairs Boys Socks Crew Wholesale Casual Size 4-6 4T 5T Lot Little Kids Fashion,https://www.walmart.com/ip/All-Top-Bargains-6-Pairs-Boys-Socks-Crew-Wholesale-Casual-Size-4-6-4T-5T-Lot-Little-Kids-Fashion/493774974
646,"LagunaLaguna Boys UPF 50+ Shark Print Swim Trunk Shorts with Back Pocket, Sizes 8-20",https://www.walmart.com/ip/Laguna-Boys-UPF-50-Shark-Print-Swim-Trunk-Shorts-with-Back-Pocket-Sizes-8-20/632361693
647,"Justice LeagueJustice League Boys Underwear, 4 Pack Athletic Boxer Briefs (Little Boys & Big Boys)",https://www.walmart.com/ip/Justice-League-Boys-Underwear-4-Pack-Athletic-Boxer-Briefs-Little-Boys-Big-Boys/679447532
648,"ChampionChampion Boys Socks, 6 Pack Logo Ankle Socks, Sizes M-L",https://www.walmart.com/ip/Champion-Boys-Socks-6-Pack-Logo-Ankle-Socks-Sizes-M-L/707517607
649,Falari12 Pairs Girl Toddler Kids Cotton Crew Socks,https://www.walmart.com/ip/12-Pairs-Girl-Toddler-Kids-Cotton-Crew-Socks/227390214
650,HanesHanes Boys Undershirt 3 Pack T-Shirt Sizes 6/8 - 18/20,https://www.walmart.com/ip/Hanes-Boys-Undershirt-3-Pack-T-Shirt-Sizes-6-8-18-20/873264
651,ColortoneTie-Dye Multicolor Hoodies Sweatshirts Adult,https://www.walmart.com/ip/Tie-Dye-Multicolor-Hoodies-Sweatshirts-Adult/653110117
652,"Fruit of the LoomFruit of the Loom Classic White Crew Undershirts, 5-Pack (Husky)",https://www.walmart.com/ip/Fruit-of-the-Loom-Classic-White-Crew-Undershirts-5-Pack-Husky/493540212
653,"V.I.P.AME Sleepwear Boys 2-Pack Lounge Pajama Pants, Sizes 4-12",https://www.walmart.com/ip/AME-Sleepwear-Boys-2-Pack-Lounge-Pajama-Pants-Sizes-4-12/237130510
654,PupeezPupeez Boy's Winter Ultra Comfort & Cozy Clog Slippers -Kids,https://www.walmart.com/ip/Pupeez-Boy-s-Winter-Ultra-Comfort-Cozy-Clog-Slippers-Kids/885855150
655,"YokiYoki Boys Heavyweight Nylon Bomber Jacket with Fur Trim Hood, Sizes 8-20",https://www.walmart.com/ip/Yoki-Boys-Heavyweight-Nylon-Bomber-Jacket-with-Fur-Trim-Hood-Sizes-8-20/480978444
656,"No BoundariesNo Boundaries Men's Printed Crew Socks, 3-Pack",https://www.walmart.com/ip/No-Boundaries-Men-s-Printed-Crew-Socks-3-Pack/232682768
657,CanisFashion Toddler Kids Boys Tops T-shirt Camo Pants 2Pcs Outfits Set Clothes Fit For 1-6T,https://www.walmart.com/ip/Fashion-Toddler-Kids-Boys-Tops-T-shirt-Camo-Pants-2Pcs-Outfits-Set-Clothes-Fit-For-1-6T/216458678
658,Port & CompanyBoys 5.4-oz 100% Cotton T-Shirt PC54Y,https://www.walmart.com/ip/PC54Y-Port-Company-5-4-oz-100-Cotton-T-Shirt-Child-Tshirt/881761472
659,"ThermajohnThermajohn Boy's Thermals, Ultra Soft Thermal Underwear Set with Fleece Lining (Little Boys & Big Boys)",https://www.walmart.com/ip/Thermajohn-Boy-s-Ultra-Soft-Thermal-Underwear-Long-Johns-Set-with-Fleece-Lined/923374600
660,ArrowArrow Aroflex Stretch Flat Front Dress Pant (Husky Boys),https://www.walmart.com/ip/Arrow-Aroflex-Stretch-Flat-Front-Dress-Pant-Husky-Boys/374976943
661,"PolarWearPolar Wear Boy's 3 Piece Knit Hat, Scarf & Gloves Set in 4 Fun Designs",https://www.walmart.com/ip/Polar-Wear-Boy-s-3-Piece-Knit-Hat-Scarf-Gloves-Set-in-4-Fun-Designs/708239959
662,"Super Mario Bros.Super Mario Bros. Boys Underwear, 4 Pack Athletic Boxer Briefs (Little Boys & Big Boys)",https://www.walmart.com/ip/Super-Mario-Bros-Boys-Underwear-4-Pack-Athletic-Boxer-Briefs-Little-Boys-Big-Boys/308751259
