,item_name,url
0,"RBXRBX Boys Tricot Athletic Joggers 2-Pack Pants, Sizes 4-20",https://www.walmart.com/ip/RBX-Boys-Tricot-Athletic-Joggers-2-Pack-Pants-Sizes-4-20/538981701
1,"HOLLYWOODHollywood Boys Ottoman Jogger, Sizes 8-18",https://www.walmart.com/ip/Hollywood-Boys-Ottoman-Joggers-Sizes-8-18/285406016
2,"Brooklyn VerticalBrooklyn Vertical Boys' 2 Pack T-Shirts, Sizes 8-20",https://www.walmart.com/ip/Brooklyn-Vertical-Boys-2-Pack-T-Shirts-Sizes-8-20/297348471
3,"Wonder NationWonder Nation Boys Long Sleeve Thermals 2-Pack, Sizes 4-18 & Plus",https://www.walmart.com/ip/Wonder-Nation-Boys-Long-Sleeve-Thermals-2-Pack-Sizes-4-18-Husky/721606776
4,"St. EveSaint Eve Boys Long Sleeve Long Pant 2-Piece Pajama Set, Sizes 4-18 & Husky",https://www.walmart.com/ip/Saint-Eve-Boys-Long-Sleeve-Long-Pant-2-Piece-Pajama-Set-Sizes-4-18-Husky/329179869
5,"GaranimalsGaranimals Baby Boy & Toddler Boy Long-Sleeve Mix & Match Outfits Kid-Pack Gift Box, 8-Piece (12M-5T)",https://www.walmart.com/ip/Garanimals-Baby-Boy-Toddler-Boy-Long-Sleeve-Mix-Match-Outfits-Kid-Pack-Gift-Box-8-Piece-12M-5T/850854219
6,"HollywoodHollywood Boys Shark Hoodie Sweatshirt & Jogger Sweatpants, 2-Piece Outfit Set, Sizes 4-7",https://www.walmart.com/ip/Hollywood-Boys-Shark-Hoodie-Sweatshirt-Jogger-Sweatpants-2-Piece-Outfit-Set-Sizes-4-7/771867707
7,"SpongeBob SquarePantsSpongeBob Boys Underwear, 6 Pack Boxer Briefs Sizes 4 - 10",https://www.walmart.com/ip/SpongeBob-Boys-Underwear-6-Pack-Boxer-Briefs-Size-4/722451991
8,"RussellRussell, Boys Thermal Underwear, Mid-weight Performance Super Soft Baselayer Sizes 4/5 - 14/16",https://www.walmart.com/ip/Russell-Boys-Thermal-Underwear-Mid-weight-Performance-Super-Soft-Baselayer-Sizes-4-5-14-16/570165468
9,"Fruit of the LoomFruit of the Loom Boys Thermals, Waffle Thermal Set Sizes 4/5 - 18",https://www.walmart.com/ip/Fruit-of-the-Loom-Boys-Thermals-Waffle-Thermal-Set-Sizes-4-5-18/589060536?wpa_bd=&wpa_pg_seller_id=F55CDC31AB754BB68FE0B39041159D63&wpa_ref_id=wpaqs:f2rxhFcDdjo8MYqKP1AttDCIctp_fni87ccHZR9qRnBIYPgQAsp6jmUmkwzZFwGZ9YYJoTUwhNTE3zkULQJUA-64540uerC2-lutTxT2H1ZPyfnvGnDIXnmtTVJW9Oth3aFZCMVRxXNGYPCn89XFvVUGpKaGwowvAT0o0_m3eZMBLYp-RRqXaaII48zdeWlAlNjY_3WoYkVJIUxhnI3EXQ&wpa_tag=&wpa_aux_info=&wpa_pos=10&wpa_plmt=1145x1145_T-C-IG_TI_1-6_HL-INGRID-GRID-NY&wpa_aduid=a7dc7b51-2971-461e-8729-0c11653f19a7&wpa_pg=browse&wpa_pg_id=5438_7712430_7809949&wpa_st=__searchterms__&wpa_tax=5438_7712430_7809949&wpa_bucket=__bkt__
10,"BuffaloBuffalo Boys Slim Straight Fit Pants, Sizes 8-18",https://www.walmart.com/ip/Buffalo-Boys-Slim-Straight-Fit-Pants-Sizes-8-18/402708328
11,BOCINIBocini Unlined Fleece Varsity Jackets (Little Boys & Big Boys),https://www.walmart.com/ip/Bocini-Boys-Unlined-Fleece-Varsity-Jackets-Sizes-6-16/202369471
12,Wonder NationWonder Nation Boys Crewneck Short Sleeve T-Shirt 3 Pack Sizes 4-18 & Husky,https://www.walmart.com/ip/Wonder-Nation-Boys-Solid-Crewneck-Short-Sleeve-T-Shirt-3-Pack-Sizes-4-18-Husky/822360797
13,"RBXRBX Boys Tricot Track Jacket, T-Shirt, Joggers Performance Set, 3-Piece, Sizes 4-12",https://www.walmart.com/ip/RBX-Boys-Tricot-Track-Jacket-T-Shirt-Joggers-Performance-Set-3-Piece-Sizes-4-12/506043760
14,Wonder NationWonder Nation Baby and Toddler Boys Bubble Jacket,https://www.walmart.com/ip/Wonder-Nation-Baby-and-Toddler-Boys-Bubble-Jacket/637950286
15,"365 Kids From Garanimals365 Kids From Garanimals Boys Long Sleeve Graphic T-Shirts, 2-Pack, Sizes 4-10",https://www.walmart.com/ip/365-Kids-From-Garanimals-Boys-Long-Sleeve-Graphic-T-Shirts-2-Pack-Sizes-4-10/182333163
16,Sleep On ItSleep On It Boys 2 Piece Long Sleeve Pajama Pant Set sizes 5-18 & Husky,https://www.walmart.com/ip/Sleep-On-It-Boys-2-Piece-Long-Sleeve-Pajama-Pant-Set-sizes-5-18-Husky/598124103
17,Seven OaksSeven Oaks Boys Tri-Colorblock Jersey Long Sleeve Hoodie Sizes 8-18,https://www.walmart.com/ip/Seven-Oaks-Boys-Tri-Colorblock-Jersey-Long-Sleeve-Hoodie-Sizes-8-18/302561566
18,"GaranimalsGaranimals Baby Boy & Toddler Boy Fleece Sweatshirts & Sweatpants Outfit Set, 4-Piece (12M-5T)",https://www.walmart.com/ip/Garanimals-Baby-Boy-Toddler-Boy-Fleece-Sweatshirts-Sweatpants-Outfit-Set-4-Piece-12M-5T/811068086
19,"US Polo Assn.U.S. Polo Assn. Boys Underwear, 4 Pack Cotton Boxer Briefs Sizes 5- 14",https://www.walmart.com/ip/U-S-Polo-Assn-Boys-Underwear-4-Pack-Cotton-Boxer-Briefs-Sizes-5-14/690617247
20,"BleachedBleached Boys Mixed Fashion Graphic Long Sleeve T-Shirts, 2-Pack, Sizes 4-18",https://www.walmart.com/ip/Bleached-Boys-Mixed-Fashion-Graphic-Long-Sleeve-T-Shirts-2-Pack-Sizes-4-18/351297407
21,"HollywoodHollywood Boys Knit Twill Pull-On Pants, Sizes 4-18",https://www.walmart.com/ip/Hollywood-Boys-Knit-Twill-Pull-On-Pants-Sizes-4-18/971594788
22,"Off CampusOff Campus Boys Hoodie Sweatshirt, Graphic T-Shirt, & Jogger Sweatpants, 3-Piece Outfit Set, Sizes 4-14",https://www.walmart.com/ip/Off-Campus-Boys-Hoodie-Sweatshirt-Graphic-T-Shirt-Jogger-Sweatpants-3-Piece-Outfit-Set-Sizes-4-14/723030433
23,"Star WarsStar Wars Mandalorian Baby Yoda, Boys Underwear, 4 Pack Boxer Briefs Sizes 6 - 10",https://www.walmart.com/ip/Star-Wars-Mandalorian-Baby-Yoda-Boys-Underwear-4-Pack-Boxer-Briefs-Sizes-6-10/883772520
24,"HOLLYWOODHollywood Little Boys Sherpa-Bonded Jersey Jogger, Sizes 4-7",https://www.walmart.com/ip/Hollywood-Little-Boys-Faux-Sherpa-Bonded-Jersey-Joggers-Sizes-4-7/678584347
25,"Social EditionSocial Edition Boys Pajama Set with Matching Eye Mask, 2-piece, Sizes 4-16",https://www.walmart.com/ip/Social-Edition-Boys-Pajama-Set-with-Matching-Eye-Mask-2-piece-Sizes-4-16/397099977
26,Seven OaksSeven Oaks Boys Colorblock Fleece Long Sleeve Hoodie Sizes 7-18,https://www.walmart.com/ip/Seven-Oaks-Boys-Colorblock-Fleece-Long-Sleeve-Hoodie-Sizes-7-18/576973090
27,"Fruit of the LoomFruit of the Loom Boys Thermals, Performance Thermal Set Sizes 4/5 - 18",https://www.walmart.com/ip/Fruit-of-the-Loom-Boys-Thermals-Performance-Thermal-Set-Sizes-4-5-18/267863190
28,"Off CampusOff Campus Boys Hoodie Sweatshirt, Graphic T-Shirt, & Jogger Sweatpants, 4-Piece Outfit Set, Sizes 4-14",https://www.walmart.com/ip/Off-Campus-Boys-Hoodie-Sweatshirt-Graphic-T-Shirt-Jogger-Sweatpants-4-Piece-Outfit-Set-Sizes-4-14/501808653
29,"BatmanDC Comics Batman Boys 4-7 Short Sleeve T-Shirt, Tank, & Knit Shorts, 3-Piece Outfit Set",https://www.walmart.com/ip/DC-Comics-Batman-Boys-4-7-Short-Sleeve-T-Shirt-Tank-Knit-Shorts-3-Piece-Outfit-Set/902497631
30,"One Point OneOne Point One Boys Splatter Long Sleeve Hoodie, Sizes 8-18",https://www.walmart.com/ip/One-Point-One-Boys-Splatter-Long-Sleeve-Hoodie-Sizes-8-18/941004570
31,"BleachedBleached Boys Beanie + Long Sleeve Tie Dye T-Shirt 2fer, Sizes 4-18",https://www.walmart.com/ip/Bleached-Boys-Beanie-Long-Sleeve-Tie-Dye-T-Shirt-2fer-Sizes-4-18/840952243
32,"Ryan's WorldRyan's World Boys Play All Day Crewneck & Logo Hoodie, 2-Pack, Sizes 4-8",https://www.walmart.com/ip/Ryan-s-World-Boys-Play-All-Day-Crewneck-Logo-Hoodie-2-Pack-Sizes-4-8/890717067
33,"Off CampusOff Campus Boys Long Sleeve T-Shirts, Graphic T-Shirt, Hoodie Sweatshirt, & Jogger Sweatpants, 7-Piece Outfit Set, Sizes 4-14",https://www.walmart.com/ip/Off-Campus-Boys-Long-Sleeve-T-Shirts-Graphic-T-Shirt-Hoodie-Sweatshirt-Jogger-Sweatpants-7-Piece-Outfit-Set-Sizes-4-14/986948844
34,"365 Kids From Garanimals365 Kids From Garanimals Boys Cargo Jogger Sweatpants, 3-Pack, Sizes 4-10",https://www.walmart.com/ip/365-Kids-From-Garanimals-Boys-Cargo-Jogger-Sweatpants-3-Pack-Sizes-4-10/852972139
35,"RBXRBX Boys Tricot Athletic 2-Pack Pants, Sizes 4-20",https://www.walmart.com/ip/RBX-Boys-Tricot-Athletic-2-Pack-Pants-Sizes-4-20/296680594
36,"Spider-ManMarvel Spider-Man Boys Webhead Sweatshirt, Sizes 6-16",https://www.walmart.com/ip/Marvel-Spider-Man-Boys-Webhead-Sweatshirt-Sizes-6-16/938020280
37,Wonder NationWonder Nation Boys Striped Short Sleeve T-Shirt 3-Pack Sizes 4-18 & Husky,https://www.walmart.com/ip/Wonder-Nation-Boys-Striped-Short-Sleeve-T-Shirt-3-Pack-Sizes-4-18-Husky/227172644
38,HanesHanes Boys 4-18 EcoSmart Fleece Pullover Hoodie Sweatshirt,https://www.walmart.com/ip/Hanes-Boys-EcoSmart-Fleece-Pullover-Hoodie-Sweatshirt-Sizes-4-18/40324626
39,"PokmonPokmon Boys Pajama Blanket Sleeper, Sizes 4-12",https://www.walmart.com/ip/Pok-mon-Boys-Pajama-Blanket-Sleeper-Sizes-4-12/406698112
40,"US Polo Assn.U.S. Polo Assn. Boys Crew Neck T-Shirt, 2-Pack, Sizes XXS-XL",https://www.walmart.com/ip/U-S-Polo-Assn-Boys-Crew-Neck-T-Shirt-2-Pack-Size-4-18/631709403
41,"Athletic WorksAthletic Works Boys Tricot Track Pants, Sizes 4-18 & Husky",https://www.walmart.com/ip/Athletic-Works-Boys-Tricot-Track-Pants-Sizes-4-18-Husky/398601800
42,"Spider-ManSpiderman Boys Pajama Blanket Sleeper, Sizes 4-12",https://www.walmart.com/ip/Spiderman-Boys-Pajama-Blanket-Sleeper-Sizes-4-12/598797936
43,"Climate ConceptsClimate Concepts Big Boys Faux Fur Lined Hooded Puffer Coat with Sleeve Patch, Sizes 8-20",https://www.walmart.com/ip/Climate-Concepts-Big-Boys-Faux-Fur-Lined-Hooded-Puffer-Coat-with-Sleeve-Patch-Sizes-8-20/928759982
44,Wonder NationWonder Nation Boys Sherpa Hoodie Sizes 4-18 & Husky,https://www.walmart.com/ip/Wonder-Nation-Boys-Sherpa-Hoodie-Sizes-4-18-Husky/735898666
45,"Wonder NationWonder Nation Boys School Uniform Short Sleeve Pique Polo Shirt, 4-Pack Value Bundle, Sizes 4-18",https://www.walmart.com/ip/Wonder-Nation-Boys-School-Uniform-Short-Sleeve-Pique-Polo-Shirt-4-Pack-Value-Bundle-Sizes-4-18/601496109
46,"GenericV.I.P. Boys Exclusive Fall Graphic T-Shirts 2-Pack, Sizes 4-18",https://www.walmart.com/ip/V-I-P-Boys-Exclusive-Fall-Graphic-T-Shirts-2-Pack-Sizes-4-18/624445367
47,"ChampionChampion Boys Champion Script Fleece Jogger Pants, Sizes 8-20",https://www.walmart.com/ip/Champion-Boys-Champion-Script-Fleece-Jogger-Pants-Sizes-8-20/883910316
48,"Wonder NationWonder Nation Boys School Uniform Short Sleeve Pique Polo Shirts, 4-Pack Value Bundle, Sizes 4-18",https://www.walmart.com/ip/Wonder-Nation-Boys-School-Uniform-Short-Sleeve-Pique-Polo-Shirts-4-Pack-Value-Bundle-Sizes-4-18/861183117
49,HanesHanes - MMF - ComfortSoft Youth T-Shirt,https://www.walmart.com/ip/Hanes-MMF-ComfortSoft-Youth-T-Shirt/878527329
50,"Wonder NationWonder Nation Husky Boys School Uniform Short Sleeve Pique Polo Shirt, 2-Pack Value Bundle, Sizes 10-18",https://www.walmart.com/ip/Wonder-Nation-Husky-Boys-School-Uniform-Short-Sleeve-Pique-Polo-Shirt-2-Pack-Value-Bundle-Sizes-10-18/796315735
51,TrevcoHarry Potter - Potter Sweater (Front/Back Print) - Youth Short Sleeve Shirt - X-Large,https://www.walmart.com/ip/Harry-Potter-Potter-Sweater-Front-Back-Print-Youth-Short-Sleeve-Shirt-X-Large/527974066
52,Jolly JammiesMatching Family Christmas Pajamas Kid's Fairisle Union Suit,https://www.walmart.com/ip/Matching-Family-Christmas-Pajamas-Kid-s-Fairisle-Union-Suit/641325266
53,"Wonder NationWonder Nation Boys 4-18 Regular, Slim, & Husky School Uniform Twill Chino Pants",https://www.walmart.com/ip/Wonder-Nation-Boys-School-Uniform-Twill-Chino-Pants-Sizes-4-18-Slim-Husky/884163964
54,"BatmanBatman Boys Super Soft Long Sleeve Top & Long Pants, 2-Piece Pajama Set, Sizes 4-10",https://www.walmart.com/ip/Batman-Boys-Super-Soft-Long-Sleeve-Top-Long-Pants-2-Piece-Pajama-Set-Sizes-4-10/347355217
55,"Wonder NationWonder Nation Boys Flannel Hoodie, Sizes 4-18 & Plus",https://www.walmart.com/ip/Wonder-Nation-Boys-Flannel-Hoodie-Sizes-4-18-Plus/102116674
56,The Amazing SpidermanSpiderman Boys Long Sleeve Top & Long Pants 2-Piece Pajama Set Sizes 4-10,https://www.walmart.com/ip/Spiderman-Boys-Long-Sleeve-Top-Long-Pants-2-Piece-Pajama-Set-Sizes-4-10/884213083
57,NintendoNintendo Boys Long Sleeve Top & Long Pants 2-Piece Pajama Set Sizes 4-10,https://www.walmart.com/ip/Nintendo-Boys-Long-Sleeve-Top-Long-Pants-2-Piece-Pajama-Set-Sizes-4-10/683335095
58,"The AvengersAvengers Boys Super Soft Long Sleeve Top & Long Pants , 2-Piece Pajama Set Sizes 4-10",https://www.walmart.com/ip/Avengers-Boys-Super-Soft-Long-Sleeve-Top-Long-Pants-2-Piece-Pajama-Set-Sizes-4-10/194115595
59,"ChampionShip GoldChampionship Gold Boys Pajama Pants, 2-Pack, Sizes 8-18",https://www.walmart.com/ip/Championship-Gold-Boys-Pajama-Pants-2-Pack-Sizes-8-18/483815603
60,Cozy JamsCozy Jams Boys 2 Pack Pajama Pant Sizes S-XL,https://www.walmart.com/ip/Cozy-Jams-Boys-2-Pack-Pajama-Pant-Sizes-S-XL/799507373
61,Petit LemPetit Lem Boys 2-Pack Pajama Pants Sizes 4-16,https://www.walmart.com/ip/Petit-Lem-Boys-2-Pack-Pajama-Pants-Sizes-4-16/218777415
62,"Athletic WorksAthletic Works Boys Tricot Track 2-Pack Pants, 4-18 & Husky",https://www.walmart.com/ip/Athletic-Works-Boys-Tricot-Track-2-Pack-Pants-4-18-Husky/802432636
63,"FortniteFortnite Boys Short Sleeve Top & Long Pants, 2-Piece Pajama Set Sizes 8-14",https://www.walmart.com/ip/Fortnite-Boys-Short-Sleeve-Top-Long-Pants-2-Piece-Pajama-Set-Sizes-8-14/718465150
64,"HanesHanes Boys' Underwear, X-Temp Stretch Mesh Boxer Briefs 5 Pack Sizes S - XL",https://www.walmart.com/ip/Hanes-Boys-S-XL-X-Temp-Stretch-Mesh-Boxer-Briefs-5-Pack/951048003
65,"IXtremeiXtreme Boys Colorblock Puffer Coat, Sizes 8-18",https://www.walmart.com/ip/iXtreme-Boys-Colorblock-Puffer-Coat-Sizes-8-18/833901003
66,"Swiss TechSwissTech Boys Snow Pants, Sizes 4-18",https://www.walmart.com/ip/SwissTech-Boys-Snow-Pants-Sizes-4-18/160497288
67,"Cozy JamsCozy Jams Boys French Terry Pajamas, 3-Piece Set, Sizes 4-14",https://www.walmart.com/ip/Cozy-Jams-Boys-French-Terry-Pajamas-3-Piece-Set-Sizes-4-14/442317813
68,Wonder NationWonder Nation Boys Crewneck Long Sleeve T-Shirt 3 Pack Sizes 4-18 & Husky,https://www.walmart.com/ip/Wonder-Nation-Boys-Crewneck-Long-Sleeve-T-Shirt-3-Pack-Sizes-4-18-Husky/811909956
69,TrevcoTransformers - Transformer Squares - Juvenile Short Sleeve Shirt - 5/6,https://www.walmart.com/ip/Transformers-Transformer-Squares-Juvenile-Short-Sleeve-Shirt-5-6/762886549
70,"RBXRBX Boys Fleece Full Zip Hoodie, T-Shirt, Joggers 3-Piece Active Set, Sizes 4-12",https://www.walmart.com/ip/RBX-Boys-Fleece-Full-Zip-Hoodie-T-Shirt-Joggers-3-Piece-Active-Set-Sizes-4-12/853575739
71,"RussellRussell Boys Stretch Knit Performance Jogger Pants, Sizes 4-18",https://www.walmart.com/ip/Russell-Boys-Stretch-Knit-Performance-Jogger-Pants-Sizes-4-18/410744521
72,"MinecraftMinecraft Boys Pajama Blanket Sleeper, Sizes 4-12",https://www.walmart.com/ip/Minecraft-Boys-Pajama-Blanket-Sleeper-Sizes-4-12/623138594
73,Swiss CrossSwiss Cross Boys Melange Fleece Zip-Up Hoodie Sizes 8-18,https://www.walmart.com/ip/Swiss-Cross-Boys-Melange-Fleece-Zip-Up-Hoodie-Sizes-8-18/268999734
74,"Wonder NationWonder Nation Boys' Rain Jacket, Sizes 4-18 & Plus",https://www.walmart.com/ip/Wonder-Nation-Boys-Rain-Jacket-Sizes-4-18-Plus/329509989
75,Derek HeartMatching Family Christmas Pajamas Kids Notch Collar Tartan 2-Piece Pajama Set,https://www.walmart.com/ip/Matching-Family-Christmas-Pajamas-Kids-Notch-Collar-Tartan-2-Piece-Pajama-Set/419151097
76,Wonder NationWonder Nation Boys 4-18 Full Zip Chevron Hoodie,https://www.walmart.com/ip/Wonder-Nation-Boys-Chevron-Full-Zip-Hoodie-Sizes-4-18-Husky/841002187
77,TrevcoTransformers - Roll To The Rescue - Juvenile Short Sleeve Shirt - 4,https://www.walmart.com/ip/Transformers-Roll-To-The-Rescue-Juvenile-Short-Sleeve-Shirt-4/929937258
78,"HindHind Boys Compression Pants, 2-Pack, Sizes 4-18",https://www.walmart.com/ip/Hind-Boys-Compression-Pants-2-Pack-Sizes-4-18/739932565
79,"Jurassic WorldJurassic World Boys Long Sleeve Top & Long Pants 2-Piece Pajama Set, Sizes 4-12",https://www.walmart.com/ip/Jurassic-World-Boys-Long-Sleeve-Top-Long-Pants-2-Piece-Pajama-Set-Sizes-4-12/142481209
80,"ChampionShip GoldChampionship Gold Boys Fleece Hooded Pajama Blanket Sleeper, Sizes 4-7",https://www.walmart.com/ip/Championship-Gold-Boys-Fleece-Hooded-Pajama-Blanket-Sleeper-Sizes-4-7/455621652
81,Sleep On ItSleep On It Boys Fleece Pajama Robe with Slippers Sizes 6-14,https://www.walmart.com/ip/Sleep-On-It-Boys-Fleece-Pajama-Robe-with-Slippers-Sizes-6-14/777986144
82,Sleep On ItSleep On It Boys Long Sleeve & Pant 2-Piece Pajama Set Sizes 6-14,https://www.walmart.com/ip/Sleep-On-It-Boys-Long-Sleeve-Pant-2-Piece-Pajama-Set-Sizes-6-14/208924518
83,"ChampionShip GoldChampionship Gold Boys Long Sleeve Graphic Tee, Pants & Robe Pajama Set, 3-Piece, Sizes 4-14",https://www.walmart.com/ip/Championship-Gold-Boys-Long-Sleeve-Graphic-Tee-Pants-Robe-Pajama-Set-3-Piece-Sizes-4-14/276379451
84,"Sleep On ItSleep On It Boys Nasa Thermal Henley with Joggers Pajama Set, 2-Piece, Sizes 6-14",https://www.walmart.com/ip/Sleep-On-It-Boys-Nasa-Thermal-Henley-with-Joggers-Pajama-Set-2-Piece-Sizes-6-14/148179608
85,"Sleep On ItSleep On It Boys Skate Pajama Set, 2-Piece, Sizes 7-14",https://www.walmart.com/ip/Sleep-On-It-Boys-Skate-Pajama-Set-2-Piece-Sizes-7-14/125503320
86,Petit LemPetit Lem Boys 2-Piece Pajama Set: Long Sleeve Top And Pant Sizes 4-14,https://www.walmart.com/ip/Petit-Lem-Boys-2-Piece-Pajama-Set-Long-Sleeve-Top-And-Pant-Sizes-4-14/494931596
87,Wonder NationWonder Nation Boys Sleeve Stripe Long Sleeve T-Shirt 2 Pack Sizes 4-18 & Husky,https://www.walmart.com/ip/Wonder-Nation-Boys-Sleeve-Stripe-Long-Sleeve-T-Shirt-2-Pack-Sizes-4-18-Husky/832246984
88,"Athletic WorksAthletic Works Boys Mesh 3-Pack Shorts, Sizes 4-18 & Husky",https://www.walmart.com/ip/Athletic-Works-Boys-Mesh-3-Pack-Shorts-Sizes-4-18-Husky/657340923
89,"Athletic WorksAthletic Works Boys Graphic & Solid Long Sleeve 2-Pack Performance Shirts, Sizes 4-20 & Husky",https://www.walmart.com/ip/Athletic-Works-Boys-Graphic-Solid-Long-Sleeve-2-Pack-Performance-Shirts-Sizes-4-20-Husky/896226109
90,"RussellRussell Boys Stretch Knit Full Zip Performance Jacket, Sizes 4-18",https://www.walmart.com/ip/Russell-Boys-Stretch-Knit-Full-Zip-Performance-Jacket-Sizes-4-18/450434233
91,"Athletic WorksAthletic Works Boys Graphics and Solid Long Sleeve 3-Pack Shirts, Sizes 4-20 & Husky",https://www.walmart.com/ip/Athletic-Works-Boys-Graphics-and-Solid-Long-Sleeve-3-Pack-Shirts-Sizes-4-20-Husky/243606423
92,"Wonder NationWonder Nation Boys Pajama Pants, 2-Pack, Sizes 4-18 & Husky",https://www.walmart.com/ip/Wonder-Nation-Boys-Pajama-Pants-2-Pack-Sizes-4-18-Husky/739054216
93,"Wonder NationWonder Nation Boys Fleece Hoodie, Sizes 4-18 & Plus",https://www.walmart.com/ip/Wonder-Nation-Boys-Fleece-Hoodie-Sizes-4-18-Plus/551839157
94,AND1AND1 Boys Flight Time Fleece Athletic Pants Sizes 4-18,https://www.walmart.com/ip/AND1-Boys-Flight-Time-Fleece-Athletic-Pants-Sizes-4-18/495043309
95,"Off CampusOff Campus Boys Mixed Graphic Long Sleeve Graphic T-Shirts, 2-Pack, Sizes 4-18 & Plus",https://www.walmart.com/ip/Off-Campus-Boys-Mixed-Graphic-Long-Sleeve-Graphic-T-Shirts-2-Pack-Sizes-4-18-Plus/280705779
96,"RussellRussell Boys Tech Fleece Camo Pullover Hoodie, Sizes 4-18",https://www.walmart.com/ip/Russell-Boys-Tech-Fleece-Camo-Pullover-Hoodie-Sizes-4-18/543486204
97,Seven OaksSeven Oaks Boys Multiprint Long Sleeve T-Shirt 3 Pack Sizes 8-18,https://www.walmart.com/ip/Seven-Oaks-Boys-Multiprint-Long-Sleeve-T-Shirts-3-Pack-Sizes-8-18/649789442
98,"GaranimalsGaranimals Baby Boy & Toddler Boy Long-Sleeve T-Shirts, 3-Pack (12M-5T)",https://www.walmart.com/ip/Garanimals-Baby-Boy-Toddler-Boy-Long-Sleeve-T-Shirts-3-Pack-12M-5T/768951203
99,"Fruit of the LoomFruit of the Loom Boys Underwear Ringer Stripe Boxer Briefs, 10+3 Bonus Pack, Size S-XL",https://www.walmart.com/ip/Fruit-of-the-Loom-Boys-Underwear-Ringer-Stripe-Boxer-Briefs-10-3-Bonus-Pack-Size-S-XL/907553108
100,"Ryan's WorldRyan's World Boys 4-7 Short Sleeve T-Shirts, Long Sleeve T-Shirts, and Jogger Sweatpants, 4-Piece Outfit Set",https://www.walmart.com/ip/Ryan-s-World-Boys-4-7-Short-Sleeve-T-Shirts-Long-Sleeve-T-Shirts-and-Jogger-Sweatpants-4-Piece-Outfit-Set/213926230
101,"HanesHanes Boys EcoSmart Fleece Jogger Sweatpant with Pocket, Sizes 6-18",https://www.walmart.com/ip/Hanes-Boys-EcoSmart-Fleece-Jogger-Sweatpant-with-Pocket-Sizes-6-18/828794316?wpa_bd=&wpa_pg_seller_id=F55CDC31AB754BB68FE0B39041159D63&wpa_ref_id=wpaqs:1TsehA_B7EHJhnqScjALon9Fo3MT9vQtHKprv5DNUoUeuWPUz0h2CuZcv6qa90HAgQSJ6odAn4kKNkJmVifRIAnW5yif7mf9nYXuEqjz9G45jMwHT3bfCNLxu6Gnt6cPitDTx4Hk3-mn9BV2fxygty_c9S8T_3JvsdzldLDfzT7yB5QFxRoGZN99npNPhOwTzvutgEcxFvKSYet36H1sSQ&wpa_tag=&wpa_aux_info=&wpa_pos=22&wpa_plmt=1145x1145_T-C-IG_TI_1-6_HL-INGRID-GRID-NY&wpa_aduid=46a7c1f2-1b3a-4297-ae52-7b90c08b850e&wpa_pg=browse&wpa_pg_id=5438_7712430_7809949&wpa_st=__searchterms__&wpa_tax=5438_7712430_7809949&wpa_bucket=__bkt__
102,HanesHanes Boys 4-18 Ecosmart Fleece Crew Neck Sweatshirt,https://www.walmart.com/ip/Hanes-Boys-Ecosmart-Fleece-Crew-Neck-Sweatshirt-Sizes-4-18/40331619?wpa_bd=&wpa_pg_seller_id=F55CDC31AB754BB68FE0B39041159D63&wpa_ref_id=wpaqs:1TsehA_B7EHJhnqScjALon9Fo3MT9vQtHKprv5DNUoUeuWPUz0h2CuZcv6qa90HAgQSJ6odAn4kKNkJmVifRIEq5LCBMb571e_ibhP2kikUPc-aF15xPITeXu9I5gZuh3aFZCMVRxXNGYPCn89XFvVUGpKaGwowvAT0o0_m3eZOCegCiZQPWT_nFqrBVXa_2lNjY_3WoYkVJIUxhnI3EXQ&wpa_tag=&wpa_aux_info=&wpa_pos=23&wpa_plmt=1145x1145_T-C-IG_TI_1-6_HL-INGRID-GRID-NY&wpa_aduid=46a7c1f2-1b3a-4297-ae52-7b90c08b850e&wpa_pg=browse&wpa_pg_id=5438_7712430_7809949&wpa_st=__searchterms__&wpa_tax=5438_7712430_7809949&wpa_bucket=__bkt__
103,"Wonder NationWonder Nation Baby & Toddler Boys Long Sleeve Snug Fit Cotton Pajamas Set, 4-Piece",https://www.walmart.com/ip/Wonder-Nation-Baby-Toddler-Boys-Long-Sleeve-Snug-Fit-Cotton-Pajamas-Set-4-Piece/865211382
104,"HanesHanes Boys Underwear, 5 Pack Woven Boxers Sizes 6/8 - 18/20",https://www.walmart.com/ip/Hanes-Boys-6-20-Woven-Boxers-5-Pack/28380430
105,"HanesHanes Cushion Heel and Toe Ankle Socks, 6 Pack (Toddler Boys & Baby Boys)",https://www.walmart.com/ip/Hanes-Cushion-Heel-and-Toe-Ankle-Socks-6-Pack-Toddler-Boys-Baby-Boys/51496767
106,"The Amazing SpidermanSpiderman Boys Long Sleeve Pajama Set, 2-Piece, Sizes 4-12",https://www.walmart.com/ip/Spiderman-Boys-Long-Sleeve-Pajama-Set-2-Piece-Sizes-4-12/510347913
107,"MinecraftMinecraft Boys Long Sleeve Pajama Set, 2-Piece, Sizes 4-16",https://www.walmart.com/ip/Minecraft-Boys-Long-Sleeve-Pajama-Set-2-Piece-Sizes-4-16/663083828
108,"Fruit of the LoomFruit of the Loom Boys Socks, 20 Pack Ankle Zone Cushion Socks Sizes S - L",https://www.walmart.com/ip/Fruit-of-the-Loom-Boys-Socks-20-Pack-Ankle-Cushioned-Sizes-S-L/659005852
109,Fruit of the LoomFruit of the Loom Boys 4-18 Fleece Jogger Sweatpants,https://www.walmart.com/ip/Fruit-of-the-Loom-Boys-4-18-Fleece-Jogger-Sweatpants/56025226
110,"HanesHanes Boys Socks, 12 Pack Ankle Cushion Socks Sizes S - L",https://www.walmart.com/ip/Hanes-Boys-Socks-12-Pack-Ankle-Cushion-Sizes-S-L/50270356
111,"Scooby-DooScooby-Doo Boys Underwear, 5 Pack Briefs, Sizes 4 - 8",https://www.walmart.com/ip/Scooby-Doo-Boys-Underwear-5-Pack-Briefs-Sizes-4-8/548957329
112,"Wonder NationWonder Nation Baby Boys & Toddler Boys Snug Fit Cotton Long Sleeve Pajamas, 4-Piece PJ Set (12M-5T)",https://www.walmart.com/ip/Wonder-Nation-Baby-Boys-Toddler-Boys-Snug-Fit-Cotton-Long-Sleeve-Pajamas-Set-4-Piece-Sizes-12M-5T/158967943
113,"PokmonPokemon Boys Long Sleeve Pajama Set, 2-Piece, Sizes 4-16",https://www.walmart.com/ip/Pokemon-Boys-Long-Sleeve-Pajama-Set-2-Piece-Sizes-4-16/682544401
114,"HanesHanes Boys Underwear, 7 Pack Tagless Boxer Briefs Sizes 6/8 - 18/20",https://www.walmart.com/ip/Hanes-Boys-Underwear-7-Pack-Tagless-Boxer-Briefs-Sizes-6-8-18-20/194780786
115,"Child of Mine by Carter'sChild of Mine by Carter's Baby Boy & Toddler Boy French Terry Zip-up Hoodie Sweatshirts, 2-Pack (12M-5T)",https://www.walmart.com/ip/Child-of-Mine-by-Carter-s-Baby-Boy-Toddler-Boy-French-Terry-Zip-up-Hoodie-Sweatshirts-2-Pack-12M-5T/187087575
116,"Fruit of the LoomFruit of the Loom Boys Underwear, 10 Pack Print and Solid Boxer Briefs (Toddler Boys)",https://www.walmart.com/ip/Fruit-of-the-Loom-Boys-Underwear-10-Pack-Print-and-Solid-Boxer-Briefs-Toddler-Boys/862618627
117,Fruit of the LoomFruit of the Loom Boys S-L Zone Cushion Ankle Socks 10 Pack,https://www.walmart.com/ip/Fruit-of-the-Loom-Boys-S-L-Zone-Cushion-Ankle-Socks-10-Pack/692047618
118,"HanesHanes Boys 4-18 ComfortSoft Dyed Boxer Briefs, 3 Pack",https://www.walmart.com/ip/Hanes-Boys-4-18-ComfortSoft-Dyed-Boxer-Briefs-3-Pack/16672813
119,"Wonder NationWonder Nation Boys Long Sleeve Plaid Woven Shirt, Sizes 4-18",https://www.walmart.com/ip/Wonder-Nation-Boys-Long-Sleeve-Plaid-Woven-Shirt-Sizes-4-18/490333823
120,"Fruit of the LoomFruit of the Loom Boys Underwear, Boxer Briefs Sizes 6/8 - 18/20 Husky",https://www.walmart.com/ip/Fruit-of-the-Loom-Boys-Underwear-10-Pack-Striped-Boxer-Brief-Underwear-Sizes-6-8-18-20/661642145
121,"BleachedBleached Boys Mixed Graphic T-Shirts 2-Pack, Sizes 4-18",https://www.walmart.com/ip/Bleached-Boys-Mixed-Graphic-T-Shirts-2-Pack-Sizes-4-18/214642186
122,"Wonder NationWonder Nation Boys Straight Stretch Jeans, Sizes 4-16 & Husky",https://www.walmart.com/ip/Wonder-Nation-Boys-Straight-Stretch-Jeans-Sizes-4-16-Husky/815839259
123,"Fruit of the LoomFruit Of The Loom Boy's Socks, 10 Pack Crew Sizes S - L",https://www.walmart.com/ip/Fruit-Of-The-Loom-Boys-Crew-Socks-10-Pack/223203420
124,"MinecraftMinecraft Boys Exclusive Hooded Pajama Blanket Sleeper, Sizes 4-16",https://www.walmart.com/ip/Minecraft-Boys-Exclusive-Hooded-Pajama-Blanket-Sleeper-Sizes-4-16/319671818
125,"Real EssentialsReal Essentials Youth Tricot Athletic 3-Pack Gym Joggers with Pockets, Sizes 4-18",https://www.walmart.com/ip/Real-Essentials-Youth-Tricot-Athletic-3-Pack-Gym-Joggers-with-Pockets-Sizes-4-18/668179254
126,"365 Kids From Garanimals365 Kids From Garanimals Boys Varsity Kid-Pack with Graphic T-Shirts, Jogger Pants & Sweatpants, 8-Piece Outfit Set, Sizes 4-10",https://www.walmart.com/ip/365-Kids-From-Garanimals-Boys-Varsity-Kid-Pack-with-Graphic-T-Shirts-Jogger-Pants-Sweatpants-8-Piece-Outfit-Set-Sizes-4-10/433593199
127,HanesHanes Tagless Short Sleeve T-Shirt (Little Boys & Big Boys),https://www.walmart.com/ip/Hanes-Boys-4-18-Tagless-Short-Sleeve-T-Shirt/40264358
