,item_name,url
258,"ArrowArrow Aroflex Stretch Poplin Fashion Dress Shirt and Tie, 2 Piece Set (Little Boys & Big Boys)",https://www.walmart.com/ip/Arrow-Aroflex-Stretch-Poplin-Fashion-Dress-Shirt-and-Tie-2-Piece-Set-Little-Boys-Big-Boys/747334300
259,"ChampionChampion Boys Camo Fill Script Fleece Crewneck Sweatshirt, Sizes 8-20",https://www.walmart.com/ip/Champion-Boys-Camo-Fill-Script-Fleece-Crewneck-Sweatshirt-Sizes-8-20/649239432
260,Magg ShopMagg Kids Toddlers Fleece Lined Winter Snow Glove Waterproof Assorted Solid Color 2-4T mittens,https://www.walmart.com/ip/Magg-Kids-Toddlers-Fleece-Lined-Winter-Snow-Glove-Waterproof-Assorted-Solid-Color-2-4T-mittens/566257798
261,Mickey MouseBoys Mickey Plaid Scuff Slipper With Embroidery In Shoe Gift Box (Little Boys & Big Boys),https://www.walmart.com/ip/Boys-Mickey-Plaid-Scuff-Slipper-With-Embroidery-In-Shoe-Gift-Box-Little-Boys-Big-Boys/865269538
262,"ClimateRight by Cuddl DudsCuddlDuds Toddler Boy Thermal Long Underwear, 2pc Set Stretch Fleece",https://www.walmart.com/ip/CuddlDuds-Toddler-Boy-Thermal-Long-Underwear-2pc-Set-Stretch-Fleece/469972045
263,"Wonder NationWonder Nation Boys Tank Undershirts, 10 pack Sizes S - XL H",https://www.walmart.com/ip/Wonder-Nation-Boys-Undershirt-10pk-A-shirt-Size-Husky/824862127
264,Jellifish KidsJellifish Kids Boys 2 Piece Pajama Sleep Set Sizes 4-16,https://www.walmart.com/ip/Jellifish-Kids-Boys-2-Piece-Pajama-Sleep-Set-Sizes-4-16/586802828
265,PokmonBoys Pokemon Boys Scuff Slippers In Shoe Gift Box (Little Boys & Big Boys),https://www.walmart.com/ip/Boys-Pokemon-Boys-Scuff-Slippers-In-Shoe-Gift-Box-Little-Boys-Big-Boys/760816906
266,"Harry PotterHarry Potter Boys Underwear, 5 Pack Boxer Briefs (Little Boys)",https://www.walmart.com/ip/Warner-Bros-Harry-Potter-Boys-Underwear-5-Pack-Boxer-Briefs/784160111
267,"ChristmasChristmas Toddler Boys Graphic T-shirts, 2-Pack (2T-5T)",https://www.walmart.com/ip/Christmas-Toddler-Boys-Graphic-T-shirts-2-Pack-2T-5T/787581658
268,"Sonic the HedgehogSonic the Hedgehog Boys Long Sleeve Top and Pants 2-Piece Pajama Set, Sizes 4-12",https://www.walmart.com/ip/Sonic-the-Hedgehog-Boys-Long-Sleeve-Top-and-Pants-2-Piece-Pajama-Set-Sizes-4-12/935845182
269,"Little Star OrganicLittle Star Organic Long Sleeve Snug Fit Pajamas, 4pc Set (Baby Boys & Toddler Boys)",https://www.walmart.com/ip/Little-Star-Organic-Long-Sleeve-Snug-Fit-Pajamas-4pc-Set-Baby-Boys-Toddler-Boys/795048785
270,PokmonBoys Pikachu Boys Scuff 3D Slippers and Free Shoe Gift Box (Little Boys & Big Boys),https://www.walmart.com/ip/Boys-Pikachu-Boys-Scuff-3D-Slippers-and-Free-Shoe-Gift-Box-Little-Boys-Big-Boys/975911591
271,"PAW PatrolPaw Patrol Baby Boys & Toddler Boys T-shirts & Jogger Pants, 2-Piece Outfit Set (12M-5T)",https://www.walmart.com/ip/Paw-Patrol-Baby-Boys-Toddler-Boys-T-shirts-Jogger-Pants-2-Piece-Outfit-Set-12M-5T/539042424
272,"GaranimalsGaranimals Baby Boys & Toddler Boys Taped Sweatpants, 3-Pack (12M-5T)",https://www.walmart.com/ip/Garanimals-Baby-Boy-Toddler-Boy-Taped-Sweatpants-3-Pack-12M-5T/664046542
273,MinecraftMinecraft Boys Thermal Set,https://www.walmart.com/ip/Minecraft-Boys-Thermal-Long-Underwear-2-Piece-Set-Sizes-S-L/781098154
274,"US Polo Assn.U.S. Polo Assn. Boys Underwear, 4 Pack Cotton Boxer Briefs Sizes 5- 14",https://www.walmart.com/ip/U-S-Polo-Assn-Boys-Underwear-4-Pack-Cotton-Boxer-Briefs-Sizes-5-14/690617247
275,"GustaveGustaveDesign Family Christmas Pajamas Winter Family Matching Sleepwear Long Sleeve Cotton Blouse and Striped Bottoms Set Nightgown ""Kid, Size 9T""",https://www.walmart.com/ip/GustaveDesign-Family-Christmas-Pajamas-Winter-Family-Matching-Sleepwear-Long-Sleeve-Cotton-Blouse-and-Striped-Bottoms-Set-Nightgown-Kid-Size-9T/643299877
276,IXtremeiXtreme Boys Puffer Coat with Contrast Vestie Sizes 4-18,https://www.walmart.com/ip/iXtreme-Boys-Puffer-Coat-with-Contrast-Vestie-Sizes-4-18/507829379
277,Mario KartMario Kart Licensed Slippers (Little Boys & Big Boys),https://www.walmart.com/ip/Mario-Kart-Licensed-Slippers-Little-Boys-Big-Boys/859819580
278,"Wonder NationWonder Nation Boys School Uniform Short Sleeve Performance Polo Shirt, 2-Pack Value Bundle, Sizes 4-18 & Husky",https://www.walmart.com/ip/Wonder-Nation-Boys-School-Uniform-Short-Sleeve-Performance-Polo-Shirt-2-Pack-Value-Bundle-Sizes-4-18-Husky/185074208
279,"WranglerWrangler Boys Long Sleeve Flannel Plaid Shirt, Sizes 4-18",https://www.walmart.com/ip/Wrangler-Boys-Long-Sleeve-Flannel-Plaid-Shirt-Sizes-4-18/518656277
280,"Fruit of the LoomFruit of the Loom Assorted Cotton Boxer Brief Underwear, 7 Pack (Toddler Boys)",https://www.walmart.com/ip/Fruit-of-the-Loom-Assorted-Cotton-Boxer-Brief-Underwear-7-Pack-Toddler-Boys/338020789
281,"Disney PixarCars, Toy Story & Monsters Inc. Toddler Boys Brief Underwear, 7-Pack",https://www.walmart.com/ip/Cars-Toy-Story-Monsters-Inc-Toddler-Boys-Brief-Underwear-7-Pack/14303277
282,"HanesHanes Baby and Toddler Boys Ankle Socks, 12-Pack",https://www.walmart.com/ip/Hanes-Baby-and-Toddler-Boys-Ankle-Socks-12-Pack/383574064
283,"HanesHanes Boys Socks, 20 Pack No Show Super Value Socks Sizes S - L",https://www.walmart.com/ip/Hanes-Boys-Socks-20-Pack-No-Show-Super-Value-Socks-Sizes-S-L/248253738
284,"Disney Pixar CarsCars Toddler Boys Brief Underwear, 7-Pack",https://www.walmart.com/ip/Cars-Toddler-Boys-Brief-Underwear-7-Pack/17164310
285,"Wonder NationWonder Nation Boys Underwear, 10 Pack Tiger & Dinosaur Print Briefs (Little Boys & Big Boys)",https://www.walmart.com/ip/Wonder-Nation-Boys-Underwear-10-Pack-Tiger-Dinosaur-Print-Briefs-Little-Boys-Big-Boys/592861064
286,"Wonder NationWonder Nation Boys Underwear, 10 Pack Solid Brief (Little Boy & Big Boy)",https://www.walmart.com/ip/Wonder-Nation-Boys-Underwear-10-Pack-Solid-Brief-Little-Boy-Big-Boy/581139805
287,"Sleep On ItSleep On It Baby & Toddler Boys Long Sleeve Snug Fit Cotton Pajamas & Socks, 3-Piece Set",https://www.walmart.com/ip/Sleep-On-It-Baby-Toddler-Boys-Long-Sleeve-Snug-Fit-Cotton-Pajamas-Socks-3-Piece-Set/700826697
288,"Star WarsStar Wars The Mandalorian Baby Yoda Boys Socks, 12 Pack No Shows, Sizes S - L",https://www.walmart.com/ip/Star-Wars-The-Mandalorian-Baby-Yoda-Boys-Socks-12-Pack-No-Shows-Sizes-S-L/680594335
289,"Wonder NationWonder Nation Boys Underwear, 10 Pack Space Boxer Brief Sizes S - XL",https://www.walmart.com/ip/Wonder-Nation-Boys-Underwear-10-Pack-Space-Boxer-Brief-Sizes-S-XL/556562937
290,"Fruit of the LoomFruit of the Loom Baby and Toddler Boys Cushion Crew Socks, 18-Pack",https://www.walmart.com/ip/Fruit-of-the-Loom-Baby-and-Toddler-Boys-Cushion-Crew-Socks-18-Pack/151193751
291,"IceburgIceburg Boys Nunu Snow Bib, Sizes 4-18",https://www.walmart.com/ip/Iceburg-Boys-Nunu-Snow-Bib-Sizes-4-18/319677137
292,"Off CampusOff Campus Boys Long Sleeve T-Shirts, Graphic T-Shirt, Hoodie Sweatshirt, & Jogger Sweatpants, 7-Piece Outfit Set, Sizes 4-14",https://www.walmart.com/ip/Off-Campus-Boys-Long-Sleeve-T-Shirts-Graphic-T-Shirt-Hoodie-Sweatshirt-Jogger-Sweatpants-7-Piece-Outfit-Set-Sizes-4-14/986948844
293,"Footed PajamasJoggies - Family Matching Black and Deep Red Hoodie Onesies for Boys, Girls, Men, Women and Pets - Adult - Small2X/Dbl Wide (Fits 5'3 - 5'6"")",https://www.walmart.com/ip/Joggies-Family-Matching-Black-and-Deep-Red-Hoodie-Onesies-for-Boys-Girls-Men-Women-and-Pets-Adult-Small2X-Dbl-Wide-Fits-5-3-5-6/756355601
294,"IceburgIceburg Boys Cargo Snow Pant, Sizes 4-18",https://www.walmart.com/ip/Iceburg-Boys-Cargo-Snow-Pant-Sizes-4-18/351562099
295,"Athletic WorksAthletic Works Boys Mesh DriWorks 3-Pack Pants, Sizes 4-18 & Husky",https://www.walmart.com/ip/Athletic-Works-Boys-Mesh-DriWorks-3-Pack-Pants-Sizes-4-18-Husky/725600241
296,RussellRussell Active Boys Ankle Socks 6 Pack Socks,https://www.walmart.com/ip/Russell-Active-Boys-Ankle-Socks-6-Pack-Socks/373126770
297,"Fruit of the LoomFruit of the Loom Heavy Cotton T-Shirt, Pack of 6",https://www.walmart.com/ip/Fruit-of-the-loom-Men-s-Short-Sleeve-Crew-Tee/175313774
298,"Super Mario Bros.Super Mario Bros. Boys Mario & Friends Graphic Long Sleeve T-Shirt, Sizes 4-18",https://www.walmart.com/ip/Super-Mario-Bros-Boys-Mario-Friends-Graphic-Long-Sleeve-T-Shirt-Sizes-4-18/819037152
299,KidPikaKidPika Toddler Kids Baby Boys Winter Clothes Camo Tops T-Shirt Pants Outfits 2Pcs Set,https://www.walmart.com/ip/KidPika-Toddler-Kids-Baby-Boys-Winter-Clothes-Camo-Tops-T-Shirt-Pants-Outfits-2Pcs-Set/551674931
300,"Wonder NationWonder Nation Boys Rip and Repair Jeans, Sizes 4-18 & Husky",https://www.walmart.com/ip/Wonder-Nation-Boys-Rip-and-Repair-Jeans-Sizes-4-18-Husky/877485807
301,"Footed PajamasFooted Pajamas - Family Matching Polar Hoodie Onesies for Boys, Girls, Men, Women and Pets - Adult - Large (Fits 6'0 - 6'4"")",https://www.walmart.com/ip/Footed-Pajamas-Family-Matching-Orange-Hoodie-Onesies-for-Boys-Girls-Men-Women-and-Pets-Kids-Medium-Fits-4-6-4-8/269107520
302,"RussellRussell Boys Socks, 3 Pack Crew Printed Athletic (Little Boys & Big Boys)",https://www.walmart.com/ip/Russell-Boys-Voltage-Crew-Socks-3-Pack/311435511
303,"BatmanBatman, Boys Underwear, 6 Pack Boxer Brief Sizes 4 - 8",https://www.walmart.com/ip/Batman-Boys-Underwear-6-Pack-Boxer-Brief-Sizes-4-8/856963425
304,"MinecraftMinecraft Boys Exclusive Pajama Coat, Sizes 4-12, 2-Piece Set",https://www.walmart.com/ip/Minecraft-Boys-Exclusive-Pajama-Coat-Sizes-4-12-2-Piece-Set/266296586
305,"Child of Mine by Carter'sChild of Mine by Carter's Baby Boy & Toddler Boy Birthday Short-Sleeve T-Shirt & Pants Outfit Set, 2-Piece (12M-5T)",https://www.walmart.com/ip/Child-of-Mine-by-Carter-s-Baby-Boy-Toddler-Boy-Birthday-Short-Sleeve-T-Shirt-Pants-Outfit-Set-2-Piece-12M-5T/736683244
306,"365 Kids From Garanimals365 Kids From Garanimals Boys Dino Long Sleeve T-Shirt, Woven Jogger Pants, & Hat, 3-Piece Outfit Set, Sizes 4-10",https://www.walmart.com/ip/365-Kids-From-Garanimals-Boys-Dino-Long-Sleeve-T-Shirt-Woven-Jogger-Pants-Hat-3-Piece-Outfit-Set-Sizes-4-10/401963415
307,"Child of Mine by Carter'sChild of Mine by Carter's Baby Boy Footed Pants, 2-Pack",https://www.walmart.com/ip/Child-of-Mine-by-Carter-s-Baby-Boy-Footed-Pants-2-Pack/611340460
308,"Holiday TimeHoliday Time Boys Exclusive Christmas Sweaters, Sizes 4-18 & Plus",https://www.walmart.com/ip/Holiday-Time-Boys-Exclusive-Christmas-Sweaters-Sizes-4-18-Plus/627038565
309,Ryan's WorldRyan's World Boys Exclusive 4-12 Sunshine Logo 2 Toned Long Sleeve T-Shirt,https://www.walmart.com/ip/Ryan-s-World-Boys-Exclusive-4-12-Sunshine-Logo-2-Toned-Long-Sleeve-T-Shirt/783660875
310,"Spider-ManSpider-Man Boys Super Soft Short Sleeve Top, Long Pants & Shorts, 3-Piece Pajama Set, Sizes 4-10",https://www.walmart.com/ip/Spider-Man-Boys-Super-Soft-Short-Sleeve-Top-Long-Pants-Shorts-3-Piece-Pajama-Set-Sizes-4-10/310834843
311,"HindHind Boys Colorblock Hoodie and Joggers 2-Piece Athletic Set, Sizes 4-7",https://www.walmart.com/ip/Hind-Boys-Colorblock-Hoodie-and-Joggers-2-Piece-Athletic-Set-Sizes-4-7/145892501
312,"HollywoodHollywood Boys Stretch Twill Jogger Pants, Sizes 4-18",https://www.walmart.com/ip/Hollywood-Boys-Stretch-Twill-Jogger-Pants-Sizes-4-18/373920229
313,"Ryan's WorldRyan's World Boys Long Sleeve Top and Pants, 2-Piece Pajama Set Sizes 4-8",https://www.walmart.com/ip/Ryan-s-World-Boys-Long-Sleeve-Top-and-Pants-2-Piece-Pajama-Set-Sizes-4-8/517451001
314,"WranglerWrangler Boys Sherpa Lined Trucker Denim Jacket, Sizes XS-XL",https://www.walmart.com/ip/Wrangler-Boys-Sherpa-Lined-Trucker-Denim-Jacket-Sizes-XS-XL/830379800
315,"RobloxRoblox Boys Box Letter Logo & Floating Characters Graphic T-Shirt 2-Pack, Sizes 4-18",https://www.walmart.com/ip/Roblox-Boys-Box-Letter-Logo-Floating-Characters-Graphic-T-Shirt-2-Pack-Sizes-4-18/224108166
316,"Mickey MouseMickey Mouse Toddler Boy Vest, Long-Sleeve Graphic T-Shirt & Jogger Pants Outfit Set, 3-Piece (2T-5T)",https://www.walmart.com/ip/Mickey-Mouse-Toddler-Boy-Vest-Long-Sleeve-Graphic-T-Shirt-Jogger-Pants-Outfit-Set-3-Piece-2T-5T/653737668
317,"Little Star OrganicLittle Star Organic Baby Boy & Toddler Boy 1-Piece Snug Fit Cotton Footless Pajamas, 2-Pack (9M-5T)",https://www.walmart.com/ip/Little-Star-Organic-Snug-Fit-Stretchie-Footie-Pajamas-2pk-Baby-Boys-Toddler-Boys/935111059
318,MinecraftMinecraft Boys 2-Piece Pajama Set with Robe Sizes 6-10,https://www.walmart.com/ip/Minecraft-Boys-2-Piece-Pajama-Set-with-Robe-Sizes-6-10/437311092
319,Freestyle RevolutionFreestyle Revolution Boys 3-Piece Pajama Robe Set Sizes 4-12,https://www.walmart.com/ip/Freestyle-Revolution-Boys-3-Piece-Pajama-Robe-Set-Sizes-4-12/725898897
320,"Spider-ManSpider-Man Toddler Boy T-Shirt & Jogger Pants Outfit Set, 2-Piece (2T-4T)",https://www.walmart.com/ip/Spider-Man-Toddler-Boy-T-Shirt-Jogger-Pants-Outfit-Set-2-Piece-2T-4T/512511184
321,AllTopBargainsAll Top Bargains 6 Pair Boys Crew Socks Kids Shoe Size 4-6 Years Cartoon Patterned Design School,https://www.walmart.com/ip/All-Top-Bargains-6-Pair-Boys-Crew-Socks-Kids-Shoe-Size-4-6-Years-Cartoon-Patterned-Design-School/108394282
322,JERZEESJerzees Mid-Weight Fleece Crewneck Sweatshirt (Little Boys & Big Boys),https://www.walmart.com/ip/Jerzees-Mid-Weight-Fleece-Crewneck-Sweatshirt-Little-Boys-Big-Boys/54734272
323,"GerberGerber Baby and Toddler Boys Wiggle-Proof Jersey Crew Socks, 8-Pack",https://www.walmart.com/ip/Gerber-Baby-and-Toddler-Boys-Wiggle-Proof-Jersey-Crew-Socks-8-Pack/584426868
324,"HanesHanes Boys' S- XL X-Temp Stretch Boxer Briefs, 5 Pack",https://www.walmart.com/ip/Hanes-Boys-S-XL-X-Temp-Stretch-Boxer-Briefs-5-Pack/714084445
325,The AvengersMarvel The Avengers Boys Exclusive 4-18 Big Team 2 Tone Graphic T-Shirt,https://www.walmart.com/ip/Marvel-The-Avengers-Boys-Exclusive-4-18-Big-Team-2-Tone-Graphic-T-Shirt/570709691
326,"Mickey MouseMickey Mouse Baby Boys' & Toddler Boys' Quarter Socks, 6 Pack",https://www.walmart.com/ip/Mickey-Mouse-Baby-Boys-Toddler-Boys-Quarter-Socks-6-Pack/552259415
327,"GerberGerber Baby & Toddler Boys Snug Fit Cotton Pajamas, 4pc Set (12M-5T)",https://www.walmart.com/ip/Gerber-Baby-Toddler-Boys-Snug-Fit-Cotton-Pajamas-4pc-Set-12M-5T/191037285
328,"MinecraftMinecraft Boys Exclusive Long Sleeve Top & Long Pants ,2-Piece Pajama Set Sizes 4-12",https://www.walmart.com/ip/Minecraft-Boys-Exclusive-Long-Sleeve-Top-Long-Pants-2-Piece-Pajama-Set-Sizes-4-12/488859252
329,Cozy JamsCozy Jams Boys Thermal Top & Flannel Bottom 2-Piece Pajama Set Sizes 4-14,https://www.walmart.com/ip/Cozy-Jams-Boys-Thermal-Top-Flannel-Bottom-2-Piece-Pajama-Set-Sizes-4-14/592229072
330,"Wonder NationWonder Nation Baby Toddler Unisex Socks, 20-Pack Neutral Cushion Foot Crew",https://www.walmart.com/ip/Wonder-Nation-Baby-Toddler-Unisex-Socks-20-Pack-Neutral-Cushion-Foot-Crew/586940631
331,"Wonder NationWonder Nation Baby Boy & Toddler Boy Hooded Flannel Plaid Shirt & Cargo Pants Outfit Set, 2-Piece (12M-5T)",https://www.walmart.com/ip/Wonder-Nation-Baby-Boy-Toddler-Boy-Hooded-Flannel-Plaid-Shirt-Cargo-Pants-Outfit-Set-2-Piece-12M-5T/314243913
332,ChampionShip GoldChampionship Gold Toddler Boys Cosplay Critter Hooded Bath Robe (2T-4T),https://www.walmart.com/ip/Championship-Gold-Toddler-Boys-Cosplay-Critter-Hooded-Bath-Robe-2T-4T/151396271
333,"GaranimalsGaranimals Baby Boy & Toddler Boy Short-Sleeve Solid T-Shirt, 3-Pack (12M-5T)",https://www.walmart.com/ip/Garanimals-Baby-Boy-Toddler-Boy-Short-Sleeve-Solid-T-Shirt-3-Pack-12M-5T/571958687
334,"MarvelSpiderman Boys Exclusive Long Sleeve Top & Long Pants,2-Piece Pajama Set Sizes 4-12",https://www.walmart.com/ip/Spiderman-Boys-Exclusive-Long-Sleeve-Top-Long-Pants-2-Piece-Pajama-Set-Sizes-4-12/190481633
335,"Sleep On ItSleep On It Boys Lightning & Space Tight Fit 4-Piece Pajama Set, Sizes 4-12",https://www.walmart.com/ip/Sleep-On-It-Boys-Lightning-Space-Tight-Fit-4-Piece-Pajama-Set-Sizes-4-12/473552483
336,"GerberGerber Unisex Toddler Boys and Toddler Girls Reusable White Waterproof Pants Underwear, 8-Pack",https://www.walmart.com/ip/Gerber-Unisex-Toddler-Boys-and-Toddler-Girls-Reusable-White-Waterproof-Pants-Underwear-8-Pack/433016029
337,"ArrowArrow Boys Aroflex Stretch Flat Front Dress Pant, Sizes 4-18",https://www.walmart.com/ip/Arrow-Aroflex-Stretch-Flat-Front-Dress-Pant-Little-Boys-Big-Boys/256579311
338,Cozy JamsCozy Jams Boys 2 Pack Pajama Pant Sizes S-XL,https://www.walmart.com/ip/Cozy-Jams-Boys-2-Pack-Pajama-Pant-Sizes-S-XL/799507373
339,"Child of Mine by Carter'sChild of Mine by Carter's Toddler Boy Hooded Sweatshirt, Bodysuit & Pants Outfit Set, 3-Piece (2T-5T)",https://www.walmart.com/ip/Child-of-Mine-by-Carter-s-Toddler-Boy-Hooded-Sweatshirt-Bodysuit-Pants-Outfit-Set-3-Piece-2T-5T/700711905
340,"HanesHanes Toddler Boys Low Cut Socks, 10-Pack",https://www.walmart.com/ip/Hanes-Toddler-Boys-Low-Cut-Socks-10-Pack/43306168
341,"Ryan's WorldRyan's World Boys Red Titan Grid & Comic Graphic T-Shirts, 2-Pack, Sizes 4-8",https://www.walmart.com/ip/Ryan-s-World-Boys-Red-Titan-Grid-Comic-Graphic-T-Shirts-2-Pack-Sizes-4-8/414912161
342,Wonder NationWonder Nation Toddler Boys' Systems Jacket,https://www.walmart.com/ip/Wonder-Nation-Toddler-Boys-4-in-1-Systems-Jacket-Coat/782179721
343,"Star Art in LinenStar Kids Robe Soft Plush Hooded Fleece Robe Sleep Robe Bathrobe Boys & Girls (14-16, Navy )",https://www.walmart.com/ip/Star-Kids-Robe-Soft-Plush-Hooded-Fleece-Robe-Sleep-Robe-Bathrobe-Boys-Girls-14-16-Navy/289444665
344,"MinecraftMinecraft Boys 2-Pack Lounge Pajama Pants, Sizes 4-12",https://www.walmart.com/ip/Minecraft-Boys-2-Pack-Lounge-Pajama-Pants-Sizes-4-12/652824530
345,"IXtremeiXtreme Boys Classic Ripstop Puffer Coat, Sizes 4-18",https://www.walmart.com/ip/iXtreme-Boys-Classic-Ripstop-Puffer-Coat-Sizes-4-18/132598697
346,"MinecraftMinecraft Boys Short Sleeve T-Shirt, Sizes 4-18",https://www.walmart.com/ip/Minecraft-Boys-Short-Sleeve-T-Shirt-Sizes-4-18/716963451
347,Scooby-DooScooby Doo Boys Hooded Character Pajama Blanket Sleeper Sizes 4-12,https://www.walmart.com/ip/Scooby-Doo-Boys-Hooded-Character-Pajama-Blanket-Sleeper-Sizes-4-12/688492604
348,"Wonder NationWonder Nation Boys' S-XL White Tank Undershirt, 5 Pack",https://www.walmart.com/ip/Wonder-Nation-Boys-S-XL-White-Tank-Undershirt-5-Pack/916629320
349,"RoboxRoblox Boys Character Panel & Action Graphic T-Shirts 2-Pack, Sizes 4-18",https://www.walmart.com/ip/Roblox-Boys-Character-Panel-Action-Graphic-T-Shirts-2-Pack-Sizes-4-18/537757552
350,"Signature by Levi Strauss & Co.Signature by Levi Strauss & Co. Boys Taper Fit Jeans, Sizes 8-18",https://www.walmart.com/ip/Signature-by-Levi-Strauss-Co-Boys-Taper-Fit-Jeans-Sizes-8-18/991233058
351,FalariFalari 12 Pairs Boy Toddler Kids Cotton Crew Socks,https://www.walmart.com/ip/Falari-12-Pairs-Boy-Toddler-Kids-Cotton-Crew-Socks/516365076
352,HanesBaby Toddler Boy Ankle Socks - 10 Pack,https://www.walmart.com/ip/Baby-Toddler-Boy-Ankle-Socks-10-Pack/43306158
353,"Wonder NationWonder Nation, Boys Socks, 30 Pack No Shows Sizes S-L",https://www.walmart.com/ip/Wonder-Nation-Boys-Socks-30-Pack-No-Shows-Sizes-S-L/549131883
354,"Spider-ManSpider-Man, Boys Socks, 12 Pack No Show Socks Sizes S - L",https://www.walmart.com/ip/Spider-Man-Boys-Socks-12-Pack-No-Show-Socks-Sizes-S-L/954083412
355,"HindHind Boys Mesh Joggers 2-Pack Pants, Sizes 8-16",https://www.walmart.com/ip/Hind-Boys-Mesh-Joggers-2-Pack-Pants-Sizes-8-16/867589161
356,JERZEESJerzees Mid-Weight Fleece Elastic Bottom Sweatpants (Little Boys & Big Boys),https://www.walmart.com/ip/Jerzees-Mid-Weight-Fleece-Elastic-Bottom-Sweatpants-Little-Boys-Big-Boys/54734394
357,"Bendy and the Ink MachineBendy and the Ink Machine Boys Checkered Graphic T-Shirt, Sizes 4-18",https://www.walmart.com/ip/Bendy-and-the-Ink-Machine-Boys-Checkered-Graphic-T-Shirt-Sizes-4-18/848594649
358,"HanesHanes Boys Undershirt, 5 Pack Tagless EcoSmart White Crew Undershirts, Sizes 6/8 - 18/20",https://www.walmart.com/ip/Hanes-Boys-Tagless-EcoSmart-White-Crew-Undershirts-5-Pack-Sizes-6-8-18-20/786590122
359,"Spider-ManSpider-Man Baby & Toddler Boys Long Sleeve Snug Fit Cotton Pajamas, 4pc Set",https://www.walmart.com/ip/Spider-Man-Baby-Toddler-Boys-Long-Sleeve-Snug-Fit-Cotton-Pajamas-4pc-Set/597921239
360,"Despicable MeMinions Boys Socks, 12 + 4 Pack No Show Socks Sizes S - L",https://www.walmart.com/ip/Minions-Boys-Socks-12-4-Pack-No-Show-Socks-Sizes-S-L/744515057
361,RussellRussell Active Boys Crew Socks 6 Pack Socks,https://www.walmart.com/ip/Russell-Active-Boys-Crew-Socks-6-Pack-Socks/247518764
362,"Holiday TimeWonder Nation Baby and Toddler Boys Fairisle Pajamas Set, 2-Piece",https://www.walmart.com/ip/Wonder-Nation-Baby-and-Toddler-Boys-Fairisle-Pajamas-Set-2-Piece/875924168
363,"Fruit of the LoomFruit of the Loom Super Value Classic White Tank Undershirts, 7 Pack Sizes 4 - 18/20",https://www.walmart.com/ip/Fruit-of-the-Loom-Boys-Undershirts-Super-Value-White-Tank-7-Pack-Little-Boys-Big-Boys/715405530
364,SezzitSezzit Boys Wide Stripe Quarter Zip Long Sleeve Sweater Sizes 4-18,https://www.walmart.com/ip/Sezzit-Boys-Wide-Stripe-Quarter-Zip-Long-Sleeve-Sweater-Sizes-4-18/749668213
365,"Scooby-DooScooby Doo Boys Underwear, 6 Pack Boxer Briefs Sizes 4 - 10",https://www.walmart.com/ip/Scooby-Doo-Boys-Underwear-6-Pack-Boxer-Briefs-Sizes-4-10/495040611
366,"Spider-ManMarvel Spider-Man Boys Classic Spidey Hoodie, Sizes 4-18",https://www.walmart.com/ip/Marvel-Spider-Man-Boys-Classic-Spidey-Hoodie-Sizes-4-18/109278108
367,"SezzitSezzit Boys 1/4 Zip Marled Pullover Sweater, Sizes 4-18",https://www.walmart.com/ip/Sezzit-Boys-1-4-Zip-Marled-Pullover-Sweater-Sizes-4-18/862151797
368,"SpongeBob SquarePantsSpongeBob Boys Underwear, 6 Pack Boxer Briefs Sizes 4 - 10",https://www.walmart.com/ip/SpongeBob-Boys-Underwear-6-Pack-Boxer-Briefs-Size-4/722451991
369,Wonder NationWonder Nation Boys 4-18 & Husky Carpenter Pants,https://www.walmart.com/ip/Wonder-Nation-Boys-Carpenter-Pants-Sizes-4-18-Husky/437104698
370,"GildanGildan Adult Preshrunk Hooded Sweatshirt, Pack of 2",https://www.walmart.com/ip/Gildan-18500-Adult-Hooded-Sweatshirt/164233886
371,"Touched by NatureTouched by Nature Baby and Toddler Boy Organic Cotton Socks with Non-Skid Gripper for Fall Resistance, 8-Pack",https://www.walmart.com/ip/Touched-by-Nature-Baby-and-Toddler-Boy-Organic-Cotton-Socks-with-Non-Skid-Gripper-for-Fall-Resistance-8-Pack/896807492
372,Cold FrontThe Noah Cuff Hat and Hunter Snowboard Glove Bundle,https://www.walmart.com/ip/The-Noah-Cuff-Hat-and-Hunter-Snowboard-Glove-Bundle/601705130
373,SUNSIOMSUNSIOM Winter Beanie Hat Scarf Set Fleece Warm Snow Ski Cap for Kids Boys Gilrs Men,https://www.walmart.com/ip/SUNSIOM-Winter-Beanie-Hat-Scarf-Set-Fleece-Warm-Snow-Ski-Cap-for-Kids-Boys-Gilrs-Men/994974136
374,"PAW PatrolPaw Patrol Baby & Toddler Boys Long Sleeve Snug Fit Cotton Pajamas, 4pc Set",https://www.walmart.com/ip/Paw-Patrol-Baby-Toddler-Boys-Long-Sleeve-Snug-Fit-Cotton-Pajamas-4pc-Set/356801724
375,"LR ScoopLR Scoop Knit Camo Pull On Shorts, Sizes 4-18",https://www.walmart.com/ip/LR-Scoop-Knit-Camo-Pull-On-Shorts-Sizes-4-18/241790416
376,"Fruit of the LoomFruit Of The Loom Breathable Lightweight Boxer Briefs, 5 Pack Sizes 6/8 - 18/20",https://www.walmart.com/ip/Fruit-Of-The-Loom-Breathable-Lightweight-Boxer-Briefs-5-Pack-Sizes-6-8-18-20/100706026
377,Sleep On ItSleep On It Boys Character Fleece Hooded Pajama Blanket Sleeper Sizes 6-14,https://www.walmart.com/ip/Sleep-On-It-Boys-Character-Fleece-Hooded-Pajama-Blanket-Sleeper-Sizes-6-14/847691520
378,"Wonder NationWonder Nation Boys Underwear, 10 Pack Skate Boxer Brief (Little Boys & Big Boys)",https://www.walmart.com/ip/Wonder-Nation-Boys-Underwear-10-Pack-Skate-Boxer-Brief-Little-Boys-Big-Boys/915927964
379,"Star WarsStar Wars Boys Underwear, 4 Pack Athletic Boxer Briefs (Little Boys & Big Boys)",https://www.walmart.com/ip/Star-Wars-Boys-Underwear-4-Pack-Athletic-Boxer-Briefs-Little-Boys-Big-Boys/283808583
380,"Star WarsStar Wars Boys Baby Yoda Today I Feel Graphic T-Shirts, Sizes 4-18",https://www.walmart.com/ip/Star-Wars-Boys-Baby-Yoda-Today-I-Feel-Graphic-T-Shirts-Sizes-4-18/676809558
381,Avery HillAvery Hill Boys Long Sleeve Dress Shirt with Windsor Tie,https://www.walmart.com/ip/Avery-Hill-Boys-Long-Sleeve-Dress-Shirt-with-Windsor-Tie/535402448
382,WranglerWrangler 5 Pocket Relaxed Fit Jean (Toddler Boys),https://www.walmart.com/ip/Wrangler-5-Pocket-Relaxed-Fit-Jean-Toddler-Boys/662475661
383,"Baby SharkBaby Shark Toddler Boys Brief Underwear, 7-Pack",https://www.walmart.com/ip/Baby-Shark-Toddler-Boys-Brief-Underwear-7-Pack/162270333
384,CanisNewborn Toddler Infant Baby Boy Clothes T-shirt Top Tee +Denim Pants Outfits Set,https://www.walmart.com/ip/Newborn-Toddler-Infant-Baby-Boy-Clothes-T-shirt-Top-Tee-Denim-Pants-Outfits-Set/293403742
385,"Fruit of the LoomFruit of the Loom Boys Underwear, 6 Pack Cotton Stretch Boxer Briefs (Toddler Boys)",https://www.walmart.com/ip/Fruit-of-the-Loom-Boys-Underwear-6-Pack-Cotton-Stretch-Boxer-Briefs-Toddler-Boys/755727554
386,"Monster JamMonster Jam Toddler Boy T-Shirt & Jogger Pants Outfit Set, 2-Piece (2T-5T)",https://www.walmart.com/ip/Monster-Jam-Toddler-Boy-T-Shirt-Jogger-Pants-Outfit-Set-2-Piece-2T-5T/546420902
387,"RobloxRoblox Boys Panel & Circle Warriors Graphic T-Shirts 2-Pack, Sizes 4-18",https://www.walmart.com/ip/Roblox-Boys-Panel-Circle-Warriors-Graphic-T-Shirts-2-Pack-Sizes-4-18/352569458
388,"Star WarsStar Wars Boys Baby Yoda & The Force Graphic T-Shirts, 2-Pack, Sizes 4-18",https://www.walmart.com/ip/Star-Wars-Boys-Baby-Yoda-The-Force-Graphic-T-Shirts-2-Pack-Sizes-4-18/369283666
389,"Luvable FriendsLuvable Friends Baby Boy Pants with Tapered Cuff, 3-Pack",https://www.walmart.com/ip/Luvable-Friends-Baby-Boy-Pants-with-Tapered-Cuff-3-Pack/48556587
390,"ChampionChampion Kids Socks, 12 Pack Ankle Athletic Logo Sizes S - L",https://www.walmart.com/ip/Champion-Boys-Socks-12-Pack-Ankle-Athletic-Logo-Sizes-S-L/640303267
391,"GerberGerber Baby Boys Wiggle Proof Jersey Crew Socks, 8-Pack",https://www.walmart.com/ip/Gerber-Baby-Boys-Wiggle-Proof-Jersey-Crew-Socks-8-Pack/799292832
