,item_name,url
392,"HanesHanes Boys 4-18 ComfortSoft Jersey Pocket Active Short Value Pack, 2 Pack",https://www.walmart.com/ip/Hanes-Boys-4-18-ComfortSoft-Jersey-Pocket-Active-Short-Value-Pack-2-Pack/856113899
393,"Fruit of the LoomFruit of the Loom Boys Pants Super Soft Mini Waffle Baselayer Thermal Underwear- 2 Pack, (Little Boys & Big Boys)",https://www.walmart.com/ip/Fruit-of-the-Loom-Boys-Thermal-Pants-Super-Soft-Mini-Waffle-Thermal-Underwear-2-Pack-Little-Boys-Big-Boys/854869413
394,"Scooby-DooScooby Doo Boys Socks, 12 Pack No Show Scooby Doo Sizes S - L",https://www.walmart.com/ip/Scooby-Doo-Boys-Socks-12-Pack-No-Show-Scooby-Doo-Little-Boys-Big-Boys/969359355
395,"PAW PatrolPAW Patrol Boys Socks, 12 + 4 Pack No Show Socks Sizes S - L",https://www.walmart.com/ip/PAW-Patrol-Boys-Socks-12-4-Pack-No-Show-Socks-Sizes-S-L/250751676
396,"Little Star OrganicLittle Star Organic Baby Toddler Boy Snug Fit Cotton Long Sleeve Pajamas, 2pc Set",https://www.walmart.com/ip/Little-Star-Organic-Baby-Toddler-Boy-Snug-Fit-Cotton-Long-Sleeve-Pajamas-2pc-Set/879047625
397,"Little Star OrganicLittle Star Organic Newborn Baby Girl Sleep 'N Play Footed Pajamas, 3-pack (0/3M-6/9M)",https://www.walmart.com/ip/Little-Star-Organic-Newborn-Baby-Girl-Sleep-N-Play-Footed-Pajamas-3-pack-0-3M-6-9M/56096483
398,"Wonder NationWonder Nation Boys Underwear, 10 Pack Skate Boxer Brief, Sizes S-XL",https://www.walmart.com/ip/Wonder-Nation-Boys-Underwear-10-Pack-Skate-Boxer-Brief-Sizes-S-XL/761744942
399,Wonder NationWonder Nation Boys Solid Baseball Long Sleeve T-Shirt 2 Pack Sizes 4-18 & Husky,https://www.walmart.com/ip/Wonder-Nation-Boys-Solid-Baseball-Long-Sleeve-T-Shirt-2-Pack-Sizes-4-18-Husky/426906860
400,CalsunbabyKids Toddler Baby Boy Pants Bottom Joggy Leggings Trousers Cotton Clothes Fit For 0-4Years,https://www.walmart.com/ip/Kids-Toddler-Baby-Boy-Pants-Bottom-Joggy-Leggings-Trousers-Cotton-Clothes-Fit-For-0-4Years/508219054
401,"ChampionChampion Boys Camo Fill Champion Script Fleece Jogger Pants, Sizes 8-20",https://www.walmart.com/ip/Champion-Boys-Camo-Fill-Champion-Script-Fleece-Jogger-Pants-Sizes-8-20/428762531
402,Wonder NationWonder Nation Boys 4-18 Regular & Husky School Uniform Flat Front Shorts,https://www.walmart.com/ip/Wonder-Nation-Boys-School-Uniform-Flat-Front-Shorts-Sizes-4-18/257805941
403,"Wonder NationWonder Nation Boys School Uniform Long Sleeve Pique Polo Shirt, 2-Pack Value Bundle, Sizes 4-18",https://www.walmart.com/ip/Wonder-Nation-Boys-School-Uniform-Long-Sleeve-Pique-Polo-Shirt-2-Pack-Value-Bundle-Sizes-4-18/601904366
404,"Swiss AlpsSwiss Alps Boys Sherpa Full Zip Jacket & Jogger Sweatpants, 2-Piece Outfit Set, Sizes 4-12",https://www.walmart.com/ip/Swiss-Alps-Boys-Sherpa-Full-Zip-Jacket-Jogger-Sweatpants-2-Piece-Outfit-Set-Sizes-4-12/674796816
405,Swiss CrossSwiss Cross Boys Melange Fleece Zip-Up Hoodie Sizes 8-18,https://www.walmart.com/ip/Swiss-Cross-Boys-Melange-Fleece-Zip-Up-Hoodie-Sizes-8-18/268999734
406,"Mickey MouseMickey Mouse Baby Boy & Toddler Boy Short-Sleeve T-Shirt & Jogger Pants Outfit Set, 2-Piece (12M-5T)",https://www.walmart.com/ip/Mickey-Mouse-Baby-Boy-Toddler-Boy-Short-Sleeve-T-Shirt-Jogger-Pants-Outfit-Set-2-Piece-12M-5T/720405995
407,"Sleep On ItSleep On It Boys Fleece Long Sleeve Pajama Set, 2-Piece, Sizes 6-14",https://www.walmart.com/ip/Sleep-On-It-Boys-Fleece-Long-Sleeve-Pajama-Set-2-Piece-Sizes-6-14/841260137
408,"MinecraftMinecraft Boys Underwear, 10 Pack Boxer Briefs Sizes 4 - 8",https://www.walmart.com/ip/Minecraft-Boys-Underwear-10-Pack-Boxer-Briefs-Sizes-4-8/637256746
409,"Little Star OrganicLittle Star Organic Baby Boys & Toddler Boys Brights Hoodie Sweatshirt & Jogger Pants, 2-Piece Set (9M-5T)",https://www.walmart.com/ip/Little-Star-Organic-Baby-Boys-Toddler-Boys-Brights-Hoodie-Sweatshirt-Jogger-Pants-2-Piece-Set-9M-5T/558934609
410,"HanesHanes Men's and Big Men's Nano-T Long Sleeve Tee, Up To Size 3XL",https://www.walmart.com/ip/Hanes-Men-s-and-Big-Men-s-Nano-T-Long-Sleeve-Tee-Up-To-Size-3XL/33441983
411,"GaranimalsGaranimals Baby Boy & Toddler Boy Pullover Hoodie Top, Long-Sleeve T-Shirt & Jogger Pants Outfit Set, 3-Piece (12M-5T)",https://www.walmart.com/ip/Garanimals-Baby-Boy-Toddler-Boy-Pullover-Hoodie-Top-Long-Sleeve-T-Shirt-Jogger-Pants-Outfit-Set-3-Piece-12M-5T/281974482
412,"Sonic the HedgehogSonic The Hedgehog Boys AOP Graphic T-Shirts & Splatter Mask 2-Pack, Sizes 4-20",https://www.walmart.com/ip/Sonic-The-Hedgehog-Boys-AOP-Graphic-T-Shirts-Splatter-Mask-2-Pack-Sizes-4-20/569034588
413,CalsunbabyMy First Christmas Baby Boy Girl Santa Claus Tops+Pants 4PCS Xmas Clothes Set,https://www.walmart.com/ip/My-First-Christmas-Baby-Boy-Girl-Santa-Claus-Tops-Pants-4PCS-Xmas-Clothes-Set/674187465
414,Wonder NationWonder Nation Boys 4-16 School Uniform Stretch Twill Pull On Pants,https://www.walmart.com/ip/Wonder-Nation-Boys-School-Uniform-Stretch-Twill-Pull-On-Pants-Sizes-4-16/985925156
415,"Cozy JamsCozy Jams Boys Tight Fit Pajama Set 2-Piece, Sizes 4-14",https://www.walmart.com/ip/Cozy-Jams-Boys-Tight-Fit-Pajama-Set-2-Piece-Sizes-4-14/233852311
416,"BatmanBatman Baby Boys' & Toddler Boys' Quarter Socks, 6 Pack",https://www.walmart.com/ip/Batman-Baby-Boys-Toddler-Boys-Quarter-Socks-6-Pack/408431155
417,"HindHind Boys Colorblocked Hoodie and Joggers with Elastic Waistband, 2-Piece Athleisure Set, Sizes 8-18",https://www.walmart.com/ip/Hind-Boys-Colorblocked-Hoodie-and-Joggers-with-Elastic-Waistband-2-Piece-Athleisure-Set-Sizes-8-18/939918342
418,"RobloxRobolox Boys Characters & Grey Warriors Graphic T-Shirts 2-Pack, Sizes 4-18",https://www.walmart.com/ip/Robolox-Boys-Characters-Grey-Warriors-Graphic-T-Shirts-2-Pack-Sizes-4-18/562903204
419,"Athletic WorksAthletic Works Boys Graphics and Solid Long Sleeve 3-Pack Shirts, Sizes 4-20 & Husky",https://www.walmart.com/ip/Athletic-Works-Boys-Graphics-and-Solid-Long-Sleeve-3-Pack-Shirts-Sizes-4-20-Husky/243606423
420,Boys OnlyBoys Only Boy's Waffle Thermal Long Underwear 2-Piece Set,https://www.walmart.com/ip/Boys-Only-Boy-s-Waffle-Thermal-Long-Underwear-2-Piece-Set/784955328
421,HanesHanes Big Men's X-Temp Thermal Waffle Crew with FreshIQ,https://www.walmart.com/ip/Hanes-Big-Men-s-X-Temp-Thermal-Waffle-Crew-with-FreshIQ/432547251
422,"Elowel PajamasElowel Space Rocket 2-Piece Pajama Set 100% Cotton (Baby, Little & Big Boys)",https://www.walmart.com/ip/Elowel-Space-Rocket-2-Piece-Pajama-Set-100-Cotton-Baby-Little-Big-Boys/477533571
423,"PAW PatrolPaw Patrol Toddler Boy Graphic T-Shirt, 2-Pack (2T-5T)",https://www.walmart.com/ip/Paw-Patrol-Toddler-Boy-Graphic-T-Shirt-2-Pack-2T-5T/724542066
424,"Mickey MouseMickey Mouse Toddler Boy T-Shirt & Jogger Pants Outfit Set, 2-Piece (2T-4T)",https://www.walmart.com/ip/Mickey-Mouse-Toddler-Boy-T-Shirt-Jogger-Pants-Outfit-Set-2-Piece-2T-4T/246693922
425,ChampionChampion Youth Short Sleeve Tagless T-Shirt,https://www.walmart.com/ip/Tshirt-T435-Youth-6-1-oz-Tagless/40268188
426,"Five Nights at Freddy'sFive Nights at Freddy's Boys Character & Digital Game Over Graphic T-Shirt 2-Pack, Sizes 4-18",https://www.walmart.com/ip/Five-Nights-at-Freddy-s-Boys-Character-Digital-Game-Over-Graphic-T-Shirt-2-Pack-Sizes-4-18/561082246
427,"Wonder NationWonder Nation Boys Underwear, 5 Pack Skate Boxer Brief (Little Boys & Big Boys)",https://www.walmart.com/ip/Wonder-Nation-Boys-Underwear-5-Pack-Skate-Boxer-Brief-Little-Boys-Big-Boys/509792400
428,"PokmonPokemon Boys Cotton Long Sleeve and Long Pants, 4-Piece Set, Sizes 4-10",https://www.walmart.com/ip/Pokemon-Boys-Cotton-Long-Sleeve-and-Long-Pants-4-Piece-Set-Sizes-4-10/451187048
429,N'Ice CapsNICE CAPS Kids Easy On Thinsulate Waterproof Secure-Wrap Mitten for Boys Girls Infant Toddler Kids,https://www.walmart.com/ip/NICE-CAPS-Kids-Easy-On-Thinsulate-Waterproof-Secure-Wrap-Mitten-for-Boys-Girls-Infant-Toddler-Kids/639049704
430,"Little Star OrganicLittle Star Organic Baby Boys & Toddler Boys Valentine's Day Snug Fit Cotton Pajamas, 4pc PJ Set (9M-5T)",https://www.walmart.com/ip/Little-Star-Organic-Baby-Boys-Toddler-Boys-Valentine-s-Day-Snug-Fit-Cotton-Pajamas-4pc-PJ-Set-9M-5T/545739517
431,"Sleep On ItSleep On It Boys Jersey Pajama Pants Set, 2-Piece, Sizes 6-14",https://www.walmart.com/ip/Sleep-On-It-Boys-Jersey-Pajama-Pants-Set-2-Piece-Sizes-6-14/613614346
432,"Wonder NationWonder Nation Boys School Uniform Performance Shorts, Sizes 4-16",https://www.walmart.com/ip/Wonder-Nation-Boys-School-Uniform-Performance-Shorts-Sizes-4-16/570571774
433,"RussellRussell Boys Underwear, 4 Pack Freshforce Odor Protection Boxer Brief (Little Boys & Big Boys)",https://www.walmart.com/ip/Russell-Boys-Underwear-4-Pack-Freshforce-Odor-Protection-Boxer-Brief-Little-Boys-Big-Boys/997792158
434,"Little Star OrganicLittle Star Organic Baby Boys & Toddler Boys Mix 'n Match Outfits Star-Pack, 7pc Gift Bag Set (18M-5T)",https://www.walmart.com/ip/Little-Star-Organic-Baby-Boys-Toddler-Boys-Mix-n-Match-Outfits-Star-Pack-7pc-Gift-Bag-Set-18M-5T/737773587
435,"Mario KartMario Cart Boys Underwear, 6 Pack Boxer Briefs Sizes 4 - 10",https://www.walmart.com/ip/Mario-Cart-Boys-Underwear-6-Pack-Boxer-Briefs-Sizes-4-10/122050039
436,"SpongeBob SquarePantsSpongeBob Boys Pajama Set, 4-Piece, Sizes 4-10",https://www.walmart.com/ip/SpongeBob-Boys-Pajama-Set-4-Piece-Sizes-4-10/432477582
437,"HollywoodHollywood Boys Shark Hoodie Sweatshirt & Jogger Sweatpants, 2-Piece Outfit Set, Sizes 4-7",https://www.walmart.com/ip/Hollywood-Boys-Shark-Hoodie-Sweatshirt-Jogger-Sweatpants-2-Piece-Outfit-Set-Sizes-4-7/771867707
438,GildanGildan - MF Men - Heavy Blend Sweatpants,https://www.walmart.com/ip/Gildan-MF-Men-Heavy-Blend-Sweatpants/859180830
439,"US Polo Assn.U.S. Polo Assn. Boys Cotton Briefs, 5-Pack, Sizes 5-14",https://www.walmart.com/ip/U-S-Polo-Assn-Boys-Cotton-Briefs-5-Pack-Sizes-5-14/329269004
440,"Wonder NationWonder Nation Baby and Toddler Boys and Girls Triple Roll Black Socks, 12-Pack",https://www.walmart.com/ip/Wonder-Nation-Baby-and-Toddler-Boys-and-Girls-Triple-Roll-Black-Socks-12-Pack/260956076
441,IXtremeiXtreme Boys Mixed Fabric Colorblock Puffer Coat Sizes 4-18,https://www.walmart.com/ip/iXtreme-Boys-Mixed-Fabric-Colorblock-Puffer-Coat-Sizes-4-18/798172268
442,KidskornerKids Korner Boys Stretch Gloves 4-Pack Size: Toddler Ages 3-6 years,https://www.walmart.com/ip/Kids-Korner-Boys-Stretch-Gloves-4-Pack-Size-Toddler-Ages-3-6-years/521340411
443,"Real School UniformsReal School Husky Boys School Uniform Pull on Pant, Sizes 8-20",https://www.walmart.com/ip/Real-School-Husky-Boys-School-Uniform-Pull-on-Pant-Sizes-8-20/939924528
444,HanesHanes Boys' Exposed Waistband Tagless Briefs Underwear 5 Pack Sizes 10/12 -18/20,https://www.walmart.com/ip/Hanes-Boys-Exposed-Waistband-Tagless-Briefs-Underwear-5-Pack-Sizes-10-12-18-20/8224298
445,"Wonder NationWonder Nation Toddler Boys No Show Socks, 18-Pack",https://www.walmart.com/ip/Wonder-Nation-Toddler-Boys-No-Show-Socks-18-Pack/583515075
446,CherokeeCherokee Snowsuit/Ski Bib (Little Boys & Big Boys),https://www.walmart.com/ip/Cherokee-Snowsuit-Ski-Bib-Little-Boys-Big-Boys/155435134
447,MinecraftMinecraft Boys Exclusive 4-18 Creeper Face Baseball Long Sleeve T-Shirt,https://www.walmart.com/ip/Minecraft-Boys-Exclusive-4-18-Creeper-Face-Baseball-Long-Sleeve-T-Shirt/244624801
448,Sleep On ItSleep On It Baby Boys Convertible Footed One-Piece Sleeper Pajamas with Matching Blanket Buddy,https://www.walmart.com/ip/Sleep-On-It-Baby-Boys-Convertible-Footed-One-Piece-Sleeper-Pajamas-with-Matching-Blanket-Buddy/937257526
449,Child of Mine by Carter'sChild of Mine Boys Microfleece 2-Pack Pajama Blanket Sleeper Sizes 5-8,https://www.walmart.com/ip/Child-of-Mine-Boys-Microfleece-2-Pack-Pajama-Blanket-Sleeper-Sizes-5-8/318781571
450,"Ryan's WorldRyan's World, Boys Underwear, 6 Pack Boxer Brief Sizes 4/5 - 8",https://www.walmart.com/ip/Ryan-s-World-Boys-Underwear-6-Pack-Boxer-Brief-Sizes-4-5-8/683328448
451,DearfoamsDearfoams Boys Camo and Fleece Clog Slippers,https://www.walmart.com/ip/Dearfoams-Boys-Camo-and-Fleece-Clog-Slippers/898943065
452,BagilaanoeInfant Baby Boys Little Brother Long Sleeve Set Romper Pants Outfit Clothes 3PCS,https://www.walmart.com/ip/Infant-Baby-Boys-Little-Brother-Long-Sleeve-Set-Romper-Pants-Outfit-Clothes-3PCS/152926116
453,Awkward StylesAwkward Styles Christmas Pajamas for Family Xmas Gingerbread Man Matching Christmas Sleepwear Christmas Pajamas for Women Men Kids Baby,https://www.walmart.com/ip/Awkward-Styles-Christmas-Pajamas-for-Family-Xmas-Gingerbread-Man-Matching-Christmas-Sleepwear-Christmas-Pajamas-for-Women-Men-Kids-Baby/165894364
454,"PokmonPokemon Boys Digital & Full of Energy Pikachu Graphic T-Shirts 2-Pack, Sizes 4-18",https://www.walmart.com/ip/Pokemon-Boys-Digital-Full-of-Energy-Pikachu-Graphic-T-Shirts-2-Pack-Sizes-4-18/861711676
455,"BatmanSuper Mario Bros. Friends! Graphic Long Sleeve T-Shirt, Sizes 4-18",https://www.walmart.com/ip/Super-Mario-Bros-Friends-Graphic-Long-Sleeve-T-Shirt-Sizes-4-18/954785357
456,"RussellRussell Boys 4-18 & Husky Fresh Force Athletic Long Sleeve Recycled T-Shirts, 2-Pack",https://www.walmart.com/ip/Russell-Boys-4-18-Husky-Fresh-Force-Athletic-Long-Sleeve-Recycled-T-Shirts-2-Pack/972434466
457,LEGOLego Batman Boys Pajama Unionsuit Sizes 4-12,https://www.walmart.com/ip/Lego-Batman-Boys-Pajama-Unionsuit-Sizes-4-12/432836380
458,"Fruit of the LoomFruit of the Loom Boys Underwear, Breathable Lightweight Boxer Briefs, 10 Pack Sizes 6/8 - 18/20",https://www.walmart.com/ip/Fruit-of-the-Loom-Boys-Underwear-Breathable-Lightweight-Boxer-Briefs-10-Pack-Sizes-6-8-18-20/444459812
459,Fruit of the LoomFruit of the Loom - MF Men - HD Cotton Long Sleeve T-Shirt,https://www.walmart.com/ip/Fruit-of-the-Loom-MF-Men-HD-Cotton-Long-Sleeve-T-Shirt/748388440
460,LeveretLong Sleeve Boys Girls Kids & Toddler T-Shirt 100% Cotton (2-14 Years) Variety of Colors,https://www.walmart.com/ip/Long-Sleeve-Boys-Girls-Kids-Toddler-T-Shirt-100-Cotton-2-14-Years-Variety-of-Colors/526445437
461,"PJ MasksPJ Masks Toddler Boy Cotton Sleepwear Set, 2 Piece",https://www.walmart.com/ip/Pj-Mask-Toddler-Boys-Snug-Fit-Cotton-Long-Sleeve-Pajamas-2pc-Set-2T-5T/898023878
462,"SonicSonic the Hedgehog Boys Underwear, 6 Pack Boxer Briefs Sizes 4 - 10",https://www.walmart.com/ip/Sonic-the-Hedgehog-Boys-Underwear-6-Pack-Boxer-Briefs-Sizes-4-10/762147426
463,Child of Mine by Carter'sChild of Mine by Carter's Baby Toddler Boy Colorblock Winter Jacket Coat,https://www.walmart.com/ip/Child-of-Mine-by-Carter-s-Baby-Toddler-Boy-Colorblock-Winter-Jacket-Coat/705925766
464,"SimpliKidsBoys Snow Sports Thinsulate Insulation Waterproof Winter Ski Mittens Gloves,S,Red",https://www.walmart.com/ip/Boys-Snow-Sports-Thinsulate-Insulation-Waterproof-Winter-Ski-Mittens-Gloves-S-Red/219787207
465,"HanesHanes Boys Socks, 10 + 1 Bonus Pack Crew (Medium)",https://www.walmart.com/ip/Hanes-Boys-Socks-10-1-Bonus-Pack-Crew-Medium/27678768
466,Sesame StreetSesame Street Baby Boys & Toddler Boys Cookie Monster Snug Fit Cotton 1-Piece Footless Pajamas (9M-5T),https://www.walmart.com/ip/Sesame-Street-Baby-Boys-Toddler-Boys-Cookie-Monster-Snug-Fit-Cotton-1-Piece-Footless-Pajamas-9M-5T/729112206
467,"Wonder NationWonder Nation Boys Denim Jacket, Sizes 4-18",https://www.walmart.com/ip/Wonder-Nation-Boys-Denim-Jacket-Sizes-4-18/314227589
468,"HindHind Boys Compression Pants and Shorts, 2-Pack Active Bottoms, Sizes 4-18",https://www.walmart.com/ip/Hind-Boys-Compression-Pants-and-Shorts-2-Pack-Active-Bottoms-Sizes-4-18/822088590
469,"IXtremeiXtreme Boys Colorblocked Vest with Hood & Sleeves, Sizes 4-18",https://www.walmart.com/ip/iXtreme-Boys-Colorblocked-Vest-with-Hood-Sleeves-Sizes-4-18/772724894
470,Wonder NationWonder Nation Boys 4-18 Denim Trucker Jacket,https://www.walmart.com/ip/Wonder-Nation-Boys-Denim-Trucker-Jacket-Sizes-4-18/378762859
471,"Wonder NationWonder Nation Boys Slim Knit Denim Jeans, Sizes 4-18 & Husky",https://www.walmart.com/ip/Wonder-Nation-Boys-Slim-Knit-Denim-Jeans-Sizes-4-18-Husky/475306026
472,RobloxRoblox Boys Checkered Fighters & Color Grid Graphic T-Shirts Sizes 4-18,https://www.walmart.com/ip/Roblox-Boys-Checkered-Fighters-Color-Grid-Graphic-T-Shirts-Sizes-4-18/314752696
473,"MinecraftMinecraft Boys Long Sleeve Top & Long Pants Pajama Set , 2-Piece, Sizes 6-12",https://www.walmart.com/ip/Minecraft-Boys-Long-Sleeve-Top-Long-Pants-Pajama-Set-2-Piece-Sizes-6-12/767744229
474,"Wonder NationWonder Nation Boys Underwear, 5 Pack Red Boxer Brief (Little Boys & Big Boys)",https://www.walmart.com/ip/Wonder-Nation-Boys-Underwear-5-Pack-Red-Boxer-Brief-Little-Boys-Big-Boys/487929291
475,"PokmonPokemon Boys Front & Back Pikachu Graphic T-Shirt, Sizes 4-18",https://www.walmart.com/ip/Pokemon-Boys-Front-Back-Pikachu-Graphic-T-Shirt-Sizes-4-18/792335368
476,Ma&BabyNewborn Baby Boy Kid Cotton Romper+Hat Jumpsuit Clothes Long Pants Outfits Set,https://www.walmart.com/ip/Newborn-Baby-Boy-Kid-Cotton-Romper-Hat-Jumpsuit-Clothes-Long-Pants-Outfits-Set/569929805
477,"Justice LeagueJustice League Toddler Boys Underwear Briefs, 7 Pack",https://www.walmart.com/ip/Justice-League-Toddler-Boys-Underwear-Briefs-7-Pack/206787771
478,"The Children's PlaceThe Children's Place Boys 4-16 Joggers, 2-Pack",https://www.walmart.com/ip/The-Children-s-Place-Boys-4-16-Joggers-2-Pack/421899722
479,"Layer 8Layer 8 Boys Qwick-Dry Performance Pants, 2-Pack, Sizes 4-18 & Husky",https://www.walmart.com/ip/Layer-8-Boys-Qwick-Dry-Performance-Pants-2-Pack-Sizes-4-18-Husky/743030814
480,Jellifish KidsJellifish Kids Boys 2-Piece Pajama Set Sizes 4-16,https://www.walmart.com/ip/Jellifish-Kids-Boys-2-Piece-Pajama-Set-Sizes-4-16/448107994
481,Ma&BabySuper Mario Baby Kids Boys Leisure Clothes Sets Nightwear Sleepwear Pyjamas,https://www.walmart.com/ip/Super-Mario-Baby-Kids-Boys-Leisure-Clothes-Sets-Nightwear-Sleepwear-Pyjamas/212281914
482,Rokka & RollaRokka&Rolla Boys' Reversible Hooded Lightweight Water-Resistant Padded Puffer Jacket sizes 4-18,https://www.walmart.com/ip/Rokka-Rolla-Boys-Reversible-Hooded-Lightweight-Water-Resistant-Padded-Puffer-Jacket-sizes-4-18/910042643
483,Seven OaksSeven Oaks Boys Colorblock Long Sleeve T Shirts 3 Pack Sizes 8-18,https://www.walmart.com/ip/Seven-Oaks-Boys-Colorblock-Long-Sleeve-T-Shirts-3-Pack-Sizes-8-18/524610088
484,"ChampionChampion Boys Socks, 6 Pack Camo Ankle Socks, Sizes M-L",https://www.walmart.com/ip/Champion-Boys-Socks-6-Pack-Camo-Ankle-Socks-Sizes-M-L/271194274
485,"NintendoNintendo Boys Super Mario Pajama Robe, Sizes 4-12",https://www.walmart.com/ip/Nintendo-Boys-Super-Mario-Pajama-Robe-Sizes-4-12/866211403
486,"Star WarsStar Wars Boys Baby Yoda Snack Attack Graphic T-Shirt, Sizes 4-18",https://www.walmart.com/ip/Star-Wars-Boys-Baby-Yoda-Snack-Attack-Graphic-T-Shirt-Sizes-4-18/232581239
487,IXtremeiXtreme Baby Toddler Boy Solid Winter Jacket Coat,https://www.walmart.com/ip/iXtreme-Baby-Toddler-Boy-Solid-Winter-Jacket-Coat/193530146
488,Dr. Seuss' The GrinchThe Grinch Boys' Dr. Seuss The Grinch and Max Pajamas,https://www.walmart.com/ip/The-Grinch-Boys-Dr-Seuss-The-Grinch-and-Max-Pajamas/816227774
489,"Footed PajamasFooted Pajamas - Family Matching Transportion Onesies for Boys, Girls, Men, Women and Pets - Infant - Small (Fits 0 - 3mos.)",https://www.walmart.com/ip/Footed-Pajamas-Family-Matching-Transportion-Onesies-for-Boys-Girls-Men-Women-and-Pets-Infant-Small-Fits-0-3mos/825002635
490,IXtremeiXtreme Toddler Boy One-Piece Snowsuit,https://www.walmart.com/ip/iXtreme-Toddler-Boy-One-Piece-Snowsuit/306791130
491,"NintendoNintendo Boys Super Mario Long Sleeve Top and Pants, 2-Piece Pajama Set Sizes 4-12",https://www.walmart.com/ip/Nintendo-Boys-Super-Mario-Long-Sleeve-Top-and-Pants-2-Piece-Pajama-Set-Sizes-4-12/215228728
492,"The AvengersThe Avengers, Boys Underwear, 4 Pack Athletic Boxer Briefs (Little Boys & Big Boys)",https://www.walmart.com/ip/The-Avengers-Boys-Underwear-4-Pack-Athletic-Boxer-Briefs-Little-Boys-Big-Boys/618278206
493,PeanutsPeanuts Boys' Button Up Front 2-piece Christmas Pajama Set (Little Boys & Big Boys),https://www.walmart.com/ip/Peanuts-Boys-Button-Up-Front-2-piece-Christmas-Pajama-Set-Little-Boys-Big-Boys/353730691
494,GocustomHalloween Matching Christmas ELF Elves Cute T-Shirts Incredible Family MOM DAD KIDS GoCustom,https://www.walmart.com/ip/Halloween-Matching-Christmas-ELF-Elves-Cute-T-Shirts-Incredible-Family-MOM-DAD-KIDS-GoCustom/550764572
495,RussellRussell Active Boys No Show Socks 6 Pack Socks,https://www.walmart.com/ip/Russell-Active-Boys-No-Show-Socks-6-Pack-Socks/976528670
496,"Hudson BabyToddler Boy Athletic Pants, 3-Pack",https://www.walmart.com/ip/Toddler-Boy-Athletic-Pants-3-Pack/55526755
497,"NickelodeonKids Umbrella and Slicker Set, Paw Patrol Rainwear Set (Toddler and Little Boys)",https://www.walmart.com/ip/Kids-Umbrella-and-Slicker-Set-Paw-Patrol-Rainwear-Set-for-Little-Boys-Ages-4-5/728869024
498,"Wonder NationWonder Nation Baby and Toddler Boys and Girls Triple Roll White Socks, 12-Pack",https://www.walmart.com/ip/Wonder-Nation-Baby-and-Toddler-Boys-and-Girls-Triple-Roll-White-Socks-12-Pack/656835658
499,"Fruit of the LoomFruit of The Loom Toddler Boys Breathable Cool Zone Ankle Socks, 18-Pack",https://www.walmart.com/ip/Fruit-of-The-Loom-Toddler-Boys-Breathable-Cool-Zone-Ankle-Socks-18-Pack/431082085
500,MultitrustFamily Christmas Pajamas Set Xmas Pjs Matching Pyjamas Adult Kids Xmas Sleepwear,https://www.walmart.com/ip/Family-Christmas-Pajamas-Set-Xmas-Pjs-Matching-Pyjamas-Adult-Kids-Xmas-Sleepwear/800532296
501,"HanesHanes Boys Socks, 6 Pack Ankle X-Temp (Big Boys)",https://www.walmart.com/ip/Hanes-Boys-Socks-6-Pack-Ankle-X-Temp-Big-Boys/641788321
502,"HanesHanes Men's and Big Men's ComfortWash Long Sleeve Tee, Up To Size 3XL",https://www.walmart.com/ip/Hanes-Men-s-and-Big-Men-s-ComfortWash-Long-Sleeve-Tee-Up-To-Size-3XL/471094453
503,"The AvengersAvengers Boys Short Sleeve Top, Long Pants & Shorts, 3-Piece Pajama Set Sizes 4-10",https://www.walmart.com/ip/Avengers-Boys-Short-Sleeve-Top-Long-Pants-Shorts-3-Piece-Pajama-Set-Sizes-4-10/441365688
504,"RussellRussell Boys Socks, 3 Pack Crew Printed Athletic (Little Boys & Big Boys)",https://www.walmart.com/ip/Russell-Boys-Socks-3-Pack-Crew-Printed-Athletic-Little-Boys-Big-Boys/171737622
505,"HanesHanes Boys Socks, 12 Pack No Show Cushion Sizes S - L",https://www.walmart.com/ip/Hanes-Boys-Socks-12-Pack-No-Show-Cushion-Sizes-S-L/50270425
506,Fruit of the LoomFruit of the Loom Boys 4-18 Fleece Full Zip Sleeveless Vest,https://www.walmart.com/ip/Fruit-of-the-Loom-Boys-4-18-Fleece-Full-Zip-Sleeveless-Vest/885124654
507,BatmanBatman Boys Thermal Set,https://www.walmart.com/ip/Batman-Boys-Thermal-Long-Underwear-2-Piece-Set-Sizes-S-L/654481124
508,"360Air360air Kid's Unisex Thermal Underwear Heat Jersey Top and Bottom Thermal Set, 2-Piece",https://www.walmart.com/ip/360air-Kid-s-Unisex-Thermal-Underwear-Heat-Jersey-Top-and-Bottom-Thermal-Set-2-Piece/791310165
509,"Ryan's WorldRyan's World Boys Long Sleeve Long Pant, 2-Piece Pajama Set Sizes 4-12",https://www.walmart.com/ip/Ryan-s-World-Boys-Long-Sleeve-Long-Pant-2-Piece-Pajama-Set-Sizes-4-12/259436206
510,Wonder NationWonder Nation Boys 4-18 Corduroy Trucker Jacket,https://www.walmart.com/ip/Wonder-Nation-Boys-Corduroy-Trucker-Jacket-Sizes-4-18/914421974
511,"Star WarsToddler Boys 7-Pack Character Underwear - Choose from Star Wars, Cars, Minions, and more!",https://www.walmart.com/co/Toddler-Boys-7-Pack-Character-Underwear-Choose-from-Star-Wars-Cars-Minions-and-more/47839245
512,Bad PiggiesBadPiggies Matching Family Christmas Pajamas Set Striped Sleepwear Long Sleeve Loungewear Holiday Xmas PJs For Dad Mom Kids,https://www.walmart.com/ip/BadPiggies-Matching-Family-Christmas-Pajamas-Set-Striped-Sleepwear-Long-Sleeve-Loungewear-Holiday-Xmas-PJs-For-Dad-Mom-Kids/991049328
513,FortniteFortnite Boys Tonal DJ Yonder Graphic T-Shirt Sizes 8-18,https://www.walmart.com/ip/Fortnite-Boys-Tonal-DJ-Yonder-Graphic-T-Shirt-Sizes-8-18/562226502
514,Meihuida2pcs Toddler Kids Boys Batman Long Sleeve Cotton Nightwear Pajamas Set Sleepwear 2-8Y,https://www.walmart.com/ip/2pcs-Toddler-Kids-Boys-Batman-Long-Sleeve-Cotton-Nightwear-Pajamas-Set-Sleepwear-2-8Y/722517865
515,BagilaanoeBaby Boys Girls Solid Color 3D Ears Hooded Jacket Winter Warm Coat Zip Snowsuits,https://www.walmart.com/ip/Baby-Boys-Girls-Solid-Color-3D-Ears-Hooded-Jacket-Winter-Warm-Coat-Zip-Snowsuits/792311936
516,"Fruit of the LoomFruit of the Loom Boys Underwear, Assorted Wardrobe Briefs, 14 Pack Sizes 4 - 18/20",https://www.walmart.com/ip/Fruit-of-the-Loom-Boys-Underwear-Assorted-Wardrobe-Briefs-14-Pack-Sizes-4-18-20/404941005
517,"Plains Western WearPlains Boys Long Sleeve Flannel Snap Button-Down Shirt, Sizes 4-16",https://www.walmart.com/ip/Plains-Boys-Long-Sleeve-Flannel-Snap-Button-Down-Shirt-Sizes-4-16/363162101
518,Seven OaksSeven Oaks Boys Popover Jersey Hoodie Sizes 8-18,https://www.walmart.com/ip/Seven-Oaks-Boys-Popover-Jersey-Hoodie-Sizes-8-18/246002608
519,"Jurassic WorldJurassic Park Little Boy Boxer Briefs, 5 Pack",https://www.walmart.com/ip/Jurassic-World-Boys-Underwear-5-Pack-Boxer-Briefs-Sizes-4-8/559371480
520,"Fruit of the LoomFruit of the Loom Assorted Fashion Briefs, 10 Pack Sizes 6/8 - 18/20",https://www.walmart.com/ip/Fruit-of-the-Loom-Assorted-Fashion-Briefs-10-Pack-Sizes-6-8-18-20/457310806
521,"Dragon Ball ZDragon Ball Z Boys Goku Squad & Just Saiyan Graphic T-Shirts 2-Pack, Sizes 4-18",https://www.walmart.com/ip/Dragon-Ball-Z-Boys-Goku-Squad-Just-Saiyan-Graphic-T-Shirts-2-Pack-Sizes-4-18/907221289
522,"Sonic the HedgehogSonic the Hedgehog Boys Underwear, 10 Pack Boxer Briefs Sizes 4 - 8",https://www.walmart.com/ip/Sonic-the-Hedgehog-Boys-Underwear-10-Pack-Boxer-Briefs-Sizes-4-8/377694436
523,HanesHanes Boys School Uniform 4-18 EcoSmart Jersey Polo Shirt,https://www.walmart.com/ip/Hanes-Boys-School-Uniform-4-18-EcoSmart-Jersey-Polo-Shirt/25507530
